2011,423003,42230,4811,322002,Ayudas a centros concertados para inmigración y minorías culturales,"413.000,00","401.994,42"
2011,423003,42230,4819,322000,Subvención para actividades de integración socioeducativa,"31.300,00","26.770,77"
2011,423003,42230,4819,322002,(**) Escuela Taller Kamira,"45.000,00","40.711,12"
2011,425000,42300,1200,321200,Retribuciones del personal fijo,"47.920,28","47.920,28"
2011,425000,42300,6090,321200,Módulo SAP Formación,"125.000,00","124.855,84"
2011,425000,42310,1200,321200,Retribuciones del personal fijo,"100.180,81","100.180,81"
2011,425000,42310,2212,321200,Gastos de funcionamiento de centros de apoyo al profesorado,"127.000,00","127.000,00"
2011,425000,42310,2266,321200,Actividades formativas del profesorado,"375.000,00","304.995,64"
2011,425000,42310,6059,321200,Adquisición de material para actividades formativas,"6.010,00","5.999,99"
2011,425001,42340,1200,322A00,Retribuciones del personal fijo,"510.333,71","510.333,71"
2011,425001,42340,1211,322A00,Retribuciones del personal contratado para cubrir vacantes,"62.568,28","62.568,28"
2011,425001,42340,2160,322A00,"Funcionamiento, mantenimiento y conservación de equipamiento informático y audiovisual","120.942,12","110.324,12"
2011,425001,42340,2224,322A00,Sistemas de comunicaciones de datos,"640.000,00","624.916,35"
2011,425001,42340,2266,321200,Formación a distancia del profesorado,"200.000,00","187.096,46"
2011,425001,42340,2269,322A00,Funcionamiento de proyectos de nuevas tecnologías,"52.100,00","47.912,77"
2011,425001,42340,2273,322A00,Servicios informáticos en la red de centros,"84.018,88","83.509,02"
2011,425001,42340,2279,322A00,Proyecto Integra TIC,"59.604,00","54.072,12"
2011,425001,42340,6060,322A00,Inversiones en programas de nuevas tecnologías y materiales de formación,"59.000,00","56.999,30"
2011,425001,42340,6060,322A02,Equipamiento y servicios centrales del programa de nuevas tecnologías y educación,"70.000,00","69.837,49"
2011,425001,42340,6060,322A03,Desarrollo de aplicaciones para centros,"446.000,00","445.977,93"
2011,425001,42340,6060,322A04,Desarrollo de la Sociedad de la Información en centros educativos,"341.212,00","320.250,59"
2011,425004,42350,1200,321100,Retribuciones del personal fijo,"307.282,77","307.282,77"
2011,425004,42350,1211,321100,Retribuciones del personal contratado para cubrir vacantes,"0,00",
2011,425004,42350,2269,321100,Calidad,"17.283,20","16.082,40"
2011,425004,42350,2269,321102,Igualdad,"12.000,00","5.215,00"
2011,425004,42350,2269,321200,Programas de innovación educativa,"34.900,00","25.269,28"
2011,425004,42350,2269,321202,Programas de convivencia y educación en valores,"24.716,80","9.379,75"
2011,425004,42350,2269,322200,Organización de las Olimpiadas Matemáticas 2011,"12.000,00","12.000,00"
2011,425004,42350,2269,322202,Rutas científicas,"45.000,00","44.035,20"
2011,425004,42350,2269,322203,(**) Rutas literarias,"45.000,00","44.973,07"
2011,425004,42350,2269,322D00,Ayudas a escuelas viajeras,"80.000,00","79.673,10"
2011,425004,42350,2276,322200,Catalogación IES Histórico Plaza de la Cruz,"15.000,00","10.974,00"
2011,425004,42350,2279,322D00,Itinerarios culturales por Navarra,"120.750,00","120.700,00"
2011,425004,42350,2400,321200,"Publicaciones, estudios y experiencias educativas","23.000,00","14.232,75"
2011,425004,42350,4819,321200,Proyectos de innovación educativa,"2.601,00","2.600,00"
2011,430000,43000,1000,322300,Retribuciones de altos cargos,"55.303,00","30.475,92"
2011,430000,43000,1200,322300,Retribuciones del personal fijo,"100.838,66","100.838,66"
2011,430000,43000,2200,322300,Material de oficina,"10.958,58","10.949,24"
2011,430000,43000,2202,322300,Suscripciones y libros,"2.064,00","1.415,38"
2011,430000,43000,2262,322300,Publicidad y propaganda de convocatorias y programas,"8.951,88","2.951,88"
2011,430000,43000,2266,322300,"Congresos, conferencias y cursos","2.700,00",
2011,430000,43000,2269,322300,Gastos diversos,"28.500,00","5.898,10"
2011,430000,43000,2269,322302,Organización cursos de verano,"22.807,52","18.269,26"
2011,430000,43000,2300,322300,Dietas,"2.057,12","1.910,96"
2011,430000,43000,2301,322300,Locomoción y gastos de viaje,"25.612,90","24.621,18"
2011,430000,43000,4819,322302,Cursos de verano de las universidades navarras y de otras entidades navarras,"120.000,00","120.000,00"
2011,430000,43000,6050,322300,Mobiliario de oficina,"10,00",
2011,430000,43000,6060,322300,Equipos informáticos,"2.850,00",
2011,430001,43010,2266,322500,Promoción de enseñanzas artísticas y musicales,"10.000,00","6.661,27"
2011,430001,43010,4609,322502,Subvención a escuelas de música,"2.250.000,00","2.199.999,51"
2011,430001,43010,4609,322503,Convenio con el Ayuntamiento de Tudela para el funcionamiento del Conservatorio Municipal de Música,"223.000,00","206.381,56"
2011,430001,43010,4809,322500,Ayudas para el perfeccionamiento de profesores y alumnos de música,"6.000,00","1.800,00"
2011,430001,43010,4816,322500,Escuela Navarra de Teatro,"50.000,00","50.000,00"
2011,431000,43100,1200,322300,Retribuciones del personal fijo,"343.790,43","343.790,43"
2011,431000,43100,1210,322300,Retribuciones del personal contratado para cubrir plazas reservadas,"23.340,99","23.340,99"
2011,431000,43100,1211,322300,Retribuciones del personal contratado para cubrir vacantes,"22.431,42","22.431,42"
2011,431000,43100,2212,322300,"Gastos de la Red de Bases de Datos de Información Educativa, REDINED","10.000,00","10.000,00"
2011,431000,43100,2269,322300,Convenio con FECYT - EURAXESS (Red Europea de Centros de Movilidad). Plan de Actividades,"10,00",
2011,431000,43100,2269,322302,Gastos de evaluación científico-técnica de programas y proyectos,"21.000,00","9.737,89"
2011,431000,43100,4455,322300,(**) Financiación de la UPNA: Campus de Pamplona y Tudela,"60.883.287,00","56.982.858,81"
2011,431000,43100,4455,322302,Convenio con la UPNA para el Espacio Europeo de Educación Superior,"82.122,23","82.122,23"
2011,431000,43100,4800,322300,Intercambios con universidades extranjeras: Erasmus y otros,"321.676,00","30.568,81"
2011,431000,43100,4800,322302,Intercambios con universidades españolas: Séneca,"10.000,00","340,00"
2011,431000,43100,4800,322303,Transporte escolar a centros de enseñanza superior de Navarra,"110.100,00","52.614,21"
2011,431000,43100,4812,322300,UNED: Centros de Pamplona y Tudela,"2.250.000,00","2.055.543,50"
2011,431000,43100,4812,322302,Programa I3. Convenio con el Ministerio de Ciencia e Innovación,"10,00",
2011,431000,43100,4812,322303,"Convenio con la Universidad de Navarra ""Cátedra de Patrimonio y Arte Navarro""","100.000,00","75.000,00"
2011,431000,43100,4812,322304,Ayudas al Plan de formación y de investigación y desarrollo (I+D),"2.592.166,62","1.471.110,74"
2011,431000,43100,4812,322305,(**) Cátedra de Calidad de la UNED en Tudela,"75.010,00","75.010,00"
2011,431000,43100,4812,322306,Convenio con la Universidad de Navarra para el Espacio Europeo de Educación Superior,"82.325,55","82.315,55"
2011,431000,43100,4812,322307,Universidad de Navarra Campus de Excelencia,"100.000,00","100.000,00"
2011,431000,43100,4812,322308,Universidad de Navarra Campus de Excelencia. Convenio con el Ministerio,"10,00",
2011,431000,43100,6001,325100,Expropiaciones para la Universidad Pública de Navarra,"10,00",
2011,431000,43100,7455,322300,Financiación de la UPNA: Transferencias de capital. Campus de Pamplona,"100.000,00",
2011,431000,43100,7455,322302,Financiación de la UPNA: Transferencias de capital. Campus de Tudela,"100.000,00","100.000,00"
2011,431000,43100,7812,322300,Universidad de Navarra Campus de Excelencia. Convenio con el Ministerio,"10,00",
2011,431000,43100,7812,322302,(**) Universidad de Navarra. Nuevos centros de investigación y tecnología,"1.100.000,00","650.000,00"
2011,431000,43100,8219,322300,Préstamo a la Universidad Pública de Navarra: Campus de Excelencia. Convenio con Ministerio de Educa,"850.000,00","850.000,00"
2011,433000,43300,1200,322E00,Retribuciones del personal fijo,"841.948,46","841.948,46"
2011,433000,43300,1210,322E00,Retribuciones del personal contratado para cubrir plazas reservadas,"39.032,28","39.032,28"
2011,433000,43300,2266,321200,Perfeccionamiento y actualización del profesorado de formación profesional,"160.917,40","107.824,47"
2011,433000,43300,2269,322E00,Desarrollo e innovación de la Formación Profesional,"209.667,97","168.610,91"
2011,433000,43300,2269,322E02,Funcionamiento del Programa Leonardo Da Vinci y otros programas internacionales,"110.000,00","34.704,26"
2011,433000,43300,2269,322E03,Gastos de funcionamiento del Consejo Navarro de Formación Profesional,"3.000,00",
2011,433000,43300,4800,322E00,Programa Leonardo Da Vinci y otros programas internacionales,"550.000,00","547.310,77"
2011,433000,43300,4800,322E03,Premios y ayudas para formación profesional,"20.000,00","9.000,00"
2011,433000,43300,6059,325100,Equipamiento en centros públicos de formación profesional,"700.000,00","557.954,54"
2011,433001,43300,2212,242100,Gastos de funcionamiento de los cursos de formación profesional,"75.960,00","47.097,68"
2011,433001,43300,2212,242102,Gastos de funcionamiento. PCPIs ubicados fuera de los centros de FP. Programa Operativo FSE 2007-201,"264.934,00","264.934,00"
2011,433001,43300,2269,322E00,Desarrollo del Acuerdo de Gobierno para la formación profesional,"70.000,00","47.152,31"
2011,433001,43300,2269,322E02,Desarrollo de centros integrados y de referencia de formación profesional,"70.000,00","64.319,20"
2011,433001,43300,2269,322E03,Procedimiento de acreditación de la competencia profesional de iniciativa estatal,"269.681,06","250.000,00"
2011,433001,43300,2276,322E00,Diseño de títulos y cualificaciones,"65.000,00","64.212,23"
2011,433001,43300,6059,242100,Equipamiento de PCPIs. Programa Operativo FSE 2007-2013 de Navarra,"25.000,00","24.888,14"
2011,440000,44000,1000,334100,Retribuciones de altos cargos,"55.303,00","55.302,66"
2011,440000,44000,1200,334100,Retribuciones del personal fijo,"39.901,82","39.901,82"
2011,440000,44000,1210,334100,Retribuciones del personal contratado para cubrir plazas reservadas,"13.514,09","13.514,09"
2011,440000,44000,1211,334100,Retribuciones del personal contratado para cubrir vacantes,"47.556,94","47.556,94"
2011,440000,44000,1220,334100,Retribuciones del personal contratado temporal,"3.878,50","3.878,50"
2011,440000,44000,1250,334100,Retribuciones del personal contratado para sustituciones,"22.271,53","8.378,19"
2011,440000,44000,1400,334100,Retribuciones personales,"159.562,88","159.186,34"
2011,440000,44000,1600,334100,Seguridad social,"279.878,35","209.792,48"
2011,440000,44000,1705,334100,Complemento por trabajo en turnos de noche,"10.000,00","2.309,89"
2011,440000,44000,1810,334100,Retribuciones de personal de ejercicios anteriores,"1,00",
2011,440000,44000,2120,334100,"Mantenimiento, reparaciones y acondicionamiento","32.892,00","10.478,22"
2011,440000,44000,2200,334100,Material de oficina,"5.000,00","3.812,63"
2011,440000,44000,2202,334100,Suscripciones y libros,"4.751,78","4.437,37"
2011,440000,44000,2220,334100,Comunicaciones postales,"6.300,00","3.845,88"
2011,440000,44000,2266,334100,Organización de congresos y jornadas,"3.000,00","1.443,50"
2011,440000,44000,2269,334100,Participación en exposiciones,"1.000,00","619,50"
2011,440000,44000,2269,334102,Gastos diversos,"12.562,00","3.751,46"
2011,440000,44000,2269,334104,Consejo Navarro del Euskera,"5.000,00","4.538,00"
2011,440000,44000,2300,334100,Dietas,"2.500,00","1.119,72"
2011,440000,44000,2301,334100,Locomoción y gastos de viaje,"13.000,00","8.852,08"
2011,440000,44000,4816,334100,Acuerdo con Euskaltzaindia,"149.000,00","149.000,00"
2011,440000,44000,6020,334100,Obras de adecuación de locales,"2.000,00",
2011,440000,44000,6050,334100,Mobiliario y equipo de oficina,"5.000,00",
2011,440000,44000,6060,334100,Equipos informáticos,"10.000,00","1.051,10"
2011,440001,44100,1200,334100,Retribuciones del personal fijo,"129.590,79","129.590,09"
2011,440001,44100,1210,334100,Retribuciones del personal contratado para cubrir plazas reservadas,"7.667,06","7.667,06"
2011,440001,44100,1211,334100,Retribuciones del personal contratado para cubrir vacantes,"6.845,02","6.845,02"
2011,440001,44100,2061,334100,Mantenimiento de licencias para la biblioteca especializada,"348,22","348,22"
2011,440001,44100,2262,334102,Campañas de la lengua vasca,"112.200,00","10.921,23"
2011,440001,44100,2266,334100,Gastos de formación de adultos,"24.675,17","24.662,80"
2011,440001,44100,2266,334102,Relaciones con grupos de vascoparlantes de fuera de Navarra,"0,00",
2011,440001,44100,2269,324100,Programa europeo Culturas y Lenguas en el Camino de Santiago,"0,00",
2011,440001,44100,2269,334100,Programa europeo Culturas y Lenguas en el Camino de Santiago,"60.000,00","51.674,13"
2011,440001,44100,2400,334100,Publicaciones sociolingüísticas y educativas,"4.000,00","4.000,00"
2011,440001,44100,4609,334100,Programa de ayudas sobre el euskera a ayuntamientos y concejos de Navarra,"163.601,00","113.601,00"
2011,440001,44100,4819,322900,Subvención a Gau-Eskolak,"394.381,00","327.524,07"
2011,440001,44100,4819,334100,Programas sobre el euskera en medios de comunicación social,"215.000,00","208.403,08"
2011,440001,44100,4819,334102,Promoción de iniciativas culturales en euskera,"35.000,00","32.578,07"
2011,440001,44100,4819,334103,Promoción del euskera en las tecnologías de la información y la comunicación,"0,00",
2011,440001,44100,6081,334102,Adquisición de fondos editoriales y audiovisuales,"2.000,00","1.282,47"
2011,440001,44100,6092,334100,Toponimia de Navarra,"5.268,00","4.995,45"
2011,440002,44200,1200,334100,Retribuciones del personal fijo,"708.492,11","706.987,64"
2011,440002,44200,1210,334100,Retribuciones del personal contratado para cubrir plazas reservadas,"7.108,67","7.056,76"
2011,440002,44200,1211,334100,Retribuciones del personal contratado para cubrir vacantes,"30.501,66","30.501,30"
2011,440002,44200,2269,334102,Programas de asesoramiento a las administraciones locales y a la Administración del Estado radicada,"0,00",
2011,440002,44200,2276,334100,"Programa de análisis, estudio y evaluación de política lingüística","20.000,00","20.000,00"
2011,440002,44200,2276,334102,Realización de estudios y proyectos sociolingüísticos,"21.000,00","17.301,60"
2011,440002,44200,2276,334103,Contratación de traducciones,"4.900,00","186,54"
2011,440002,44200,2276,334104,Terminología y lingüística,"8.000,00",
2011,440002,44200,4812,334100,Programa de ayudas a la investigación y formación lingüística,"8.000,00","2.665,00"
2011,440002,44200,6081,334100,Mediateca del Euskera: Fonoteca y Biblioteca del euskera,"16.000,00","15.000,00"
2011,800000,80000,1000,421100,Retribuciones de altos cargos,"33.477,88","32.618,61"
2011,800000,80000,1100,421100,Retribuciones del personal eventual,"55.182,47","55.181,77"
2011,800000,80000,2261,421100,Gastos diversos del Sr. Consejero,"12.521,00","1.626,09"
2011,800000,80000,2301,421100,Gastos de viaje del Sr. Consejero,"9.390,00","929,49"
2011,800000,80100,1200,421100,Retribuciones del personal fijo,"442.490,38","442.489,66"
2011,800000,80100,1210,421100,Retribuciones del personal contratado para cubrir plazas reservadas,"31.536,69","31.535,68"
2011,800000,80100,1211,421100,Retribuciones del personal contratado para cubrir vacantes,"41.281,68","41.281,20"
2011,800000,80100,1220,421100,Retribuciones del personal contratado temporal,"87.977,23","87.977,23"
2011,800000,80100,1250,421100,Retribuciones del personal contratado para sustituciones,"6.925,06","6.925,06"
2011,800000,80100,1400,421100,Retribuciones personales,"484.968,07","484.968,07"
2011,800000,80100,1600,421100,Seguridad social,"575.220,61","575.220,61"
2011,800000,80100,1702,421100,Horas extraordinarias,"0,00",
2011,800000,80100,2200,421100,Material de oficina,"12.795,00","6.269,21"
2011,800000,80100,2202,421100,"Suscripciones, libros y publicaciones","11.145,00","3.066,65"
2011,800000,80100,2212,421100,Gastos de funcionamiento del edificio,"263.000,00","209.426,40"
2011,800000,80100,2266,421100,Formación del personal (cursillos y otros),"5.890,00","3.630,00"
2011,800000,80100,2269,421100,Otros gastos diversos,"33.250,00","13.175,96"
2011,800000,80100,2273,421100,Servicios informáticos,"147.715,00","144.816,87"
2011,800000,80100,2276,421100,Asistencia técnica,"902.561,00","863.314,56"
2011,800000,80100,2300,421100,Dietas,"285,00",
2011,800000,80100,2301,421100,Locomoción y gastos de viaje,"5.800,00","707,28"
2011,800000,80100,3509,421100,Otros gastos financieros,"21,00",
2011,800000,80100,4459,421100,(**) Convenio con la Cámara de Comercio para la Ventanilla Única,"110.000,00","110.000,00"
2011,800000,80100,4800,421100,Transferencias para prácticas de alumnos universitarios y formación profesional,"53.568,00","43.708,76"
2011,800000,80100,4809,421100,Responsabilidad civil,"3.157,00","1.734,44"
2011,800000,80100,6059,421100,Otro mobiliario y equipos,"15.427,00","9.116,96"
2011,800000,81000,1000,421100,Retribuciones de altos cargos,"55.303,00","55.302,66"
2011,800000,81000,1200,421100,Retribuciones del personal fijo,"115.440,45","115.440,35"
2011,800000,81000,1210,421100,Retribuciones del personal contratado para cubrir plazas reservadas,"19.516,46","19.516,14"
2011,800000,81000,1211,421100,Retribuciones del personal contratado para cubrir vacantes,"1,00",
2011,800000,81000,2261,421100,Gastos de representación,"9.500,00","1.604,93"
2011,800000,81000,2300,421100,Dietas,"1.140,00","239,94"
2011,800000,81000,2301,421100,Locomoción y gastos de viaje,"9.550,00","8.168,63"
2011,800000,81000,4400,421100,Transferencia CEIN convenio gestión ayudas,"0,00",
2011,800001,80100,6060,421100,Inversiones de gestión (equipos informáticos y otros),"15.000,00","5.561,03"
2011,800001,80100,6090,421100,Proyectos de modernización,"454.399,00","359.214,80"
2011,810001,81140,2269,458100,Otros gastos de funcionamiento,"9.800,00","7.490,74"
2011,810001,81140,2276,458100,Asistencia técnica de obras de infraestructura,"3.200,00","563,75"
2011,810001,81140,2300,458100,Dietas,"500,00","134,07"
2011,810001,81140,2301,458100,Locomoción y gastos de viaje,"3.500,00","3.285,51"
2011,810001,81140,4609,458100,Gestión de polígonos industriales,"15.000,00","9.842,07"
2011,810001,81140,6015,458100,(**) Inversiones en infraestructura industrial,"365.000,00","99.419,08"
2011,810001,81140,7400,458100,Plan Navarra 2012-60. Polígono de Lodosa,"1.500.000,00","1.500.000,00"
2011,810001,81140,7400,458102,Dotaciones para el polígono industrial de Arazuri-Orcoyen,"3.000.000,00","668.401,70"
2011,810001,81140,7609,458100,Ayudas a polígonos municipales de actividades económicas,"100.000,00",
2011,810001,81140,7609,458102,(**) Actuaciones en el polígono industrial de Mendavia,"200.000,00","200.000,00"
2011,810001,81140,7609,458103,Transferencias a NASUINSA para cubrir carencias de infraestructuras,"475.000,00","456.875,73"
2011,810002,81140,1200,425200,Retribuciones del personal fijo,"87.789,98","87.789,48"
2011,810002,81140,1210,425200,Retribuciones del personal contratado para cubrir plazas reservadas,"34.694,53","34.694,53"
2011,810002,81140,1211,425200,Retribuciones del personal contratado para cubrir vacantes,"0,32",
2011,810002,81140,2276,425200,Gastos de asistencia técnica,"185.000,00","39.145,26"
2011,810002,81140,2276,425203,"Estudios, informes y otros","30.000,00","28.102,00"
2011,810002,81140,2400,425200,Publicaciones,"500,00",
2011,810002,81140,4300,425200,Convenio con la Fundación CENIFER para organización de cursos,"40.000,00","39.998,20"
2011,810002,81140,7609,425200,Subvenciones para inversiones de entidades locales en energías renovables,"425.000,00","219.730,09"
2011,810002,81140,7701,425200,Subvenciones a fondo perdido por inversiones en energías renovables,"2.650.000,00","2.458.742,29"
2011,810002,81140,7800,425200,Subvenciones para inversiones en energías renovables,"1.786.238,64","1.374.131,15"
2011,810002,81140,7819,467300,Plan Navarra 2012-23 Centro Nacional de Biocombustibles de 2ª generación. Microrredes. P.O. FEDER 20,"1.251.000,00","1.251.000,00"
2011,810003,81140,2269,425200,Otros gastos de funcionamiento,"35.000,00","11.629,05"
2011,810003,81140,2276,425200,Gastos diversos derivados de las medidas de ahorro y eficiencia energética,"160.000,00","144.810,94"
2011,810003,81140,2276,425202,Medidas anticrisis-23. Plataforma de vigilancia del vehículo eléctrico,"30.000,00",
2011,810003,81140,2300,425200,Dietas,"500,00","293,26"
2011,810003,81140,2301,425200,Locomoción y gastos de viaje,"20.000,00","7.509,13"
2011,810003,81140,4609,425200,Auditorías energéticas y estudios de viabilidad en entidades locales,"50.000,00","21.952,51"
2011,810003,81140,4701,425200,"Subvenciones a foros, jornadas y otros de interés general","100,00",
2011,810003,81140,4701,425202,"Auditorías, diagnósticos y cursos","202.490,00","155.155,00"
2011,810003,81140,6031,425200,Plan de ahorro energético en la Administración Foral,"100.000,00",
2011,810003,81140,6040,425200,Medidas anticrisis-23. Adquisición de vehículos eléctricos,"70.000,00","50.000,00"
2011,810003,81140,7609,425200,Transferencias a entidades locales para inversiones en ahorro y eficiencia energética,"764.946,47","426.891,10"
2011,810003,81140,7701,425200,Transferencias a empresas que materialicen subvenciones en ahorro y eficiencia energética,"1.599.314,89","1.156.129,00"
2011,810003,81140,7709,425200,Medidas anticrisis-23. Ayudas de impulso del vehículo eléctrico en Navarra (VEN),"400.000,00","314.630,10"
2011,810003,81140,7709,425202,Medidas anticrisis-23. Ayudas de impulso del vehículo eléctrico en Navarra (VEN). FEDER 2007-2013,"500.000,00","355.963,63"
2011,810003,81140,7800,425200,Actuaciones de ahorro y eficiencia energética,"4.618.010,00","4.413.087,73"
2011,820001,81300,1200,421300,Retribuciones del personal fijo,"422.851,72","422.851,72"
2011,820001,81300,1210,421300,Retribuciones del personal contratado para cubrir plazas reservadas,"60.432,95","60.432,73"
2011,820001,81300,1211,421300,Retribuciones del personal contratado para cubrir vacantes,"89.771,38","89.770,37"
2011,820001,81300,2269,421300,Otros gastos diversos,"25.000,00","18.373,23"
2011,820001,81300,2276,421300,"Asistencia técnica, control e inspección","237.443,30","133.609,27"
2011,820001,81300,2300,421300,Dietas,"500,00","79,98"
2011,820001,81300,2301,421300,Locomoción y gastos de viaje,"10.000,00","9.775,78"
2011,820001,81300,4400,495300,Transferencias a NAVELSA para control metrológico,"1.000,00",
2011,820001,81300,7400,495300,Transferencias a NAVELSA para inversiones,"10.000,00","10.000,00"
2011,820002,81300,2100,467900,Conservación de caminos y acceso a centros de telecomunicaciones,"10.000,00",
2011,820002,81300,2276,467900,"Evaluación de la cobertura de redes de TV, radio y telefonía móvil. Comunidad de trabajo de los Piri","1.000,00",
2011,820002,81300,2279,467900,Servicio de difusión de televisión en Navarra,"1.152.556,70","1.146.085,87"
2011,820002,81300,6013,467900,Plan Navarra 2012-28. Plan de telecomunicaciones a largo plazo,"3.091.007,99","2.402.954,02"
2011,820002,81300,6031,467900,Plan Navarra 2012-27. Plan de infraestructuras para TDT,"208.992,01","198.234,80"
2011,820002,81300,6031,467902,Infraestructuras y equipamiento para servicios de telecomunicaciones,"200.000,00","155.645,95"
2011,820002,81300,6031,491300,(**) Instalación de antena de cobertura de situaciones de emergencias en Valle de Salazar-Selva de I,"100.000,00","1.610,70"
2011,820003,81300,7701,458100,Convenio de electrificación,"645.369,00","300.369,00"
2011,820003,81300,7701,458102,Convenio de gasificación,"849.000,00","449.000,00"
2011,830001,81120,1200,422200,Retribuciones del personal fijo,"148.337,38","148.337,38"
2011,830001,81120,1210,422200,Retribuciones del personal contratado para cubrir plazas reservadas,"3.050,93","3.050,31"
2011,830001,81120,1211,422200,Retribuciones del personal contratado para cubrir vacantes,"1,00",
2011,830001,81120,2300,422200,Dietas,"325,00",
2011,830001,81120,2301,422200,Locomoción y gastos de viaje,"3.250,00","2.276,58"
2011,830001,81120,2400,422200,Gastos de edición y publicaciones,"1.300,00",
2011,830001,81120,4400,422200,Transferencias a SODENA,"65.000,00",
2011,830001,81120,4400,422203,Medidas anticrisis-16. Transferencias a CEINSA para el programa Beca Emprendedor,"272.058,05","272.058,05"
2011,830001,81120,4709,241300,Gastos fiscales por creación de empleo,"21.277.608,00","10.367.567,69"
2011,830001,81120,4709,422202,Medidas anticrisis-16. Programa Beca Emprendedor,"1.651.775,00","573.333,04"
2011,830001,81120,7701,422200,Bonificación de intereses (nueva normativa zona asistida),"100,00",
2011,830001,81120,7701,422205,Subvenciones a fondo perdido por inversión (nueva normativa zona asistida),"14.543.865,00","9.714.816,52"
2011,830001,81120,7701,422206,Subvenciones a fondo perdido por inversión (nueva normativa zona no asistida),"3.975.000,00","2.478.169,76"
2011,830001,81120,7701,422207,Bonificación de intereses (nueva normativa zona no asistida),"15.100,00","14.534,52"
2011,830001,81120,7701,467300,Subvención impulso economía - incremento competitividad tejido industrial (marco temporal de ayudas,"8.351.622,00","7.689.102,72"
2011,830001,81120,7709,422200,Gastos fiscales por inversión,"96.998.285,88","96.998.285,88"
2011,830002,81150,1200,422300,Retribuciones del personal fijo,"56.193,94","56.193,94"
2011,830002,81150,1210,422300,Retribuciones del personal contratado para cubrir plazas reservadas,"1,00",
2011,830002,81150,1211,422300,Retribuciones del personal contratado para cubrir vacantes,"1,00",
2011,830002,81150,2269,422300,Otros gastos diversos,"2.300,00","1.930,97"
2011,830002,81150,2276,422300,Gastos de asistencia técnica,"650,00",
2011,830002,81150,2300,422300,Dietas,"130,00",
2011,830002,81150,2301,422300,Locomoción y gastos de viaje,"170,00",
