2011,211000,20000,1000,922100,Retribuciones de altos cargos,"32.619,39","32.618,61"
2011,211000,20000,1100,922100,Retribuciones del personal eventual,"55.118,96","55.118,96"
2011,211000,20000,2261,922100,Gastos de representación de la Sra. Consejera y Gabinete,"5.000,00","3.681,72"
2011,211000,20000,2269,922100,Otros gastos diversos de la Sra. Consejera y Gabinete,"1.000,00","377,60"
2011,211000,20000,2301,922100,Gastos de viaje de la Sra. Consejera y Gabinete,"3.000,00",
2011,211000,20100,1200,922100,Retribuciones del personal fijo,"252.611,32","252.611,32"
2011,211000,20100,1210,922100,Retribuciones del personal contratado para cubrir plazas reservadas,"68.296,34","68.292,22"
2011,211000,20100,1211,922100,Retribuciones del personal contratado para cubrir vacantes,"1,00",
2011,211000,20100,1220,922100,Retribuciones del personal contratado temporal,"0,00",
2011,211000,20100,1250,922100,Retribuciones del personal contratado para sustituciones,"192,87","192,87"
2011,211000,20100,1400,922100,Retribuciones personales,"273.989,76","273.989,76"
2011,211000,20100,1600,922100,Seguridad social,"297.927,63","297.927,63"
2011,211000,20100,1702,922100,Horas extraordinarias,"0,00",
2011,211000,20100,2120,922100,Reparación y conservación de edificios y otras construcciones,"5.850,00","3.549,32"
2011,211000,20100,2150,922100,Conservación de mobiliario  y otros enseres,"3.725,00","2.195,72"
2011,211000,20100,2200,922100,Gastos de oficina y material,"23.890,00","15.955,12"
2011,211000,20100,2264,922100,Gastos de funcionamiento de edificios,"64.206,61","48.706,61"
2011,211000,20100,2269,922100,Otros gastos diversos,"5.960,00","5.391,57"
2011,211000,20100,2271,922100,Servicios de limpieza y aseo,"62.215,00","59.210,84"
2011,211000,20100,2274,922100,Servicios de seguridad y vigilancia,"37.500,00","37.382,85"
2011,211000,20100,2280,922100,"Energía eléctrica, agua y gas","25.748,00","19.907,94"
2011,211000,20100,4809,922100,Indemnizaciones por responsabilidad patrimonial,"1,00",
2011,211000,20100,4809,922102,Ejecución de sentencias,"2.869,53","2.869,53"
2011,211000,21000,1000,922100,Retribuciones de altos cargos,"57.021,20","55.302,66"
2011,211000,21000,2202,922100,Suscripciones y libros,"31.367,39","24.949,90"
2011,211000,21000,2261,922100,Gastos de representación,"3.493,95","1.870,02"
2011,211000,21000,2262,922100,Información y publicidad,"4.550,00",
2011,211000,21000,2266,922100,"Asistencia a cursos de formación, reuniones, congresos y foros internacionales","13.395,00","395,00"
2011,211000,21000,2266,922102,"Organización de cursos de formación, reuniones y congresos","3.850,00","283,32"
2011,211000,21000,2279,922100,Servicios de profesionales,"3.210,00","2.466,20"
2011,211000,21000,2300,922100,Dietas,"3.050,00","185,68"
2011,211000,21000,2301,922100,Locomoción y gastos de viaje,"41.575,00","30.962,13"
2011,211000,21000,2400,922100,Publicaciones y encuadernaciones,"8.280,00","374,40"
2011,211000,21000,4819,922400,Transferencias a instituciones sin ánimo de lucro. Estudios jurídico-económicos,"1,00",
2011,211000,21000,6020,922100,Edificios,"14.960,00",
2011,211000,21000,6031,922100,"Telefonía, comunicaciones y otras instalaciones","3.092,52","493,39"
2011,211000,21000,6050,922100,Mobiliario y equipos de oficina,"2.305,00",
2011,211000,21000,6059,922100,Otro mobiliario y equipo,"1.975,00",
2011,211000,21000,7609,456300,(**) Colaboración con los municipios para la adecuación del parque natural de Ezcaba,"60.000,00",
2011,211000,21500,2273,922100,Mantenimiento informático y soporte primer nivel,"34.604,00","33.530,21"
2011,211000,21500,2273,922102,Operación y nivel de servicio SAP,"35.000,00","34.999,99"
2011,211000,21500,2273,922103,Asistencia técnica segundo nivel,"64.971,00","63.883,30"
2011,211000,21500,6060,922100,Equipamiento informático,"10.194,46","4.577,21"
2011,211000,21500,6090,922100,Procesos de información,"40.080,00","36.870,62"
2011,211000,21500,6090,922102,Desarrollo evolutivo de SAP-GPI,"18.910,54","20.811,84"
2011,211001,21500,1200,467900,Retribuciones del personal fijo,"101.202,09","101.202,09"
2011,211001,21500,1210,467900,Retribuciones del personal contratado para cubrir plazas reservadas,"1,00",
2011,211001,21500,1211,467900,Retribuciones del personal contratado para cubrir vacantes,"1,00",
2011,211001,21500,2262,467900,Publicidad y divulgación Infolocal y otros,"4.550,00","1.635,48"
2011,211001,21500,2273,467900,Desarrollo de la administración electrónica,"10.035,60","10.035,60"
2011,211001,21500,2273,467902,Mantenimiento y soportes del sistema de información,"25.450,00","23.708,16"
2011,211001,21500,2276,467900,Estudios y trabajos técnicos,"9.161,40","8.214,11"
2011,211001,21500,4409,467900,Plataforma Infolocal. Convenio con ANIMSA,"633.996,00","631.596,81"
2011,211001,21500,7409,467900,Plataforma Infolocal. Convenio con ANIMSA,"25.000,00",
2011,211002,21400,1200,922300,Retribuciones del personal fijo,"125.562,02","125.562,02"
2011,211002,21400,1210,922300,Retribuciones del personal contratado para cubrir plazas reservadas,"20.538,30","20.538,30"
2011,211002,21400,1211,922300,Retribuciones del personal contratado para cubrir vacantes,"4.396,80","4.396,04"
2011,211002,21400,2330,922300,Gratificaciones a tribunales de oposiciones,"4.090,00","753,04"
2011,211002,21400,4609,456200,Consorcio de tratamiento de residuos: apoyo funcionamiento,"500.000,00","500.000,00"
2011,211002,21400,4609,942400,Fomento de los procesos de reestructuración administrativa de los entes locales,"18.500,00",
2011,211002,21400,7609,456200,Consorcio de tratamiento de residuos o entidades consorciadas: implantación y establecimiento,"500.000,00","455.302,47"
2011,211002,21400,7609,942400,Fomento de los procesos de reestructuración administrativa de los entes locales,"21.500,00",
2011,211003,21000,1200,922200,Retribuciones del personal fijo,"188.739,28","188.739,28"
2011,211003,21000,1210,922200,Retribuciones del personal contratado para cubrir plazas reservadas,"1,00",
2011,211003,21000,1211,922200,Retribuciones del personal contratado para cubrir vacantes,"1,00",
2011,211003,21000,4609,456100,Convenio con los Ayuntamientos de Cadreita y Villafranca: financiación servicio de agua,"32.000,00",
2011,211003,21000,4609,922200,Seguros de accidentes de corporativos y secretarios de entes locales,"30.000,00","29.956,13"
2011,211003,21000,4609,942300,Compensación a entes locales por bonificaciones en tributos locales,"1.150.000,00","1.110.562,29"
2011,211003,21000,4609,942500,(**) Implementación y ejecución Plan de Desarrollo Socioeconómico-Convenio con el Ayuntamiento de Ol,"30.000,00",
2011,211003,21000,7609,261600,"(**) Actuaciones especiales en edificios, calles y caminos e instalaciones municipales","981.645,00","789.296,70"
2011,211003,21000,7609,45A200,(**) Convenio con el Ayuntamiento de Pueyo para el arreglo de caminos,"50.000,00","50.000,00"
2011,211003,21000,7609,922202,Transferencia al Ayuntamiento de Petilla de Aragón,"7.238,00",
2011,211004,21200,1200,922400,Retribuciones del personal fijo,"294.035,37","294.035,37"
2011,211004,21200,1210,922400,Retribuciones del personal contratado para cubrir plazas reservadas,"114.871,46","114.871,46"
2011,211004,21200,1211,922400,Retribuciones del personal contratado para cubrir vacantes,"1,00",
2011,211004,21200,2279,922400,Programa de gestión económico-financiero,"7.210,00","5.541,20"
2011,211004,21200,4609,922300,Sueldos y salarios del personal sanitario municipal,"74.890,00","4.372,54"
2011,211004,21200,4609,942200,Participación de ayuntamientos en impuestos no concertados con el Estado,"725.569,99","725.569,99"
2011,211004,21200,4609,942202,Participación en ingresos por tasas de Telefónica,"2.192.000,00","1.963.004,74"
2011,212001,21300,1200,942200,Retribuciones del personal fijo,"404.428,67","404.428,67"
2011,212001,21300,1210,942200,Retribuciones del personal contratado para cubrir plazas reservadas,"1,00",
2011,212001,21300,1211,942200,Retribuciones del personal contratado para cubrir vacantes,"1,00",
2011,212001,21300,7600,456100,Plan Navarra 2012-66. Plan director de depuración y saneamiento de ríos,"2.616.867,66","858.024,36"
2011,212001,21300,7600,456102,Plan director de depuración y saneamiento de ríos,"1.995.132,34","840.331,79"
2011,212001,21300,7600,942400,Plan extraordinario de inversiones locales 2011-2012,"4.500.000,00","633.957,81"
2011,212001,21300,7600,942402,Plan especial de infraestructuras en zonas deprimidas,"146.016,81","5.919,48"
2011,212001,21310,7600,456100,Plan director de abastecimiento en alta,"12.347.616,56","886.268,45"
2011,212001,21310,7600,456102,Abastecimiento en alta no incluido en planes directores (RG),"38.815,00","444,33"
2011,212001,21310,7600,456103,Abastecimiento de agua en alta (RE),"200.948,14",
2011,212001,21310,7600,942400,Realización de estudios para el plan de inversiones,"0,00",
2011,212001,21320,7600,261600,Pavimentaciones con redes (RG),"9.200.000,00","1.247.144,97"
2011,212001,21320,7600,261602,Urbanización de travesías,"1.092.617,90","43.083,14"
2011,212001,21320,7600,261603,Edificios municipales (RG),"2.062.002,68","1.207.337,54"
2011,212001,21320,7600,261604,Pavimentaciones sin redes (RG),"4.809.584,00","2.275.525,17"
2011,212001,21320,7600,261605,Pavimentaciones con redes (RE),"2.100.000,00","368.554,37"
2011,212001,21320,7600,261606,Pavimentación sin redes (RE),"1.646.064,28","65.153,95"
2011,212001,21320,7600,261607,Edificios municipales (RE),"608.307,56","166.370,67"
2011,212001,21320,7600,456100,Redes locales de abastecimiento y saneamiento (RG),"6.737.285,00","1.267.409,84"
2011,212001,21320,7600,456102,Redes locales de abastecimiento y saneamiento (RE),"181.743,78","65.561,78"
2011,212001,21320,7600,456200,Plan director de residuos sólidos urbanos. Tratamiento,"3.795.000,00","20.256,87"
2011,212001,21320,7600,456202,Plan director de residuos sólidos urbanos. Recogida,"2.900.000,00","978.607,29"
2011,212001,21320,7600,456203,Residuos específicos,"202.720,18","67.870,92"
2011,212001,21320,7600,459100,Alumbrado público (RE),"1.148.229,26","440.925,01"
2011,212001,21320,7600,459102,Alumbrado público (RG),"2.696.846,14","1.613.806,71"
2011,212001,21320,7600,45A200,Caminos locales (RG),"1.134.634,70","405.963,54"
2011,212001,21320,7600,45B100,Cementerios (RG),"883.585,86","202.111,41"
2011,212002,21200,1200,942200,Retribuciones del personal fijo,"148.126,77","148.126,77"
2011,212002,21200,1210,942200,Retribuciones del personal contratado para cubrir plazas reservadas,"1,00",
2011,212002,21200,1211,942200,Retribuciones del personal contratado para cubrir vacantes,"5.186,87","5.186,11"
2011,212002,21200,4600,942200,Fondo general de transferencias corrientes,"167.842.261,83","163.452.011,89"
2011,212002,21200,4600,942202,Ayuda a la Federación Navarra de Municipios y Concejos,"382.835,00","372.821,23"
2011,212002,21200,4600,942203,Carta de capitalidad de la ciudad de Pamplona,"22.929.127,00","22.329.390,71"
2011,212002,21200,4600,942204,Compensación a ayuntamientos por corporativos,"5.225.961,17","5.225.961,17"
2011,900000,90000,1000,233100,Retribuciones de altos cargos,"64.717,49","64.716,71"
2011,900000,90000,1100,233100,Retribuciones del personal eventual,"120.310,75","120.310,75"
2011,900000,90000,2261,233100,Gastos diversos de la Sra. Consejera,"7.000,00","6.296,20"
2011,900000,90000,2301,233100,Gastos de viaje de la Sra. Consejera,"2.850,00","1.144,65"
2011,900000,90200,1200,233100,Retribuciones del personal fijo,"628.741,80","628.741,80"
2011,900000,90200,1210,233100,Retribuciones del personal contratado para cubrir plazas reservadas,"129.906,26","129.906,26"
2011,900000,90200,1211,233100,Retribuciones del personal contratado para cubrir vacantes,"125.132,98","125.132,98"
2011,900000,90200,1220,233100,Retribuciones del personal contratado temporal,"95.719,68","95.719,68"
2011,900000,90200,1250,233100,Retribuciones del personal contratado para sustituciones,"54.963,55","54.963,55"
2011,900000,90200,1400,233100,Retribuciones personales,"827.365,95","827.365,95"
2011,900000,90200,1600,233100,Seguridad social,"1.107.754,87","1.107.754,87"
2011,900000,90200,1702,233100,Horas extraordinarias,"0,00",
2011,900000,90200,4809,233100,Indemnizaciones por responsabilidad civil y patrimonial y ejecución de sentencias,"1.000,00",
2011,900000,90200,4809,233102,Ejecución de reclamaciones y recursos administrativos,"9.500,00","3.732,86"
2011,900000,90200,6060,233100,Equipos informáticos,"20.000,00","16.815,63"
2011,900000,91000,1000,233100,Retribuciones de altos cargos,"55.303,00","55.302,66"
2011,900000,91000,1200,233100,Retribuciones del personal fijo,"1.473.143,14","1.473.143,14"
2011,900000,91000,1210,233100,Retribuciones del personal contratado para cubrir plazas reservadas,"123.188,53","123.188,53"
2011,900000,91000,1211,233100,Retribuciones del personal contratado para cubrir vacantes,"156.433,65","156.433,65"
2011,900000,91000,2120,233100,Reparación y conservación de edificios e instalaciones,"1.800,00","1.286,17"
2011,900000,91000,2140,233100,Reparación y conservación de vehículos,"5.044,00","3.201,25"
2011,900000,91000,2150,233100,Conservación y reparación de bienes muebles,"4.496,00","3.512,48"
2011,900000,91000,2160,233100,Mantenimiento del hardware,"20.687,00","17.590,98"
2011,900000,91000,2200,233100,Material de oficina,"101.500,00","89.898,26"
2011,900000,91000,2202,233100,"Suscripciones, publicaciones y adquisición de libros","6.090,51","5.529,79"
2011,900000,91000,2241,233100,Primas de seguros de vehículos,"3.330,00","2.775,10"
2011,900000,91000,2261,233100,Gastos de representación,"3.500,00","1.429,84"
2011,900000,91000,2262,233100,Publicidad y propaganda,"4.000,00",
2011,900000,91000,2266,233100,Gastos de formación,"1.098,00","80,00"
2011,900000,91000,2266,233102,"Conferencias, congresos y cursillos","4.000,00","2.480,00"
2011,900000,91000,2266,233103,Gastos de formación derivados de Planes del Departamento,"6.460,00",
2011,900000,91000,2269,233100,Otros gastos diversos,"25.181,80","7.101,80"
2011,900000,91000,2271,233100,Servicio de limpieza,"18.000,00","13.288,43"
2011,900000,91000,2273,233100,Soporte de primer nivel,"81.018,00","68.028,67"
2011,900000,91000,2273,233102,Asistencia técnica de segundo nivel,"22.120,00","22.114,64"
2011,900000,91000,2274,233100,Servicio de seguridad,"96.909,49","96.909,48"
2011,900000,91000,2279,233100,Arrendamiento de servicios,"40.544,00","40.111,85"
2011,900000,91000,2279,233102,Atención telefónica al ciudadano,"102.370,00","89.986,69"
2011,900000,91000,2280,233100,Energía eléctrica y agua,"84.000,00","27.610,60"
2011,900000,91000,2281,233100,Combustible y calefacción,"28.000,00","20.168,41"
2011,900000,91000,2300,233100,Dietas,"950,00","318,98"
2011,900000,91000,2301,233100,Locomoción y gastos de viaje,"26.500,00","16.746,82"
2011,900000,91000,2339,233100,Indemnizaciones por gastos de los miembros del Consejo Navarro de las Personas Mayores,"1.500,00","781,24"
2011,900000,91000,3509,233100,Otros gastos financieros,"10,00",
2011,900000,91000,4819,233100,(**) Actividades generales de voluntariado,"0,00",
2011,900000,91000,6089,233100,Tarjeta de personas con discapacidad,"35.000,00",
2011,900000,91000,6090,233100,Aplicaciones informáticas,"193.500,00","175.089,98"
2011,900000,91000,6092,233100,Proyectos de modernización,"40.000,00","34.500,00"
2011,900001,91200,1200,143100,Retribuciones del personal fijo,"206.943,57","206.943,57"
2011,900001,91200,1210,143100,Retribuciones del personal contratado para cubrir plazas reservadas,"29.564,27","29.563,51"
2011,900001,91200,1211,143100,Retribuciones del personal contratado para cubrir vacantes,"13.611,92","13.611,84"
2011,900001,91200,2266,143100,Gastos Premio Príncipe de Viana a la Solidaridad,"35.336,18","35.327,18"
2011,900001,91200,2266,143102,Organización IV Encuentro de CCAA y Cooperación,"20.000,00","10.969,05"
2011,900001,91200,2276,143100,"Asistencia técnica, difusión, control y evaluación","180.000,00","89.112,00"
2011,900001,91200,2301,143100,Gastos de viaje,"30.000,00","650,25"
2011,900001,91200,2400,143100,Publicaciones de cooperación al desarrollo,"4.800,00","2.950,00"
2011,900001,91200,4809,143100,Becas para cooperación al desarrollo,"48.192,00","42.991,29"
2011,900001,91200,4819,143100,Proyectos Medicus Mundi Navarra,"1.564.000,00","1.564.000,00"
2011,900001,91200,4819,143102,Cooperación internacional al desarrollo,"15.301.280,00","13.463.321,32"
2011,900001,91200,4819,143103,Ayudas para emergencias internacionales,"341.800,00","174.130,88"
2011,900001,91200,4819,143104,(**) Ayuda humanitaria para la población saharaui,"270.000,00","270.000,00"
2011,900001,91200,4819,143105,"Fondo 0,7% IRPF. Cooperación internacional al desarrollo","1.594.800,00","1.578.310,62"
2011,900001,91200,4819,143107,Subvención a la Coordinadora ONGD de Navarra,"80.600,00","80.113,98"
2011,900001,91200,4819,143108,Premio Príncipe de Viana de la Solidaridad,"40.000,00","40.000,00"
2011,900001,91400,2269,231000,"Promoción, divulgación, edición y difusión de programas y planes","10.000,00","1.925,10"
2011,900001,91400,2276,231000,Estudios y convenios en materia de servicios sociales,"20.000,00","6.000,00"
2011,900001,91400,2276,231002,Estudios de investigación en calidad y TIC,"0,00",
2011,900001,91400,4809,231000,"Transferencias para becas, proyectos de investigación y publicaciones","62.532,00","62.496,00"
2011,900001,91400,7609,231400,Transferencias a entidades locales para inversiones en tercera edad,"1.043.098,89","309.883,32"
2011,900001,91400,7819,231402,"(**) Transferencia inversiones Asociación de Jubilados, Pensionistas y Viudas Ega para reforma de lo","50.000,00",
2011,900001,91400,7819,231602,Transferencia para inversiones del Proyecto Hombre,"200.000,00",
2011,900001,91500,2266,231004,Gastos Premio Príncipe de Viana a la Innovación en Dependencia,"48.309,00","48.151,27"
2011,900001,91500,2266,231005,Jornada Internacional del Uso de Sujeciones en Personas Mayores Dependientes,"21.740,00","21.239,99"
2011,900001,91500,2276,231000,Asistencia técnica para estudios en materia de servicios sociales,"0,00",
2011,900001,91500,4809,231000,Subvenciones corrientes para homologación,"41.933,82","33.013,82"
2011,900001,91500,4819,231000,Premio Príncipe de Viana a la Innovación en Dependencia,"40.000,00","40.000,00"
2011,900001,91500,4819,231005,Subvención COCEMFE Plan de Formación MEDIS,"34.000,00","17.000,00"
2011,900002,91600,4802,212100,Pensiones asistenciales PAS,"20.000,00","17.084,04"
2011,900002,91600,4809,212100,Pensiones no contributivas,"12.931.000,00","12.890.990,72"
2011,900002,91600,4809,212102,Pensiones LISMI,"422.000,00","404.449,25"
2011,900002,91600,4809,212103,Gastos fiscales por aportaciones a sistemas de previsión social,"44.752.253,00","41.664.428,65"
2011,900003,91600,2279,231600,Contrato de acompañamiento social en medio abierto,"92.700,00","75.592,28"
2011,900003,91600,2279,231602,Gestión de servicio de atención residencial en incorporación social,"512.000,00","506.441,55"
2011,900003,91600,2279,231603,Contratos de servicios de incorporación sociolaboral,"622.000,00","618.530,51"
2011,900003,91600,2279,231604,Contratos de servicio de incorporación social en vivienda (EISOVI),"183.178,20","183.178,20"
2011,900003,91600,4609,231500,Servicio de acogida para personas sin hogar,"160.000,00","160.000,00"
2011,900003,91600,4609,231600,Subvención a entidades locales: intervención social con minorías étnicas,"250.000,00","242.792,97"
2011,900003,91600,4609,231602,(**) Programa de Empleo Social Protegido,"4.000.000,00","3.966.015,30"
2011,900003,91600,4609,231603,Medidas anticrisis-11. Contratación de perceptores de Renta Básica para actuaciones de interés públi,"2.625.000,00","1.347.188,69"
2011,900003,91600,4809,231500,Ayudas a familias navarras sin medios de subsistencia,"36.081.864,61","35.870.357,26"
2011,900003,91600,4809,231502,Gastos fiscales derivados de las  deducciones por pensiones de viudedad,"8.199.075,00","5.667.386,70"
2011,900003,91600,4809,231503,Gastos fiscales derivados de las deducciones por cotizaciones de personas cuidadoras,"603.928,13","603.928,13"
2011,900003,91600,4809,231603,Otras medidas de incorporación sociolaboral,"30.000,00","7.183,68"
2011,900003,91600,4809,231604,Subvención de gastos de tramitación compra programa VIS,"200.000,00","17.200,00"
2011,900003,91600,4819,231500,"Fondo 0,7% IRPF. Subvenciones para entidades del área de exclusión social","431.669,00","425.971,69"
2011,900003,91600,4819,231502,"Fondo 0,7% IRPF. Atención a desempleados sin prestaciones","752.400,00","704.115,07"
2011,900003,91600,4819,231503,(**) Subvención proyecto de comedores solidarios PARIS 365 de la Fundación Gizakia Herritar,"30.000,00","30.000,00"
2011,900003,91600,4819,231600,"Fondo 0,7% IRPF. Subvención al Programa Acceder","45.000,00","44.939,02"
2011,900003,91600,4819,231602,Subvención a Cáritas,"30.000,00","30.000,00"
2011,900003,91600,4819,231603,"Fondo 0,7% IRPF. Subvenciones para la promoción de minorías étnicas","278.975,00","277.779,85"
2011,900003,91600,4819,231604,"Fondo 0,7% IRPF. Subvención a entidades colaboradoras del programa VIS y VAIS","272.963,59","221.929,98"
2011,900003,91600,4819,231605,"Fondo 0,7% IRPF. Subvención a programas de apoyo a la incorporación social de inmigrantes","100.000,00","94.983,56"
2011,900003,91600,4819,231606,(**) Subvención al Banco de Alimentos de Navarra,"30.000,00","30.000,00"
2011,900003,91600,4819,231607,"Fondo 0,7% IRPF. Subvención a Salhaketa","65.600,00","65.600,00"
2011,900003,91600,4819,231608,(**) Subvención a Salhaketa,"89.400,00","72.637,35"
2011,900003,91600,4819,231609,Subvención a Gaz Kalo para actuaciones federativas de asociaciones gitanas,"154.800,00","154.800,00"
2011,900003,91600,4819,231611,(**) Subvención para la promoción de minorías étnicas,"100.000,00","99.550,49"
2011,900003,91700,2279,231000,Gestión del centro de servicios sociales de Estella,"385.200,00","379.531,97"
2011,900003,91700,2279,231002,"Gestión del proyecto piloto ""Te acercamoSS""","0,00",
2011,900003,91700,2279,231600,Gestión de centros de atención a víctimas de violencia de género,"564.850,00","548.258,56"
2011,900003,91700,4609,231500,Servicios sociales de Base,"12.265.410,00","11.116.224,68"
2011,900003,91700,4809,231602,Ayudas para víctimas de violencia de género con dificultades de empleabilidad,"104.798,46","104.798,46"
2011,900003,91700,4819,231600,Ayudas de emergencia para víctimas de violencia de género,"2.000,00","747,11"
2011,900003,91700,6090,231000,Sistema de información a los servicios sociales de Base,"0,00",
2011,920000,91800,1000,231000,Retribuciones de altos cargos,"203.487,72","203.487,72"
2011,920000,91800,1200,231000,Retribuciones del personal fijo,"643.319,38","643.319,38"
2011,920000,91800,1210,231000,Retribuciones del personal contratado para cubrir plazas reservadas,"34.118,47","34.118,47"
2011,920000,91800,1211,231000,Retribuciones del personal contratado para cubrir vacantes,"97.619,56","97.618,70"
2011,920000,91800,1220,231000,Retribuciones del personal contratado temporal,"462.471,83","462.471,83"
2011,920000,91800,1250,231000,Retribuciones del personal contratado para sustituciones,"1.915.450,51","1.915.450,51"
2011,920000,91800,1400,231000,Retribuciones personales,"1.694.101,57","1.693.632,66"
2011,920000,91800,1600,231000,Seguridad social,"3.987.864,34","3.987.864,34"
2011,920000,91800,1702,231000,Horas extraordinarias,"0,00",
2011,920000,91800,1703,231000,Remuneración por trabajo en días festivos,"657.773,87","657.179,71"
2011,920000,91800,1704,231000,Complemento por realización de guardias,"118.743,31","118.743,31"
2011,920000,91800,1705,231000,Complemento por trabajo en turnos de noche,"152.985,82","152.269,97"
2011,920000,91800,2120,231000,Conservación y reparación de edificios,"17.860,00","11.830,42"
2011,920000,91800,2220,231000,Comunicaciones,"19.400,00","19.314,84"
2011,920000,91800,2229,231000,Servicio interactivo registral,"14.600,00","14.347,55"
2011,920000,91800,2261,231000,Atenciones protocolarias,"640,00","453,37"
2011,920000,91800,2263,231000,Gastos jurídicos y contenciosos,"1.500,00",
2011,920000,91800,2266,231000,Gastos de formación,"330,00","330,00"
2011,920000,91800,2269,231000,Gastos diversos,"5.580,00","4.428,05"
2011,920000,91800,2271,231000,Servicios de limpieza y desinfección,"189.890,00","189.526,80"
2011,920000,91800,2279,231000,Arrendamiento de servicios,"14.530,99","14.488,33"
2011,920000,91800,2279,231002,Contrato asistencia técnica para valoración económica dependencia,"161.569,01","159.082,66"
2011,920000,91800,2285,231000,Vestuario y calzado,"1.140,00","97,19"
2011,920000,91800,2300,231000,Dietas,"2.850,00","2.537,12"
2011,920000,91800,2301,231000,Locomoción y gastos de viaje,"77.155,76","71.761,85"
2011,920000,91800,2400,231000,Edición de libros y publicaciones,"0,00",
2011,920000,91800,2400,231002,Material de formación cuidadores no profesionales,"0,00",
2011,920000,91800,3509,231000,Otros gastos financieros,"10,00",
2011,920000,91800,4300,231004,Subvención a la Fundación para la Tutela de Personas Adultas,"317.900,00","317.891,00"
2011,920000,91800,4809,231000,Ejecución de reclamaciones y recursos administrativos,"9.500,00","593,60"
2011,920000,91800,4819,231000,Formación y apoyo cuidadores no profesionales. Teléfono de la Esperanza,"0,00",
2011,920000,91800,4819,231002,Talleres de formación cuidadores no profesionales Cruz Roja,"5.000,00",
2011,920001,91800,1200,231700,Retribuciones del personal fijo,"1.549.974,46","1.549.974,46"
2011,920001,91800,1210,231700,Retribuciones del personal contratado para cubrir plazas reservadas,"135.787,07","135.787,07"
2011,920001,91800,1211,231700,Retribuciones del personal contratado para cubrir vacantes,"207.621,40","207.621,40"
2011,920001,91800,2120,231700,Conservación y reparación de edificios,"28.000,00","25.636,59"
