2023,010001,00100,3990,000000,Otros ingresos,10,10,0
2023,010001,01000,7901,000000,REACT Ingresos Palacio de Navarra eficiente y sostenible PO FEDER 14-20,2000895,2000895,0
2023,010002,01300,3010,000000,"Tasas por actuaciones de los Registros de Asociaciones, de Fundaciones y de Colegios Profesionales",9000,9000,13450
2023,010003,01010,3304,000002,Publicación de anuncios,100000,100000,"63257,52"
2023,010004,01100,3990,000000,Ingresos por ejecución de sentencias,250000,250000,"366316,14"
2023,010005,01700,4600,000000,Ingresos de entidades locales para el servicio de atención ciudadana,340000,340000,282427
2023,020002,04100,3800,000000,Reintegro de retribuciones abonadas indebidamente en ejercicios anteriores,3000,3000,"93599,69"
2023,020002,04100,3800,000003,COVID-19 Reintegro de retribuciones abonadas indebidamente en ejercicios anteriores,10,10,0
2023,020002,04100,3900,000000,Cuotas de derechos pasivos,1725000,1725000,"682513,04"
2023,020002,04100,3990,000000,Otros ingresos,10,10,"108601,3"
2023,020002,04100,8311,000000,Reintegro de anticipos de sueldo,752125,752125,423000
2023,020002,04310,8200,000000,Gestión del Montepío de funcionarios municipales,19397271,19397271,"14561368,12"
2023,020002,04440,3070,000000,Tasas académicas y derechos de examen,12000,12000,"59082,4"
2023,020002,04700,7901,000000,REACT Implantación del teletrabajo conjuntamente con el puesto de trabajo digital Gobierno Navarra PO FEDER 14-20,1338900,1338900,0
2023,021001,04500,4000,000000,Cursos de formación continua (INAP estatal),480000,600000,955440
2023,050000,02000,3890,000000,Devolución de pagos,1000,1000,0
2023,050000,02000,3990,000000,Otros ingresos,2000,2000,"8634,45"
2023,050000,02400,3010,000000,"Tasas por informes, certificados y demás actuaciones administrativas",150000,150000,"108126,12"
2023,050000,02400,3910,000000,Multas de juego,4000,4000,"25504,5"
2023,050000,02400,3910,000002,Multas de espectáculos,70000,70000,21206
2023,050000,02400,3910,000003,Multas de seguridad ciudadana,200000,200000,"627743,5"
2023,050000,02400,3990,000002,Otros ingresos,10,10,0
2023,050005,02930,3040,000000,Tasas por autorización de transportes especiales,575000,575000,"677433,97"
2023,050005,02930,3090,000000,Tasas por otras autorizaciones,400,400,"5727,88"
2023,051000,02100,3090,000000,"Tasas por informes, acompañamientos y otros",100500,100500,"70239,4"
2023,051000,02100,3090,000002,Tasas por estancias de vehículos particulares en dependencias policiales,1000,1000,0
2023,051000,02100,3990,000000,Ingreso por consumo energético,10,10,"30714,23"
2023,051000,02100,4000,000000,Financiación del Estado de la jubilación anticipada de la Policía Foral,2471246,2471246,"1806575,8"
2023,054000,02800,3010,000000,Tasas por servicios administrativos,600,600,530
2023,054000,02800,3090,000000,"Tasas por servicios de prevención, extinción de incendios y salvamento",20,20,"37888,54"
2023,054000,02800,3990,000000,Contribuciones especiales,2400000,2400000,"3462198,74"
2023,054000,02800,3990,000002,Otros ingresos,10,10,"1037,63"
2023,054001,02500,3010,000000,Tasas por servicios administrativos,200,200,235
2023,054001,02500,3990,000000,Otros ingresos,10,10,0
2023,054001,02500,4909,000000,"Ingresos programa POCTEFA, Proyecto Helinet",10,10,"175444,89"
2023,060001,06100,3090,000000,Tasas por servicios audiovisuales,1500,1500,"897,65"
2023,060005,06220,3304,000000,Ventas en el Fondo de Publicaciones,60000,60000,"66781,59"
2023,080000,08000,3800,000000,Ingresos por devolución de subvenciones,10,10,0
2023,080000,08000,7000,000000,MRR Creación de centros de atención integral 24 horas,0,0,"356109,12"
2023,090000,09100,3890,000000,Otros reintegros,10,10,"4147,76"
2023,090001,09100,3118,000000,Ingresos de instalaciones juveniles,20000,20000,"13380,06"
2023,090002,09100,3118,000002,Programas de juventud de actividades de verano,20000,20000,26560
2023,090002,09120,3309,000000,Ingresos del carné de alberguista,10000,10000,191
2023,090002,09120,3309,000002,Ingresos del Carné Joven,10,210010,"233500,48"
2023,100000,10100,3010,000000,Tasas por servicios administrativos,10,10,"587,68"
2023,100000,10100,3800,000000,Reintegros,10,10,0
2023,100000,10100,3990,000000,Otros ingresos derivados de expropiaciones,35000,35000,"18573,34"
2023,110003,11500,3010,000000,Tasas de la actividad mediadora en seguros privados,200,200,"166,4"
2023,110003,11500,3800,000000,Reintegros,10,"2951720,62","2993875,21"
2023,110003,11500,5200,000000,Intereses de cuentas corrientes e imposiciones a plazo,10,"962077,47","10844465,84"
2023,110003,11500,5990,000000,Compensación por cancelación de préstamos,10,10,0
2023,110003,11500,9000,000000,Emisiones de Deuda de Navarra,194993570,194993570,0
2023,110003,11500,9110,000000,Préstamos en moneda nacional,444993570,444993570,50000000
2023,111000,11300,3910,000000,Penalizaciones por incumplimientos de contratos,10,10,"2486,86"
2023,111000,11300,3990,000000,Otros ingresos,10,10,"12393,61"
2023,111000,11300,3990,000002,Herencias legales,10,10,0
2023,111000,11300,3990,000003,Ingresos por indemnizaciones de aseguradoras,10,"179842,12","315776,27"
2023,111000,11300,3990,000004,Ingresos por saldos y depósitos abandonados,10,10,0
2023,111000,11300,4800,000002,"Donaciones, herencias y legados testamentarios",10,10,0
2023,111000,11300,8401,000000,Ingresos por obligaciones afianzadas,10,10,0
2023,111001,11300,6120,000000,Venta de bienes muebles,10,10,0
2023,111002,11300,3990,000000,Comisiones de avales,10,10,0
2023,111002,11300,5000,000000,Intereses de títulos valores,10,10,0
2023,111002,11300,5201,000000,Intereses de venta de bienes inmuebles a NASUVINSA,73242,73242,0
2023,111002,11300,5201,000002,Intereses de aplazamientos,120000,120000,"124958,9"
2023,111002,11300,5300,000000,"Dividendos, participaciones y beneficios",10,10,0
2023,111002,11300,5400,000000,Rentas de inmuebles,119000,119000,"154286,19"
2023,111002,11300,5400,000002,Arrendamiento Petilla de Aragón,10,10,0
2023,111002,11300,5500,000000,Concesión demanial garajes González Tablas,12510,12510,"229281,56"
2023,111002,11300,6000,000000,Venta de terrenos,2008000,2008000,"2211581,14"
2023,111002,11300,6000,000002,Reversión de terrenos,10,10,0
2023,111002,11300,6000,000003,Venta de terrenos de la extinta Fundación Itoiz-Canal de Navarra,10,10,0
2023,111002,11300,6100,000000,Venta de inmuebles,20000,20000,160150
2023,111002,11300,6100,000002,Venta de inmuebles de la extinta Fundación Itoiz-Canal de Navarra,10,10,0
2023,111002,11300,7400,000000,Ingresos de sociedades,10,10,0
2023,111002,11300,8212,000000,Reintegro préstamo concedido por la venta de bienes inmuebles a NASUVINSA,1230697,1230697,0
2023,111002,11300,8500,000000,Reintegro de acciones y participaciones del sector público,14598168,14598168,0
2023,113002,12000,8700,000000,Remanente de tesorería afecto,0,"69632437,68",0
2023,113002,12000,8700,000002,Remanente de tesorería gastos generales,0,"29860278,63",0
2023,113002,12000,8700,000003,Remanente de tesorería afecto al Fondo de Participación de las Entidades Locales,0,"11360523,76",0
2023,113002,12000,8700,000004,"Remanente de tesorería afecto al Fondo 0,7%",0,"1223302,46",0
2023,113002,12000,8700,000005,Remanente de tesorería afecto al Fondo de Residuos,0,"2438588,55",0
2023,113002,12000,8700,000006,Remanente de tesorería afecto al MRR,105892170,"193825744,93",0
2023,113002,12000,8700,000007,Remanente de tesorería afecto al REACT,0,"18603498,9",0
2023,150000,17000,3010,000000,Tasas por servicios administrativos,10,10,"219,84"
2023,150000,17000,3800,000000,Reintegros,10,10,"6143,38"
2023,150000,17000,4000,000000,Transferencia del Estado por la Bonificación al consumo de combustibles,10,10,"98550002,28"
2023,152000,17500,1015,000000,Ingresos por el Impuesto de sociedades,354824000,354824000,"287504253,31"
2023,152000,17500,1015,000002,"Fondo 0,7% IS de otros fines de interés social",168000,168000,0
2023,152000,17500,1020,000000,Ingresos por el Impuesto sobre la renta de no residentes,2515000,2515000,"10673647,41"
2023,152000,17500,1140,000000,Impuesto sobre depósitos en entidades de crédito,6870000,6870000,"6464084,85"
2023,152000,17500,1300,000000,Impuesto sobre la producción de la energía eléctrica,21890000,21890000,947608
2023,152000,17500,1820,000000,Impuesto sobre grandes superficies,2000000,2000000,"82902,12"
2023,152000,17500,1830,000000,Ingresos por gravamen premios de loterías,5964000,5964000,"766324,1"
2023,152000,17500,2100,000000,Ingresos por el IVA,395803400,395803400,"488071979,91"
2023,152000,17500,2200,000000,Ingresos por los impuestos especiales sobre el alcohol y bebidas derivadas,46469000,46469000,"27935414,73"
2023,152000,17500,2201,000000,Ingresos por el Impuesto Especial sobre determinados medios de transporte,8412000,8412000,"5619755,76"
2023,152000,17500,2202,000000,Ingresos por el Impuesto Especial sobre la cerveza,163000,163000,"136999,69"
2023,152000,17500,2203,000000,Ingresos por el Impuesto Especial sobre las labores del tabaco,151998000,151998000,"100696039,84"
2023,152000,17500,2204,000000,Ingresos por el Impuesto Especial sobre hidrocarburos,191842000,191842000,"167181444,36"
2023,152000,17500,2206,000000,Ingresos por el Impuesto Especial sobre productos intermedios,103000,103000,"112899,18"
2023,152000,17500,2207,000000,Ingresos por el Impuesto Especial sobre la electricidad,24198000,24198000,"2916923,46"
2023,152000,17500,2208,000000,Impuesto sobre la eliminación en vertedero y la incineración de residuos,5700000,5700000,"4399242,6"
2023,152000,17500,2210,000000,Impuesto sobre las ventas minoristas de hidrocarburos,0,0,0
2023,152000,17500,2810,000000,Impuesto sobre las primas de seguros,28752000,28752000,"20291402,1"
2023,152000,17500,2840,000000,Impuesto sobre actividades de juego,1890000,1890000,2428571
2023,152000,17500,2850,000000,Impuesto sobre gases fluorados de efecto invernadero,780000,780000,"527714,23"
2023,152000,17500,2860,000000,Impuesto sobre Transacciones Financieras,0,0,"2399566,95"
2023,152000,17500,2870,000000,Impuesto sobre Determinados Servicios Digitales,0,0,"6651191,55"
2023,152000,17500,3000,000000,Tasas de juego,10504000,10504000,"8788213,39"
2023,152000,17500,3050,000000,Canon de superficie de minas,50000,50000,"16546,64"
2023,152000,17500,3080,000000,Canon de Telefónica,252000,252000,"53429,47"
2023,152000,17500,3309,000000,Ingresos por la venta de cartones de juego,60000,60000,"34665,9"
2023,152000,17500,3910,000000,Sanciones,12600000,12600000,"8275742,35"
2023,152000,17500,4000,000000,Transferencia del Estado por la ayuda para sufragar el precio del gasóleo consumido por productores agrarios,0,8000000,0
2023,152000,17500,4000,000002,Transferencia del Estado para financiar las ayudas al gasóleo profesional,0,15000000,0
2023,154000,17600,3090,000000,Tasas sobre la información suministrada,11000,11000,"4781,36"
2023,154003,17600,1120,000000,Ingresos por el Impuesto sobre Sucesiones y Donaciones,50520000,50520000,"40372824,89"
2023,154003,17600,2820,000000,Ingresos por el Impuesto sobre Transmisiones Patrimoniales,70224000,70224000,"41934436,76"
2023,154003,17600,2830,000000,Ingresos por el Impuesto sobre Actos Jurídicos Documentados,19080000,19080000,"13025370,72"
2023,155002,17800,3890,000000,Ingresos por la compensación de costas en procedimientos de apremio,152000,152000,"163799,39"
2023,155002,17800,3912,000000,Recargos de apremio,8004000,8004000,"10132808,9"
2023,155002,17800,5201,000000,Intereses por la deuda fraccionada en vía de apremio,1348000,1348000,"186182,31"
2023,155004,17800,3911,000000,Intereses de demora de deudas no aplazadas,10,10,1729816
2023,155004,17800,5201,000000,Intereses de demora de deudas aplazadas,4620000,4620000,"1257021,17"
2023,156000,17900,3309,000000,Ingresos por venta de impresos,2500,2500,"1800,15"
2023,156001,17900,4600,000000,Convenio con Haciendas Locales de Navarra,2300000,2300000,"1363531,85"
2023,157001,17A00,1005,000000,Ingresos por el IRPF,1825850600,1825850600,"1472836384,49"
2023,157001,17A00,1005,000002,"Fondo 0,7% IRPF de otros fines de interés social",10739000,10739000,0
2023,157001,17A00,1005,000003,Anticipo pensiones viudedad,-2844000,-2844000,"-2031855,25"
2023,157001,17A00,1005,000004,Anticipo renta emancipación y de acceso a la vivienda,-10440000,-10440000,"-8310547,11"
2023,157001,17A00,1100,000000,Ingresos por el Impuesto sobre el Patrimonio,43310000,43310000,"34919174,24"
2023,157001,17A00,4000,000000,Transferencia del Estado por la Línea directa ayuda a personas físicas de bajo nivel de ingresos y patrimonio,0,10000000,3849200
2023,160000,17100,1005,000005,Ajuste por retenciones de trabajo y de capital,0,146168190,"115441412,5"
2023,160000,17100,2100,000002,Ajuste fiscal IVA,1133644000,1133644000,"929901854,81"
2023,160000,17100,2200,000002,Ajuste fiscal I.E. Alcohol y bebidas derivadas,-33405000,-33405000,"-26988432,78"
2023,160000,17100,2202,000002,Ajuste fiscal I.E. Cerveza,5630000,5630000,"4293413,79"
2023,160000,17100,2203,000002,Ajuste fiscal I.E. Tabaco,2130000,2130000,"7517216,2"
2023,160000,17100,2204,000002,Ajuste fiscal I.E. Hidrocarburos,170694000,170694000,"43870401,57"
2023,160000,17100,2205,000002,Ajuste fiscal I.E. Envases plástico,0,0,"4790700,9"
2023,160000,17100,2850,000002,Ajuste fiscal I. Gases fluorados,0,0,"742499,17"
2023,160000,17100,4000,000000,Participación de las diputaciones en los ingresos del Estado,90000,90000,"90007,35"
2023,160000,17100,4000,000003,Participación en el gravamen temporal energético,0,0,"13078512,34"
2023,160000,17100,4000,000004,Participación en el gravamen temporal de entidades de crédito,0,0,"10193949,54"
2023,200000,20100,3010,000000,Tasas y actuaciones administrativas,2000,2000,625
2023,200000,20100,3990,000000,Ingresos por expedientes de responsabilidad patrimonial,1000,1000,0
2023,200000,20100,3990,000002,Otros ingresos,2000,2000,"7422,91"
2023,210000,21100,4410,000000,Consumo eléctrico. Oficina del Defensor del Pueblo,10,10,"41340,54"
2023,210001,21000,3010,000000,Tasas por servicios administrativos,10,10,0
2023,210001,21100,3070,000000,Tasas por participar en procesos de selección,0,0,"31657,6"
2023,210001,21100,3800,000000,Reintegros de bonificaciones fiscales,10,10,"28040,39"
2023,210001,21100,4000,000002,Reto demográfico,0,0,"-195934,3"
2023,210001,21100,7000,000002,Reto demográfico,0,0,"-236784,94"
2023,210001,21200,3800,000000,Reintegro Fondo. Corporativos,10,10,0
2023,210001,21200,3810,000000,Reintegro del presupuesto corriente. Montepíos,10,10,0
2023,210001,21200,8210,000000,Reintegro fondo anticipado. Equilibrio presupuestario,10,10,0
2023,210001,21300,6800,000000,Reintegros de subvenciones de capital,0,0,"55612,63"
2023,211000,21300,6800,000000,Reintegro. Plan de Inversiones Locales,10,10,"372141,28"
2023,220000,20200,5500,000000,Canon anual de la concesión del área de servicio de la Autovía del Camino,50800,50800,"50968,05"
2023,220000,22000,3800,000000,Reintegros por expropiación de terrenos,10,10,0
2023,220000,22000,3800,000002,Reintegros,0,0,"158143,76"
2023,220000,22000,3990,000000,Revisión de precios,10,10,0
2023,220000,22000,6000,000000,Ingresos por reversión de terrenos,10,10,0
2023,220001,22300,3309,000000,Ventas de planos y fotografías,3500,3500,"5506,52"
2023,220001,22300,7400,000000,"Aportación de Canal de Navarra, S.A., por expropiación de terrenos y servicios",10,10,0
2023,220001,22300,7600,000000,Convenio Ayuntamiento de Pamplona cartografía,123246,123246,"182796,24"
2023,220002,22100,3990,000000,Otros ingresos,0,0,"93191,25"
2023,220002,22100,7600,000003,Convenio construcción nuevo vial de conexión de Barañáin con la carretera NA-30 en Landaben,0,"2780930,75","2780930,75"
2023,220003,22200,3090,000000,Autorizaciones,30000,30000,"37347,16"
2023,220003,22200,3910,000000,Multas y sanciones,80000,80000,0
2023,220003,22200,3990,000000,Ingresos por daños en señalización y otros,350000,350000,"310066,62"
2023,220003,22200,5400,000000,Canon área servicio Mugiro en la A-15,0,0,"111751,78"
2023,220004,22100,3800,000000,Reintegro canon de los riegos del Canal de Navarra. Ampliación 1ª fase,10,10,0
2023,230000,23000,3800,000002,Reintegros,10,10,"1779,66"
2023,230000,23000,3911,000000,Intereses de demora,10,10,0
2023,230000,23200,7000,000002,MRR Transporte sostenible,10,10,0
2023,230001,23100,3800,000000,Reintegro remanente aportación al transporte público de la Comarca de Pamplona,10,10,"113816,58"
2023,230001,23100,4000,000000,Ayudas directas al transporte público interurbano,10,"398724,29","398724,29"
2023,230001,23100,4600,000000,Convenio Ayuntamiento de Larraun. Transporte público de viajeros a la demanda,0,0,"-9070,61"
2023,230001,23100,5500,000000,Cánones prestación de servicios de transporte público regular de viajeros,10000,10000,0
2023,230002,23200,3010,000000,Tasas por servicios administrativos,65000,65000,39436
2023,230002,23200,3040,000000,Ingresos por tasas de tarjetas de transporte,160000,160000,"289068,54"
2023,230002,23200,3070,000000,Tasas de exámenes de transportista,14000,14000,5370
2023,230002,23200,3309,000000,Venta de tarjetas para tacógrafos digitales,10,69885,83181
2023,230002,23200,3910,000000,Sanciones de transportes,1580000,1580000,"1307894,47"
2023,230002,23200,4000,000000,Ayudas directas a empresas y profesionales especialmente afectados por la subida de los precios de los carburantes,10,"1896184,07","7552592,76"
2023,300000,30000,3990,000000,Otros ingresos,0,0,"7632,52"
2023,310000,31100,3010,000000,Tasas y actuaciones administrativas,10,10,0
2023,310000,31100,3090,000000,Solicitud de autorización tasas establecimiento comercial,10,10,0
2023,310000,31100,3910,000000,Multas e indemnizaciones,30000,30000,84447
2023,320000,32100,3890,000000,Devolución de subvenciones de viviendas de protección oficial y rehabilitación,150000,150000,"270840,21"
2023,320000,32100,3910,000000,Multas e indemnizaciones,50000,50000,"15107,24"
2023,320000,32100,3990,000000,Otros ingresos,1000,1000,"10509,64"
2023,320000,32100,4901,000000,Proyecto LC DISTRICTS,18063,18063,"18062,5"
2023,320000,32100,5109,000000,Ingresos financieros de intereses de préstamos de suelo y vivienda,1000,1000,0
2023,320000,32100,5400,000000,Alquileres de locales y viviendas,47500,47500,"74376,76"
2023,320000,32100,6000,000000,Ingresos por venta de suelo del Banco Foral de Suelo Público,10,10,0
2023,320000,32100,7000,000000,MRR Subvenciones programa PREE. Rehabilitación energética de edificios,10,10,0
2023,320000,32100,7000,000002,MRR Subvenciones programa PREE 5000 Rehabilitación energética de edificios en municipios de reto demográfico,10,10,1707500
2023,320000,32100,7000,000003,MRR Subvenciones fondos europeos arrendamiento protegido,6900000,6900000,6900000
2023,320000,32100,7000,000004,MRR Subvenciones fondos europeos rehabilitación protegida,12144000,12144000,9584100
2023,320000,32100,8219,000000,Devolución de préstamos concedidos a promotores públicos y asimilados,28800,28800,0
2023,320000,32100,8311,000000,"Amortización de préstamos para viviendas, locales y suelo. Particulares",57000,57000,0
2023,330000,33100,4000,000000,MRR Proyecto territorial para el equilibrio y la equidad del Pirineo,10,10,0
2023,330000,33100,7000,000000,MRR Proyecto territorial para el equilibrio y la equidad del Pirineo,10,10,0
2023,330000,33100,7000,000002,MRR PIREP,10,10,0
2023,330000,33100,7901,000000,REACT Ingresos Rehabilitación ecológica Palacio de Arce y su entorno en Nagore PO FEDER 14-20,1933040,1933040,0
2023,330000,33100,7901,000002,REACT Alloz Sostenible PO FEDER 14-20,719000,719000,0
2023,400000,41000,3010,000000,Tasas por servicios administrativos,40000,40000,"6067,48"
2023,400000,41000,3070,000000,Tasas por participación en oposiciones,30000,30000,"-1331,2"
2023,400000,41000,3100,000000,Ingresos por prestación de servicios educativos y otros,1500000,1500000,"115555,1"
2023,400000,41000,3800,000000,Reintegros de ejercicios cerrados,10,10,"490433,04"
2023,400000,41000,3810,000000,Reintegros de ejercicios corrientes,10,10,"42846,44"
2023,400000,41000,3890,000000,Reintegros de la Seguridad Social,10,10,"40571,18"
2023,400000,41000,3911,000000,Intereses de demora,10,10,0
2023,400000,41000,3990,000000,Ingresos varios,10,10,"326985,01"
2023,410001,41800,5400,000000,"Ingresos por arrendamiento de ""Casa Maxurrenea""",30571,30571,"27104,76"
2023,410001,41800,7000,000000,MRR Obras en centros educativos 0-3,2420381,2420381,0
2023,410001,41800,7600,000000,Construcción de nuevos centros y obras. Plan de centros escolares,10,10,80000
2023,410001,41800,7901,000000,REACT Ingresos PO FEDER 14-20,14082683,14082683,0
2023,410002,41600,3800,000000,Devolución de becas,10,10,"31410,67"
2023,410002,41600,3800,000002,Devoluciones del programa de gratuidad,10,10,"36076,33"
2023,420000,42000,4000,000000,Desarrollo pruebas evaluación final,10,10,0
2023,420000,42100,4900,000000,Ingresos proyecto PATHWAYS. EASI,14977,14977,0
2023,420001,42400,3070,000000,Tasas de expedición del título de aptitud en euskera,8000,8000,2709
2023,420001,42400,3070,000002,Pruebas de acceso a los estudios superiores de diseño,1500,1500,"2070,01"
2023,420001,42400,3100,000000,Derechos de exámenes para la prueba homologada de idiomas,10,10,0
2023,420001,42400,3100,000002,Derechos de exámenes para el título de aptitud en euskera,11000,11000,"26,2"
2023,420002,42100,3070,000000,Tasas de expedición de títulos,295000,295000,"194928,6"
2023,420002,42100,3100,000000,Prestación de servicios educativos: Aulas Mentor,10,"850,99",1344
2023,420004,42700,4000,000000,MRR PROA+,2704474,2704474,2704474
2023,420004,42700,4000,000002,MRR Unidades de acompañamiento,690305,690305,690305
2023,420004,42700,4900,000000,Proyecto GATE. Erasmus+,13417,13417,0
2023,420007,42900,3100,000000,Ingresos escuelas infantiles,509518,509518,"385430,56"
2023,422000,43000,3800,000000,Reintegros de ejercicios cerrados,10,10,0
2023,422000,43000,4000,000000,MRR Plan de modernización de la FP,8783375,8783375,"7567502,92"
2023,422000,43000,7000,000000,MRR Plan de modernización de la FP,266200,266200,220000
2023,422001,43100,3070,000000,Pruebas de acceso grado medio y superior,7000,7000,7929
2023,422001,43100,3070,000003,Pruebas de acceso para enseñanzas deportivas,7000,7000,6035
2023,422001,43100,3070,000004,Pruebas libres modulares para la obtención de títulos de Formación Profesional,8000,8000,7665
2023,422001,43100,4000,000000,Acciones en Centros de Referencia Nacional,244244,244244,"-35310,15"
2023,422001,43100,4000,000006,Formación para el empleo. Plan de empleo. Conferencia Sectorial,11268266,11268266,0
2023,422001,43100,4000,000007,MRR Acciones Red Centros de Capacitación Digital,0,309100,"620963,94"
2023,422002,43200,3010,000000,Tasas por expedición de certificados de profesionalidad,18000,18000,19210
2023,422002,43200,3100,000000,Convenios con empresas para programas de acreditación de la competencia profesional,10,10,0
2023,422002,43200,3800,000000,Reintegro de ejercicios cerrados,0,0,1300
2023,422002,43200,3810,000002,Erasmus+. Reintegro de ejercicios corrientes,10,10,2250
2023,422002,43200,4000,000008,Desarrollo del Sistema Nacional de Cualificaciones y FP y mejora de la difusión de la FP,10,10,0
2023,422002,43200,4000,000009,Ingresos para la formación permanente del profesorado,10,10,0
2023,422002,43200,4000,000010,MRR Acciones en centros de excelencia de FP,0,2209952,3000000
2023,422002,43200,4900,000003,Programa ERASMUS+. SEPIE,660000,660000,"122963,7"
2023,500000,51000,3010,000000,Tasas por servicios administrativos,720,720,5365
2023,500000,51000,3890,000000,Devolución de pagos,3000,3000,"55359,24"
2023,500000,51000,3910,000000,Multas y sanciones,300000,300000,"146185,56"
2023,500000,51000,3910,000002,COVID-19 Multas y Sanciones,0,0,"-19164,8"
2023,500000,51000,3911,000000,Intereses de demora,10,10,0
2023,500000,51000,4000,000000,Subvención en el programa de trasplantes,10,10,0
2023,511001,51100,3129,000000,Ingresos por prestaciones de otros servicios sanitarios (autorizaciones de farmacia),17000,17000,13465
2023,511001,51100,3129,000002,Ingresos por prestaciones de otros servicios sanitarios (autorizaciones de centros),35000,35000,37015
2023,511001,51100,3129,000003,Ingresos por prestaciones de otros servicios sanitarios (inspección y varios),3000,3000,523
2023,511004,51100,3129,000000,Ingresos por prestaciones de otros servicios sanitarios (convenio especial prestación sanitaria CFN),3500,3500,2826
2023,512000,51300,4000,000000,MRR Ingresos para formación de profesionales sanitarios,10,"74949,45","74949,45"
2023,512000,51300,7901,000002,Ingresos PO FEDER 2014-2020 Navarra,542500,542500,0
2023,520000,51200,3090,000000,Tasas por análisis de salud pública,20000,20000,2801
2023,520000,51200,3090,000002,Otras tasas,50000,50000,"21413,5"
2023,520000,51200,3090,000003,Tasas servicios de inspección veterinaria,300000,300000,"236806,31"
2023,520000,51200,3199,000000,Ingresos Consejo Seguridad Nuclear,25000,25000,"59860,53"
2023,520000,51200,3890,000000,Otros reintegros,10,10,"18856,76"
2023,520000,51200,3990,000000,Otros ingresos,10,10,"11444,51"
2023,520000,51200,4000,000002,MRR Campaña programa poblacional de detección precoz de cáncer de Navarra,81370,81370,"81369,51"
2023,520000,51200,4300,000000,Transferencias corrientes de fundaciones forales,0,0,90000
2023,520000,51200,4411,000000,Transferencias corrientes de entes públicos del Estado,10,10,0
2023,520000,51200,4411,000002,Intensificación de la actividad investigadora,10,10,"2884,77"
2023,520000,51200,4901,000000,Ingresos de proyectos comunitarios,10,10,0
2023,520000,51200,7000,000000,MRR Red Vigilancia de Salud Pública,0,0,"476545,59"
2023,540000,52000,3070,000000,Tasas académicas y derechos de examen,8000,8000,"124300,8"
2023,540000,52000,3129,000000,Otros ingresos,5000,5000,"10588,7"
2023,540000,52000,3800,000000,Reintegro de retribuciones abonadas indebidamente,2000,2000,"359531,94"
2023,540000,52000,3800,000003,COVID-19 Reintegro de retribuciones abonadas indebidamente,1000,1000,0
