2024,400000,40000,2301,321100,Gastos de viaje del Sr. Consejero y personal de su Gabinete,2652,2652,"5400,06"
2024,400000,40001,1200,321100,Retribuciones del personal fijo,71172,"67492,86","67492,86"
2024,400000,40001,1210,321100,Retribuciones del personal contratado para cubrir plazas reservadas,10,0,0
2024,400000,40001,1211,321100,Retribuciones del personal contratado para cubrir vacantes,25991,"26564,77","22042,05"
2024,400000,40100,1200,321100,Retribuciones del personal fijo,797133,"866319,05","864703,74"
2024,400000,40100,1210,321100,Retribuciones del personal contratado para cubrir plazas reservadas,76452,"62397,69","57376,1"
2024,400000,40100,1211,321100,Retribuciones del personal contratado para cubrir vacantes,384302,"273832,98","272712,23"
2024,400000,40100,2200,321100,Material de oficina,82630,82630,"55718,3"
2024,400000,40100,2221,321100,Servicios postales,127286,"95821,99","28160,01"
2024,400000,40100,2269,321100,Gastos diversos,2861,2861,"1655,54"
2024,400000,40100,2301,321100,Locomoción y gastos de viaje del personal funcionario y contratado,1000,1000,0
2024,400000,40100,3501,321100,Intereses de demora,10,"99,87","99,87"
2024,400000,40100,4809,321100,Indemnizaciones por responsabilidad patrimonial y ejecución de sentencias,51000,"130589,26","129863,26"
2024,400000,40140,1200,321100,Retribuciones del personal fijo,47182,"8452,47",0
2024,400000,41000,1200,322000,Retribuciones del personal fijo,220786709,"219678141,98","219618200,28"
2024,400000,41000,1210,322000,Retribuciones del personal contratado para cubrir plazas reservadas,15382485,"15287192,22","15185996,98"
2024,400000,41000,1211,322000,Retribuciones del personal contratado para cubrir vacantes,6652563,"6564697,89","6435489,62"
2024,400000,41000,1220,322000,Retribuciones del personal contratado temporal,124566309,"135467910,71","135426140,66"
2024,400000,41000,1221,322000,Retribuciones del personal contratado para campañas,275000,371970,"346627,08"
2024,400000,41000,1250,322000,Retribuciones del personal contratado para sustituciones,26429180,"31261821,32","31261821,32"
2024,400000,41000,1400,322000,Retribuciones personales,49276122,"49947177,61","49672498,83"
2024,400000,41000,1410,322000,Retribuciones carrera profesional,32902,"50699,49","45746,73"
2024,400000,41000,1600,322000,Seguridad Social,88846505,"93619504,51","93548617,09"
2024,400000,41000,1702,321100,Horas extraordinarias,10,"20135,98","20059,77"
2024,400000,41000,1703,322000,Remuneración por trabajo en días festivos,10,12,0
2024,400000,41000,1705,322000,Complemento por trabajo en turnos de noche,86517,"76184,88","10485,74"
2024,400000,41000,1707,322000,Remuneración por trabajo a turnos,177607,"174991,59","86340,74"
2024,400000,41000,1800,322000,"Reconocimiento de servicios, nuevos complementos, grado, antigüedad, reingresos de excedencias y otros",10,10,0
2024,400000,41000,1810,322000,Retribuciones de personal de ejercicios anteriores,400833,"2965353,45","2960484,44"
2024,400000,41000,1820,322000,"Ejecución de sentencias, indemnizaciones y compensaciones por estabilización",65000,"1604770,3","1496149,75"
2024,400000,41000,2202,321100,Suscripción y adquisición de publicaciones,4578,4578,"1048,36"
2024,400000,41000,2262,321100,Publicidad y propaganda,52020,52020,"26450,53"
2024,410000,41000,1000,321100,Retribuciones de altos cargos,64563,66179,"66163,58"
2024,410000,41000,1200,321100,Retribuciones del personal fijo,205805,"124758,42","120768,06"
2024,410000,41000,2266,321100,Gastos de actividades formativas,500,500,"897,01"
2024,410000,41000,2269,321100,Gastos diversos,2918,2918,"1977,9"
2024,410000,41000,2274,321100,Servicios de Seguridad,279355,279355,"280937,5"
2024,410000,41000,2301,321100,Locomoción y gastos de viaje del personal funcionario y contratado,247504,247504,"176778,96"
2024,410000,41000,4400,321100,"Transferencias a Navarra Impulsa Cultura, Deporte y Ocio para programas educativos del Planetario",50173,50173,50173
2024,410000,41100,1200,321100,Retribuciones del personal fijo,427632,"390365,92","384997,58"
2024,410000,41100,1210,321100,Retribuciones del personal contratado para cubrir plazas reservadas,34567,"90983,42","90978,4"
2024,410000,41100,1211,321100,Retribuciones del personal contratado para cubrir vacantes,135899,98662,"83050,87"
2024,410000,41600,1200,321100,Retribuciones del personal fijo,144816,"177466,69","173485,05"
2024,410000,41600,1210,321100,Retribuciones del personal contratado para cubrir plazas reservadas,10,0,0
2024,410000,41600,1211,321100,Retribuciones del personal contratado para cubrir vacantes,73273,"71446,24","62041,48"
2024,410000,41600,2269,324200,Apoyo al funcionamiento del Consejo Escolar,35700,35700,35700
2024,410000,41600,2290,322000,Financiación del funcionamiento de centros docentes no universitarios,13241000,12241000,"10079676,23"
2024,410000,41600,2290,322002,Gastos de funcionamiento. FPB/TP ubicados fuera de los centros de FP,167321,167321,"52445,2"
2024,410000,41600,4609,322004,Transferencias por uso de espacios municipales por alumnado de Secundaria y Formación Profesional,1100000,1100000,"839029,14"
2024,410000,41800,2120,321100,Gastos de mantenimiento de edificios propios,153000,"104784,88","177808,42"
2024,410000,41800,2120,322000,Gastos de reparación y conservación de centros escolares propios,1000000,"1008693,35","1492609,61"
2024,410000,41800,2120,322002,Abono de siniestros,10,"54979,02","54969,02"
2024,410000,41800,2220,321102,Encargo a NASERTIC. Servicios de telecomunicaciones de edificios propios,14649,14649,"8919,72"
2024,410000,41800,2271,322002,Limpieza de los centros docentes públicos,5383705,5383705,"5042812,5"
2024,410000,41800,2279,322000,Otros gastos de mantenimiento de centros,229919,229919,"173378,23"
2024,410000,41800,2280,321100,"Gastos de funcionamiento de edificios propios. Energía eléctrica, agua y calefacción",1066156,1066156,"310907,89"
2024,410000,41800,2283,321100,Material para reparaciones de edificios propios,31212,31212,"10674,97"
2024,410000,41800,6020,325102,Obras de mantenimiento en el departamento,225000,225000,"149946,98"
2024,410000,41800,6020,325103,Otras obras del departamento,418768,418768,"10355,18"
2024,410000,41800,6040,321100,Adquisición de elementos de transporte,10,10,0
2024,410000,41800,6050,325100,Mobiliario del departamento,40000,40000,"61804,76"
2024,410000,41800,6054,325100,Material técnico y equipos para el departamento,10200,10200,"9514,5"
2024,410001,41800,1200,321100,Retribuciones del personal fijo,789145,"628706,22","620716,58"
2024,410001,41800,1210,321100,Retribuciones del personal contratado para cubrir plazas reservadas,10,"14017,48","14017,48"
2024,410001,41800,1211,321100,Retribuciones del personal contratado para cubrir vacantes,309047,"254618,26","247280,84"
2024,410001,41800,2276,321100,Estudios y trabajos técnicos,56000,56000,"75691,76"
2024,410001,41800,6020,325100,Construcción de nuevos centros y obras. Plan de Centros Escolares,4892024,3317724,"2391674,82"
2024,410001,41800,6020,325103,Obras para el desarrollo de los centros de Formación Profesional,4302893,3802893,"2388052,56"
2024,410001,41800,6020,325112,Obras de mantenimiento en centros escolares,2380000,"2682278,24","2637242,9"
2024,410001,41800,6020,325136,MRR Obras en centros educativos 0-3,5560202,"5589178,21","896182,74"
2024,410001,41800,6020,325137,Obras en centros educativos 0-3,200000,200000,"101606,24"
2024,410001,41800,6020,325139,"Inversiones en Leitza por ""Casa Maxurrenea""",36140,36140,48400
2024,410001,41800,6059,325100,Equipamiento en centros públicos,1461650,1461650,"1277564,95"
2024,410001,41800,7609,325100,Obras en centros educativos de propiedad municipal,1500000,1500000,"1346384,15"
2024,410001,41800,7609,325103,Construcción de nuevos centros y obras. Plan de Centros Escolares,3367107,5191407,"3365851,82"
2024,410001,41800,7609,325106,Obras en centros educativos 0-3 de propiedad municipal,250000,250000,"242478,48"
2024,410001,41800,7609,325139,Redacción del proyecto para nuevo colegio público en Aiegi,100000,100000,0
2024,410001,41800,7609,325153,MRR Obras en centros educativos 0-3 de propiedad municipal,3546473,"3543115,34","419493,54"
2024,410001,41800,7609,325157,(E) Convenio con el Ayuntamiento de Berriozar para la mejora de la cubierta Colegio Mendialdea,75000,75000,75000
2024,410001,41800,7609,325159,(E) Convenio con el Ayuntamiento de Pamplona para la rehabilitación del Colegio Público San Francisco,75000,75000,"74951,19"
2024,410001,41800,7609,325173,Convenio Ayto. Valle de Egües. Construcción cubierta patio CPEIP/HLHIP Joakin Lizarraga de Sarriguren,250000,250000,250000
2024,410001,41800,7609,325174,Convenio con el Ayuntamiento de Ultzama para la reforma de la segunda planta del colegio público,125000,125000,125000
2024,410001,41800,7609,325175,Convenio con el Ayuntamiento de Lesaka para la primera fase de la reforma del patio del colegio público,40000,40000,39446
2024,410001,41800,7609,325176,(E) Convenio con el Ayto. de Falces para la adecuación de aulas del CP de Falces para la creación de aulas 0-3 años,125000,125000,125000
2024,410001,41800,7609,325177,(E) Convenio Ayto. Lekunberri y Ayto. Larraun. Ejecución de porche para la Eskola Ibarberri,98000,98000,98000
2024,410001,41800,7609,325178,(E) Actuaciones en el edificio del CPEIP Otero de Navascués de Cintruénigo,50000,50000,0
2024,410001,41800,7609,325179,(E) Convenio con el Ayuntamiento de Castejón para ampliación cubierta del CPEIP Castejón 2 de Mayo,50000,50000,50000
2024,410001,41800,7609,325180,(E) Convenio con Ayto. Corella para el cambio de luminarias del colegio y cubierta del patio de educación infantil,40000,40000,0
2024,410001,41800,7609,325181,(E) Convenio Ayuntamiento de Berrioplano para ampliación del espacio de psicomotricidad en la Escuela Infantil de Artica,30000,30000,30000
2024,410001,41800,7609,325182,(E) Convenio con el Ayto. Buñuel para adecuación de los baños de Colegio Público e instalación de plataformas,30000,30000,30000
2024,410001,41800,7609,325183,(E) Transferencia Ayto. Tudela para construcción cubierta parque infantil CP Huertas Mayores,20000,20000,20000
2024,410001,41800,7609,325184,(E) Convenio con el Ayuntamiento de Tudela para proyecto de construcción de cubierta de patio del CP Huertas Mayores,20000,20000,"11797,5"
2024,410001,41800,7609,325185,(E) Convenio con el Ayto. de Corella para la climatización del CP Ciudad de Corella con autogeneración eléctrica,15000,15000,0
2024,410001,41800,7609,325186,(E) Convenio con el Ayuntamiento de Olite para obras en el patio del colegio,10000,10000,"9457,5"
2024,410001,41800,7609,325187,(E) Convenio Ayto. de Monteagudo para realizar mejoras en el Colegio Público de Monteagudo,4600,4600,4600
2024,410001,41800,7609,325188,(E) Transferencia Ayto. Betelu. Acondicionamiento instalaciones deportivas y zona infantil del CP Comarcal Araxes,30000,30000,30000
2024,410003,41600,4811,322100,2º Ciclo de Educación Infantil. Centros privados concertados y/o subvencionados,21754632,22104632,"21867639,53"
2024,410003,41600,4811,322200,1º Ciclo de Educación Secundaria.  Centros privados concertados y/o subvencionados,21539138,22489138,"22294884,09"
2024,410003,41600,4811,322202,2º Ciclo de Educación Secundaria. Centros privados concertados y/o subvencionados,24745810,26245810,"26097452,26"
2024,410003,41600,4811,322400,Educación Especial. Centros privados concertados y/o subvencionados,9196197,8546197,"8354379,95"
2024,410003,41600,4811,322402,Necesidades educativas específicas. Centros privados concertados y/o subvencionados,5769679,4609679,"4332441,88"
2024,410003,41600,4811,322403,Inmigración y minorías culturales. Centros privados concertados y/o subvencionados,814595,814595,"451795,92"
2024,410003,41600,4811,322C00,Bachillerato. Centros privados concertados y/o subvencionados,13357330,12537330,"12289885,38"
2024,410003,41600,4811,322D00,Educación Primaria. Centros privados concertados y/o subvencionados,55266304,56766304,"56407883,36"
2024,410003,41600,4811,322D02,Atención al alumnado con dificultades de escolarización,1345392,1345392,"1154068,25"
2024,410003,41600,4811,322E00,Ciclos formativos de grado básico y medio,9709240,8349240,"8164651,86"
2024,410003,41600,4811,322E02,Ciclos formativos de grado superior. Centros privados concertados y/o subvencionados,5048727,4738727,"4525495,13"
2024,410005,41400,1200,321100,Retribuciones del personal fijo,137978,"228001,31","222067,11"
2024,410005,41400,1210,321100,Retribuciones del personal contratado para cubrir plazas reservadas,10,"3279,73","3279,73"
2024,410005,41400,1211,321100,Retribuciones del personal contratado para cubrir vacantes,307552,"216448,88","213610,13"
2024,410005,41400,2267,322000,Gastos de oposiciones,187000,187000,"149107,14"
2024,410005,41400,2301,322000,Locomoción y gastos de viaje. Tribunales oposición,650000,650000,"659208,6"
2024,410005,41400,2330,322000,Indemnización por trabajos realizados en tribunales,2768230,2768230,"1643211,16"
2024,410005,41500,1200,321100,Retribuciones del personal fijo,307294,"346260,36","341098,87"
2024,410005,41500,1210,321100,Retribuciones del personal contratado para cubrir plazas reservadas,25991,"17513,77","13651,71"
2024,410005,41500,1211,321100,Retribuciones del personal contratado para cubrir vacantes,270734,"233357,94","232245,58"
2024,410005,41700,1200,321100,Retribuciones del personal fijo,360154,"284800,9","281063,28"
2024,410005,41700,1210,321100,Retribuciones del personal contratado para cubrir plazas reservadas,43319,"5776,56","4112,83"
2024,410005,41700,1211,321100,Retribuciones del personal contratado para cubrir vacantes,145831,"241190,26","231346,76"
2024,410005,41700,4819,321100,Compensación de gastos de funcionamiento de organizaciones sindicales,38350,38350,38350
2024,420000,42000,1000,321100,Retribuciones de altos cargos,64553,66167,"66163,58"
2024,420000,42000,1200,321100,Retribuciones del personal fijo,140634,"163962,38","133877,9"
2024,420000,42000,1210,321100,Retribuciones del personal contratado para cubrir plazas reservadas,10,"5709,35","5708,31"
2024,420000,42000,1211,321100,Retribuciones del personal contratado para cubrir vacantes,67861,"21629,24","21628,2"
2024,420000,42000,2269,321100,Gastos diversos,4000,4000,"6447,42"
2024,420000,42000,2301,321100,Locomoción y gastos de viaje del personal funcionario y contratado,96500,96500,"138353,5"
2024,420000,42000,4400,322G00,NICDO: Campaña escolar de esquí,60000,60000,60000
2024,420000,42000,4709,322G00,Campañas escolares de actividades en la naturaleza,50000,50000,50000
2024,420000,42000,4709,322G02,Actividades de iniciación deportiva dirigida a centros educativos,5000,5000,0
2024,420000,42000,4819,322G00,Campaña escolar de vela. Federación Navarra de Vela,65000,65000,65000
2024,420001,42400,1200,322900,Retribuciones del personal fijo,1018946,"996202,42","990756,83"
2024,420001,42400,1210,322900,Retribuciones del personal contratado para cubrir plazas reservadas,10794,"11062,38","11062,38"
2024,420001,42400,1211,322900,Retribuciones del personal contratado para cubrir vacantes,47577,"50233,37","50009,91"
2024,420001,42400,2120,322500,"Ciudad de la Música: Mantenimiento, reparación y conservación del edificio",44000,44000,"55948,26"
2024,420001,42400,2150,322500,Ciudad de la Música: Mantenimiento instrumentos y sistemas de sonido,10000,10000,"50499,51"
2024,420001,42400,2200,322500,Ciudad de la Música: Material de oficina,10000,10000,"9125,47"
2024,420001,42400,2202,322002,Recursos didácticos,20000,20000,20000
2024,420001,42400,2266,321203,Formación del profesorado en euskera,50000,50000,"17334,54"
2024,420001,42400,2266,321205,Formación del profesorado en enseñanzas artísticas y musicales,8000,8000,"5916,8"
2024,420001,42400,2266,321206,Jornadas y ferias de lenguas extranjeras,7000,7000,"5893,4"
2024,420001,42400,2266,322906,Formación del profesorado en idiomas,130000,130000,"67718,85"
2024,420001,42400,2267,322502,Pruebas de acceso a los estudios superiores de diseño,1500,1500,"967,36"
2024,420001,42400,2269,322002,Elaboración materiales didácticos,5000,5000,1560
2024,420001,42400,2269,322003,Promoción de ERASMUS + y otros programas europeos,7070,7070,"5712,36"
2024,420001,42400,2269,322004,Financiación olimpiadas escolares,500,500,"759,65"
2024,420001,42400,2269,322005,Funcionamiento del programa ERASMUS+. SEPIE,2065,2065,2065
2024,420001,42400,2269,322200,Tasas del programa Bachillerato Internacional,28000,28000,0
2024,420001,42400,2269,322500,Ciudad de la Música: Gastos diversos,98000,98000,"112425,1"
2024,420001,42400,2269,322502,Conciertos didácticos,27000,27000,"24986,99"
2024,420001,42400,2269,322900,Programas de uso del euskera,552000,552000,"353339,12"
2024,420001,42400,2269,322904,"Exámenes EGA, títulos y gastos de funcionamiento",15000,15000,"11523,14"
2024,420001,42400,2269,322905,Encargo a CNAI. Programas y formación,1550000,1550000,"1287794,65"
2024,420001,42400,2273,322500,Ciudad de la Música: Mantenimiento sistemas informáticos,8000,8000,"24293,49"
2024,420001,42400,2279,322500,Ciudad de la Música: Otros trabajos realizados por terceros,43500,43500,"64175,42"
2024,420001,42400,2280,322500,"Ciudad de la Música: Energía eléctrica, agua y calefacción",320000,320000,"207532,65"
2024,420001,42400,2330,322900,Indemnizaciones por trabajos realizados en tribunales,57000,57000,"60312,3"
2024,420001,42400,2330,322902,Pruebas certificativas,10000,10000,"8743,34"
2024,420001,42400,4609,322502,Subvención a escuelas de música,3400000,3400000,3400000
2024,420001,42400,4609,322503,Convenio con el Ayuntamiento de Tudela para el funcionamiento del Conservatorio Municipal de Música,500000,500000,500000
2024,420001,42400,4800,322500,Ayudas complementarias a la movilidad internacional del alumnado de Enseñanzas Artísticas Superiores,6000,6000,4500
2024,420001,42400,4809,321200,Ayuda para la formación del profesorado en euskera,10000,10000,10000
2024,420001,42400,4809,321202,Ayudas para la formación del profesorado en lenguas extranjeras,30000,30000,"19374,78"
2024,420001,42400,4809,322000,Programa ERASMUS+. SEPIE,36437,41208,41208
2024,420001,42400,4816,322002,Subvención actividades extraescolares culturales en euskera,30000,30000,"14797,31"
2024,420001,42400,4816,322500,Escuela Navarra de Teatro,45000,45000,45000
2024,420001,42400,6020,322500,Ciudad de la Música: Adecuación edificio,10000,10000,"9999,99"
2024,420001,42400,6050,322500,Ciudad de la Música: mobiliario y equipo de oficina,10000,10000,"9987,88"
2024,420001,42400,6059,322500,Ciudad de la Música: adquisición de instrumentos musicales,60000,60000,60000
2024,420001,42400,6081,322500,Ciudad de la Música: Adquisición de libros,3000,3000,"2967,56"
2024,420002,42100,1200,321100,Retribuciones del personal fijo,527219,"516118,85","516113,59"
2024,420002,42100,1200,321200,MRR CompDigEdu Retribuciones del personal fijo,505594,"826527,45","826527,45"
2024,420002,42100,1210,321100,Retribuciones del personal contratado para cubrir plazas reservadas,10,0,0
2024,420002,42100,1210,321200,MRR CompDigEdu Retribuciones del personal contratado para cubrir plazas reservadas,14165,"4425,48","3365,17"
2024,420002,42100,1211,321100,Retribuciones del personal contratado para cubrir vacantes,51981,"53277,56","53277,56"
2024,420002,42100,1220,321200,MRR CompDigEdu Retribuciones del personal contratado temporal,97599,"31454,88","29858,66"
2024,420002,42100,1250,321200,MRR CompDigEdu Retribuciones del personal contratado para sustituciones,12282,0,0
2024,420002,42100,1400,321200,MRR CompDigEdu Retribuciones personales,90803,"117794,88","105850,81"
2024,420002,42100,1600,321200,MRR CompDigEdu Seguridad Social,98336,"122644,43","104120,01"
2024,420002,42100,2266,321200,Actividades formativas del profesorado,500000,500000,"414722,55"
2024,420002,42100,2266,321203,Actividades formativas del personal CAP,5100,5100,0
2024,420002,42100,2266,321204,MRR Actividades formativas del profesorado,443340,"105241,37",0
2024,420002,42100,2269,322000,Expedición de títulos y edición de libros de escolaridad,40000,40000,"17952,53"
2024,420002,42100,2269,322003,Calidad,41920,41920,"36333,64"
2024,420002,42100,2269,322004,Programas formativos y proyectos de innovación en centros públicos,125000,125000,"114505,81"
2024,420002,42100,2269,322005,MRR CompDigEdu Gastos diversos,39874,"14634,83",0
2024,420002,42100,2269,322700,Centros de adultos y aulas itinerantes,87791,87791,"3339,6"
2024,420002,42100,2269,322702,Gastos de los cursos en las Aulas Mentor,10,2136,2136
2024,420002,42100,2279,322D00,Itinerarios culturales por Navarra,20000,20000,18150
2024,420002,42100,2290,321200,Gastos de funcionamiento de centros de apoyo al profesorado,98430,98430,0
2024,420002,42100,2301,321200,MRR CompDigEdu Locomoción y gastos de viaje,54345,"41813,81","11001,32"
2024,420002,42100,4809,321200,Ayudas individuales para la formación del profesorado,20000,20000,"13035,71"
2024,420002,42100,4811,322000,Programas formativos y proyectos de innovación en centros concertados,45000,45000,"36966,46"
2024,420002,42100,6054,321200,Adquisición de material para actividades formativas,11000,11000,"10864,32"
2024,420004,42700,1200,321100,Retribuciones del personal fijo,1884842,"1635401,26","1600272,53"
2024,420004,42700,1200,322002,MRR Uds Acompañamiento Retribuciones del personal fijo,34164,35019,27524
2024,420004,42700,1200,322004,MRR PROA+ Retribuciones del personal fijo,609158,"935882,71","885609,27"
2024,420004,42700,1200,322006,PROA FSE+ Retribuciones del personal fijo,0,505000,"502898,95"
2024,420004,42700,1210,321100,Retribuciones del personal contratado para cubrir plazas reservadas,25991,"8166,63","7880,07"
2024,420004,42700,1210,322002,MRR Uds Acompañamiento Retribuciones del personal contratado para cubrir plazas reservadas,4712,4830,0
2024,420004,42700,1210,322004,MRR PROA+ Retribuciones del personal contratado para cubrir plazas reservadas,17297,17731,"9006,2"
2024,420004,42700,1210,322006,PROA FSE+ Retribuciones del personal contratado para cubrir plazas reservadas,0,40200,"38203,23"
2024,420004,42700,1211,321100,Retribuciones del personal contratado para cubrir vacantes,196624,"226610,04","224990,82"
2024,420004,42700,1220,322002,MRR Uds Acompañamiento Retribuciones del personal contratado temporal,296084,"365199,85","270997,8"
2024,420004,42700,1220,322004,MRR PROA+ Retribuciones del personal contratado temporal,501920,"707921,49","591634,88"
2024,420004,42700,1220,322006,PROA FSE+ Retribuciones del personal contratado temporal,0,231170,"229170,63"
2024,420004,42700,1250,322002,MRR Uds Acompañamiento Retribuciones del personal contratado para sustituciones,16304,16715,"11088,38"
2024,420004,42700,1250,322004,MRR PROA+ Retribuciones del personal contratado para sustituciones,31292,32075,"22875,6"
2024,420004,42700,1250,322006,PROA FSE+ Retribuciones del personal contratado para sustituciones,0,12840,"10840,9"
2024,420004,42700,1400,322002,MRR Uds Acompañamiento Retribuciones personales,25461,26109,"22713,04"
2024,420004,42700,1400,322004,MRR PROA+ Retribuciones personales,135229,168726,"164367,09"
2024,420004,42700,1400,322006,PROA FSE+ Retribuciones personales,0,78724,"76724,11"
2024,420004,42700,1600,322002,MRR Uds Acompañamiento Seguridad Social,99178,"127855,15","110482,74"
2024,420004,42700,1600,322004,MRR PROA+ Seguridad Social,277534,"357049,55","324614,85"
2024,420004,42700,1600,322006,PROA FSE+ Seguridad Social,0,56000,"43352,98"
2024,420004,42700,2266,321205,MRR PROA+ Actividades formativas del profesorado,3000,3000,"2348,62"
2024,420004,42700,2269,321200,Convivencia,138853,138853,"71760,1"
2024,420004,42700,2269,321202,Coeducación e igualdad de género,454120,454120,176026
2024,420004,42700,2269,322400,Plan de Atención Diversidad. Acciones de compensación educativa a centros públicos alumnado desfavorecido,1203000,1203000,"1200000,1"
2024,420004,42700,2269,322402,Financiación de actividades para la integración socioeducativa de inmigrantes y minorías socioculturales,65000,65000,"39072,79"
2024,420004,42700,2301,322003,MRR PROA+ Locomoción y gastos de viaje,11000,31000,"28469,78"
2024,420004,42700,2301,322004,MRR Unidades de acompañamiento Locomoción y gastos de viaje,14000,14000,"10490,62"
2024,420004,42700,2301,322005,MRR Menttores Locomoción y gastos de viaje,0,"7780,75","7780,75"
2024,420004,42700,2400,322400,Elaboración material guías para centros,24825,24825,"19810,4"
2024,420004,42700,2400,322402,Adquisición y reposición de material especializado,28000,28000,0
2024,420004,42700,4609,322400,Subvención para actividades de integración socioeducativa,600000,505900,"414222,51"
2024,420004,42700,4809,322400,Ayudas a la educación especial,575000,575000,"499747,3"
2024,420004,42700,4809,322402,Ayudas para escuela de vacaciones para alumnado con discapacidades,100000,100000,"16907,05"
2024,420004,42700,4809,322403,Ayudas al alumnado de centros concertados para inmigración y minorías culturales,550000,550000,"412153,43"
2024,420004,42700,4811,322200,MRR PROA+ 1º Ciclo de Educación Secundaria. Subvención a la enseñanza privada,155555,45555,"27598,04"
2024,420004,42700,4811,322400,Subvención a centros privados concertados de educación especial,35100,70200,70200
2024,420004,42700,4811,322402,(E) Convenio con CEE Ibero Isterria. Funcionamiento centro escolar,30000,30000,0
2024,420004,42700,4811,322D00,MRR PROA+ Educación Primaria. Subvención a la enseñanza privada,46685,141685,"113894,97"
2024,420004,42700,4819,322000,Convenio Fundación Ilundain Haritz-Berri Programa Educar para prevenir adicciones en Centros Educativos de Navarra,75000,75000,0
2024,420004,42700,4819,322402,"Fundación Secretariado Gitano: programa ""promociona""",55000,55000,0
2024,420004,42700,4819,322403,(E) Convenio con APANA Asociación de Autoescuelas de Navarra. Proyecto Cambiamos de marcha,21600,21600,21600
2024,420004,42700,4819,324200,Subvención a asociaciones y federaciones de padres y alumnos,65000,124000,124000
