2024,A20001,A2100,6021,337102,MRR. Rehabilitación de patrimonio histórico de uso turístico,832487,"967511,96","919254,09"
2024,A20001,A2100,6041,337100,Adquisición de equipamiento,20000,20000,"19771,32"
2024,A20001,A2100,6054,333100,Material técnico y suministros de restauración,1000,1000,"807,88"
2024,A20001,A2100,6056,333102,Restauración de bienes muebles de museos propios,40000,40000,"21286,37"
2024,A20001,A2100,6056,337100,Restauración y protección del patrimonio mobiliario,80000,80000,"87497,01"
2024,A20001,A2100,6090,337103,Gastos para la implantación del Registro del Patrimonio Cultural,50000,50000,"49999,8"
2024,A20001,A2100,6090,337400,Inventario del Patrimonio Arqueológico,70000,70000,"69999,54"
2024,A20001,A2100,6094,337100,Informatización del Servicio de Patrimonio Histórico,30000,30000,"27276,19"
2024,A20001,A2100,7300,337100,Fundación para la Conservación del Patrimonio Histórico de Navarra,10,10,0
2024,A20001,A2100,7609,337100,Restauración y protección de edificios histórico-artísticos de Entidades Locales,1500000,500000,"474595,87"
2024,A20001,A2100,7609,337107,Restauración y protección de yacimientos arqueológicos de Entidades Locales,225000,225000,"222561,73"
2024,A20001,A2100,7609,337113,Transferencia Ayuntamiento del Valle de Ollo para intervención arqueológica en el Castillo de Garaño,15000,15000,15000
2024,A20001,A2100,7609,337115,Transferencia Ayto. Aranguren para intervención arqueológica en Irulegi,30000,30000,30000
2024,A20001,A2100,7609,337116,(E) Convenio con el Ayto. de Eslava. Yacimiento Santa Criz,25000,25000,25000
2024,A20001,A2100,7609,337121,Restauración y protección de patrimonio mobiliario de Entidades Locales,40000,40000,"17100,48"
2024,A20001,A2100,7609,337122,Transferencia Ayto. Auritz-Burguete para intervención arqueológica en el yacimiento de Zaldua,15000,15000,"14996,79"
2024,A20001,A2100,7609,337123,(E) Transferencia Ayto. Artzibar. Suministro cantería y otros para reconstrucción puente de Urdiroz sobre el río Urrobi,25000,25000,25000
2024,A20001,A2100,7609,337124,(E) Convenio con el Ayuntamiento de Marcilla para equipamientos en el salón de actos del castillo de Marcilla,27000,27000,"26802,1"
2024,A20001,A2100,7609,337125,(E) Convenio Ayto. Eslava. Adecuación casa parroquial para emplazamiento Museo Yacimiento Arqueológico Sta. Criz,30000,30000,30000
2024,A20001,A2100,7819,337100,Restauración y protección de edificios histórico-artísticos,200000,1000000,"876745,27"
2024,A20001,A2100,7819,337102,"MRR Medidas de conservación, restauración en Bienes de Interés Cultural",0,"11616,55","11616,53"
2024,A20001,A2100,7819,337104,Ayudas para  intervenciones en patrimonio mobiliario,70000,70000,"52944,75"
2024,A20002,A2500,1200,334100,Retribuciones del personal fijo,512861,"469830,61","468329,33"
2024,A20002,A2500,1210,334100,Retribuciones del personal contratado para cubrir plazas reservadas,10,12,0
2024,A20002,A2500,1211,334100,Retribuciones del personal contratado para cubrir vacantes,161711,165755,"165745,33"
2024,A20002,A2500,2200,331100,Material de oficina,5000,5000,"3690,91"
2024,A20002,A2500,2239,331100,"Mensajería, reparto y transportes",2000,2000,"360,63"
2024,A20002,A2500,2262,334100,Campañas de comunicación y publicidad de programas culturales propios,98000,98000,"100298,25"
2024,A20002,A2500,2269,334100,Gastos diversos,35000,"27647,39","7621,56"
2024,A20002,A2500,2276,335100,MRR Asistencia técnica para la convocatoria de Ayudas para la inversión en infraestructuras de AAEE y Música,10,"5510,05","5500,05"
2024,A20002,A2500,2276,335102,Asistencia técnica para las convocatorias de Ayudas de los Fondos Next Generation,15000,15000,"13763,35"
2024,A20002,A2500,2276,335200,MRR Asistencia técnica para la convocatoria de Ayudas a salas de cine,10,10,0
2024,A20002,A2500,2279,334100,Programas de apoyo a los sectores culturales y artísticos,1130397,1130397,"1025252,22"
2024,A20002,A2500,2279,334103,Programas de apoyo al sector audiovisual,55000,55000,"39713,07"
2024,A20002,A2500,2279,334104,Programa de apoyo a la creación artística y residencias para las artes escénicas,90000,90000,0
2024,A20002,A2500,2301,334100,Locomoción y gastos de viaje del personal del Servicio de Acción Cultural,7000,7000,"5184,01"
2024,A20002,A2500,4300,335100,Programación artística de la Fundación Baluarte y de la Orquesta Sinfónica de Navarra,5630000,"5678576,57","5678576,57"
2024,A20002,A2500,4300,335102,Programación de la Fundación Baluarte en colaboración con la Dirección General de Cultura,265000,265000,265000
2024,A20002,A2500,4400,334100,NICDO. Área de Cine e Industrias Audiovisuales y Digitales,840000,840000,840000
2024,A20002,A2500,4400,334102,"NICDO. Desarrollo de la Industria Musical, Música en vivo, Navarra Music Commission y Girando por Navarra",1700000,1700000,1700000
2024,A20002,A2500,4609,334100,Ayudas a acciones culturales en Ayuntamientos,1500000,1500000,"1443326,2"
2024,A20002,A2500,4609,334102,Subvención a la Asociación Red de Teatros de Navarra,300000,300000,300000
2024,A20002,A2500,4609,334105,Subvención a EPEL Tudela Cultura para el Festival de cine Ópera Prima,20000,20000,20000
2024,A20002,A2500,4609,334107,MRR Ayudas para ampliar y diversificar la oferta cultural en áreas no urbanas,10,"191077,46","173316,91"
2024,A20002,A2500,4709,334100,Ayudas a viveros y fábricas de creación artística para el apoyo a proyectos profesionales y empresariales,40000,40000,40000
2024,A20002,A2500,4709,334102,GENERAZINEMA: Ayudas a empresas y profesionales del sector audiovisual,1040000,"1343575,91","1091727,77"
2024,A20002,A2500,4709,334103,"ARTEM EXPORTA: Ayudas a eventos, festivales y certámenes de artes escénicas",175000,175000,"129943,45"
2024,A20002,A2500,4709,334106,ARTEM PRO: Ayudas a empresas y profesionales para producción,330000,330000,"300909,48"
2024,A20002,A2500,4709,334107,(E) Subvención a Faktoria Choreographic Center,44000,44000,44000
2024,A20002,A2500,4809,334102,ÁGORART: Ayudas para la ampliación de estudios artísticos,135000,135000,"108856,67"
2024,A20002,A2500,4816,334100,Subvención a KUNA Gestión Cultural de Navarra para actividades de formación y profesionalización,30000,30000,30000
2024,A20002,A2500,4816,334103,Subvención a asociaciones de profesionales de la cultura,65000,"16423,43","11243,98"
2024,A20002,A2500,4816,334104,IDEIA: Ayudas a entidades culturales para la difusión y la divulgación cultural,145000,145000,"101799,37"
2024,A20002,A2500,4816,334106,Subvención a Entidades del Tercer Sector de Artes Escénicas y Musicales de Navarra,926000,926000,"814541,66"
2024,A20002,A2500,4816,334107,(E) Subvención a la Escuela Navarra de Teatro,335000,335000,335000
2024,A20002,A2500,4816,334112,(E) Convenio con la Federación Navarra de Teatro Amateur,25000,25000,25000
2024,A20002,A2500,4816,334113,GENERAZINEMA festivales: ayudas a asociaciones para la organización de festivales de cine,15000,15000,15000
2024,A20002,A2500,4816,334117,(E) Convenio con la Asociación Veinte21Ensemble,25000,25000,25000
2024,A20002,A2500,4816,334120,(E) Convenio Asociación Gautxoriak Soul Club Festival Beltza Weekend,13500,13500,"12805,62"
2024,A20002,A2500,4816,335102,(E) Subvención al Orfeón Pamplonés. Gastos de funcionamiento y actividad,271000,271000,271000
2024,A20002,A2500,4816,335202,Convenio con la Asociación para la Defensa del Patrimonio Navarro/Nafarroako Ondarearen Defentsarako Plataforma,20000,20000,20000
2024,A20002,A2500,4816,335203,(E) Convenio con ATEN (Asociación de Técnicos de Espectáculos Navarra),10000,10000,10000
2024,A20002,A2500,4819,334102,(E) Subvención a la Fundación Atena,25000,25000,25000
2024,A20002,A2500,7609,334109,Redacción del proyecto para nuevo espacio escénico de Uharte,100000,100000,100000
2024,A20002,A2500,7609,334110,(E) Transferencia Ayto. Fontellas: Ejecución centro socio-cultural (Fase 1),150000,150000,150000
2024,A20002,A2500,7609,334112,(E) Transferencia Ayto. Peralta: Salas culturales,30000,30000,30000
2024,A20002,A2500,7609,334113,(E) Transferencia Ayto. Peralta: Sala Oficina y Archivo Banda de Música,30000,30000,30000
2024,A20002,A2500,7609,334114,(E) Transferencia Ayto. Valle de Egüés: Adecuación del proyecto de la Casa de Cultura,10000,10000,0
2024,A20002,A2500,7709,335100,(E) Subvención Asociación Punto Gunea. Adecuación salas insonorizadas para grupos,20000,0,0
2024,A20002,A2500,7709,335200,MRR Ayudas a las salas de cine,10,10,0
2024,A20002,A2500,7816,335100,Subvención al Orfeón Pamplonés. Amortización préstamo inmobiliario,15000,15000,15000
2024,A20002,A2500,7816,335103,MRR Ayudas para la inversión en infraestructuras de AAEE y Música,10,"160873,32","135234,25"
2024,A20002,A2500,7816,335104,Subvención Asociación Punto Gunea. Adecuación salas insonorizadas para grupos,0,20000,20000
2024,A20003,A2300,1200,333100,Retribuciones del personal fijo,592880,"667767,49","650344,65"
2024,A20003,A2300,1210,333100,Retribuciones del personal contratado para cubrir plazas reservadas,8635,"10388,94","10386,27"
2024,A20003,A2300,1211,333100,Retribuciones del personal contratado para cubrir vacantes,422745,"390384,83","384348,19"
2024,A20003,A2300,2020,333100,Arrendamiento de edificios,155000,155000,"148687,8"
2024,A20003,A2300,2120,333100,"Reparación, mantenimiento y conservación de edificios",100000,"102005,04","118883,75"
2024,A20003,A2300,2150,333100,"Reparación, mantenimiento y conservación de mobiliario y equipamiento",4500,4500,"4252,2"
2024,A20003,A2300,2150,333102,Gastos de conservación y mantenimiento de colecciones museísticas propias,0,0,"19190,25"
2024,A20003,A2300,2200,333100,Material de oficina,3000,3000,"1640,83"
2024,A20003,A2300,2239,333100,Traslado de fondos museísticos,16000,16000,"17038,01"
2024,A20003,A2300,2262,333100,Acciones de comunicación y promoción de museos,75000,75000,"65253,57"
2024,A20003,A2300,2262,333102,Plan de comunicación del programa CulturIzan,15000,15000,"12690,78"
2024,A20003,A2300,2262,333103,Plan de comunicación del circuito de Artes Plásticas y Visuales,15000,15000,"13550,64"
2024,A20003,A2300,2266,333100,Formación en el ámbito museístico,5000,5000,"4818,18"
2024,A20003,A2300,2269,333100,Exposiciones y programación cultural,400000,400000,"472761,1"
2024,A20003,A2300,2269,333103,Gastos diversos,10000,10000,"11299,24"
2024,A20003,A2300,2269,333104,Actividades pedagógicas,40000,40000,"32678,1"
2024,A20003,A2300,2273,333100,Servicios informáticos,5000,5000,"6298,47"
2024,A20003,A2300,2274,333100,Vigilancia y seguridad,770000,770000,"677739,19"
2024,A20003,A2300,2279,333100,"Programa de apoyo a la música, danza y expresiones verbales populares",75000,75000,"72652,65"
2024,A20003,A2300,2279,333102,Programa de apoyo a los sectores artísticos a través de circuitos de Artes Plásticas,75000,75000,"43328,51"
2024,A20003,A2300,2280,333100,"Calefacción, luz y agua",180000,178960,"99229,45"
2024,A20003,A2300,2284,333100,Material de limpieza,1000,1000,"1567,57"
2024,A20003,A2300,2285,333100,Vestuario,1000,1000,"550,4"
2024,A20003,A2300,2301,333100,Locomoción y gastos de viaje del personal,7000,7000,"10310,37"
2024,A20003,A2300,4300,333100,Encuentros de Pamplona 2024 y programa en territorio en colaboración con Fundación Baluarte,800000,800000,800000
2024,A20003,A2300,4309,333100,Convenio con el Museo Gayarre. Gastos de funcionamiento y actividad,30000,30000,30000
2024,A20003,A2300,4309,333102,Fundación Museo Oteiza. Gastos de funcionamiento y actividad,990000,990000,990000
2024,A20003,A2300,4309,333103,Centro de Arte Contemporáneo de Huarte. Ayudas para artes plásticas,90000,90000,90000
2024,A20003,A2300,4309,333104,Convenio con Centro Huarte para máster interuniversitario,100000,100000,100000
2024,A20003,A2300,4309,333105,Centro de Arte Contemporáneo de Huarte. Gastos de funcionamiento y actividad,490000,490000,490000
2024,A20003,A2300,4309,333106,Fundación Museo Oteiza. Archivo Oral,35000,35000,"34312,73"
2024,A20003,A2300,4309,333107,(E) Fundación Museo Oteiza. Danok Oteiza,20000,20000,20000
2024,A20003,A2300,4455,333100,Convenio con la Cátedra de Patrimonio Inmaterial,30000,30000,"29553,5"
2024,A20003,A2300,4609,333100,Convenio con el Museo Gustavo de Maeztu. Gastos de funcionamiento y actividad,30000,30000,30000
2024,A20003,A2300,4609,333102,Convenio con el Museo Muñoz Sola de Arte Moderno. Gastos de funcionamiento y actividad,30000,30000,30000
2024,A20003,A2300,4800,333100,Becas,10,10,0
2024,A20003,A2300,4816,333100,Ayudas a museos y colecciones museográficas permanentes. Gastos de funcionamiento y actividad,137500,137500,"126472,37"
2024,A20003,A2300,4816,333102,Subvención a Ondarezain,6000,6000,6000
2024,A20003,A2300,4816,333103,Sustraiak-Raíces: ayudas a entidades culturales para proyectos de Patrimonio Cultural Inmaterial,65000,65000,"57571,8"
2024,A20003,A2300,4816,333105,(E) Convenio con Asociación Navarjota. Ejecución proyecto Salvaguarda de la Jota navarra,10500,10500,"10496,75"
2024,A20003,A2300,4816,333109,(E) Subvención a DUGUNA DANTZA TALDEA. Actos conmemoración 75 Aniversario,20000,20000,20000
2024,A20003,A2300,4816,333110,(E) Convenio con asociación KEINU Plataforma de arte situado para realización de actividades culturales,10000,10000,10000
2024,A20003,A2300,6020,333100,"Obras, estudios y proyectos en edificios",170000,170000,"168489,47"
2024,A20003,A2300,6020,333102,MRR. Obras de mejora energética del Museo de Navarra,94264,"391303,37","111056,97"
2024,A20003,A2300,6050,333100,Mobiliario y equipamiento,5000,5000,"5414,89"
2024,A20003,A2300,6056,333100,Adquisición de bienes culturales,150000,150000,"151219,55"
2024,A20003,A2300,6056,333102,Conservación - Restauración Museos propios,95000,95000,"66507,47"
2024,A20003,A2300,6060,333100,Informatización del Servicio de Museos,5000,5000,"4921,75"
2024,A20003,A2300,6081,333100,Adquisición de fondos editoriales,4000,4000,"2821,78"
2024,A20003,A2300,6090,333102,"Inventario, catalogación y digitalización de fondos",125000,125000,"111391,58"
2024,A20003,A2300,6094,333100,Aplicaciones informáticas,15000,15000,400
2024,A20003,A2300,7309,333100,Casa-Museo Julián Gayarre. Inversiones,22500,22500,22500
2024,A20003,A2300,7309,333102,Fundación Museo Oteiza. Inversiones,32000,32000,32000
2024,A20003,A2300,7309,333104,Centro de Arte Contemporáneo de Huarte. Inversiones,50000,50000,50000
2024,A20003,A2300,7609,333106,(E) Subvención al Ayto. de Tafalla. Centro de Interpretación de la Jota,25000,25000,24563
2024,A20003,A2300,7816,333100,Ayudas a museos y colecciones museográficas permanentes. Inversiones,68000,68000,"64261,57"
2024,A20003,A2300,7816,333104,(E) Convenio Asociación Cultural de Almadieros Navarros/Nafarroako Almadiazainen Kultur Elkartea para nuevas almadías,9990,9990,9990
2024,A21001,A2400,1200,332200,Retribuciones del personal fijo,2921550,"2981283,57","2964454,8"
2024,A21001,A2400,1210,332200,Retribuciones del personal contratado para cubrir plazas reservadas,403713,"347919,65","340089,15"
2024,A21001,A2400,1211,332200,Retribuciones del personal contratado para cubrir vacantes,456910,"502500,74","496940,19"
2024,A21001,A2400,2090,332200,Remuneración por préstamo en las bibliotecas,6000,6000,"4234,52"
2024,A21001,A2400,2120,332200,"Reparación, mantenimiento y conservación de edificios",210000,"326533,44","485517,62"
2024,A21001,A2400,2200,332200,Material de oficina,40000,40000,"52179,65"
2024,A21001,A2400,2224,332200,Arrendamiento y mantenimiento de programas y licencias informáticos,80000,80000,"78154,05"
2024,A21001,A2400,2224,332202,Servicios de conexión de sedes vía radio,9000,9000,"942,02"
2024,A21001,A2400,2239,332200,Envíos a bibliotecas públicas y depósitos bibliográficos,87000,87000,"76153,12"
2024,A21001,A2400,2266,332200,Formación del personal bibliotecario,25000,25000,"9100,99"
2024,A21001,A2400,2269,332200,Promoción del libro y la lectura,220000,"223581,91","189933,48"
2024,A21001,A2400,2269,332202,Gastos diversos,18000,18000,"37206,02"
2024,A21001,A2400,2269,332203,Organización y mantenimiento del archivo filmográfico,53000,53000,"51274,05"
2024,A21001,A2400,2269,332204,(E) Actividades de promoción del libro y la lectura en la Biblioteca Pública de Tudela,10000,10000,"9764,12"
2024,A21001,A2400,2274,332200,Vigilancia y seguridad,113283,113283,"95059,45"
2024,A21001,A2400,2276,332200,Elaboración de estudios e informes relativos a legislación y mapa de bibliotecas,30000,30000,0
2024,A21001,A2400,2279,332200,Servicios de asistencia en la Biblioteca de Navarra,70000,70000,"65170,18"
2024,A21001,A2400,2279,332202,Servicios de asistencia para el Sistema de Bibliotecas Públicas,180000,180000,"155741,69"
2024,A21001,A2400,2280,332200,"Calefacción, luz y agua",550000,550000,"410727,97"
2024,A21001,A2400,2301,332200,Locomoción y gastos de viaje del personal del Servicio de Bibliotecas,6000,6000,"7005,3"
2024,A21001,A2400,6020,332202,Cableado de instalaciones informáticas,30000,5000,"2490,18"
2024,A21001,A2400,6042,332200,Adquisición y adaptación de vehículos para proyecto de extensión bibliotecaria modelo Bibliobus,105000,0,0
2024,A21001,A2400,6042,332202,Adquisición de vehículo para proyecto de extensión bibliotecaria modelo Biblioneta,25000,25000,"24867,92"
2024,A21001,A2400,6054,332200,Equipamiento para bibliotecas públicas,113000,113000,"111013,52"
2024,A21001,A2400,6054,332202,Equipamiento para Biblioteca Pública de Tudela,0,3000,2999
2024,A21001,A2400,6060,332200,Equipos para proceso de información del sistema bibliotecario,75000,66000,"65976,08"
2024,A21001,A2400,6081,332200,Adquisición de fondos documentales para la Biblioteca de Navarra,125000,125000,"124844,56"
2024,A21001,A2400,6081,332202,Conservación del patrimonio bibliográfico de Navarra,4000,4000,"2919,48"
2024,A21001,A2400,6081,332203,Adquisición de fondos documentales para proyecto de extensión bibliotecaria,15000,15000,"14992,04"
2024,A21001,A2400,6081,332204,Digitalización de los fondos documentales,45000,45000,"44827,6"
2024,A21001,A2400,6081,332205,Adquisición de fondos documentales para el Sistema de Bibliotecas Públicas de Navarra,400000,400000,"399944,46"
2024,A21001,A2400,6081,332206,"Catalogación, conservación y difusión de fondos documentales",5000,5000,"4999,55"
2024,A21001,A2400,6081,332207,"Catalogación, conservación y difusión del patrimonio bibliográfico",20000,45000,"41418,57"
2024,A21001,A2400,6081,332209,(E) Adquisición de libros para la Biblioteca de Tudela,6000,6000,"5986,39"
2024,A21001,A2400,6094,332200,Aplicaciones informáticas para el sistema bibliotecario,30000,30000,0
2024,A21001,A2400,7609,332203,(E) Subvención a la Biblioteca de Tudela para la adecuación de la Sala Polivalente,3000,0,0
2024,A21002,A2200,1200,332100,Retribuciones del personal fijo,654738,"618857,32","618570,34"
2024,A21002,A2200,1210,332100,Retribuciones del personal contratado para cubrir plazas reservadas,10,"1,99",0
2024,A21002,A2200,1211,332100,Retribuciones del personal contratado para cubrir vacantes,203063,"182478,38","165999,55"
2024,A21002,A2200,2120,332100,Gastos de mantenimiento del Archivo Real y General de Navarra,75000,75000,"129655,73"
2024,A21002,A2200,2120,332102,Mantenimiento del Archivo Contemporáneo,10000,10000,"10747,58"
2024,A21002,A2200,2190,332100,Restauración de documentos,160000,160000,"138152,96"
2024,A21002,A2200,2202,332100,"Suscripciones, libros y prensa",3500,3500,"5931,64"
2024,A21002,A2200,2219,332100,Material de conservación y restauración,8500,8500,"57423,4"
2024,A21002,A2200,2239,332100,Traslado de documentación,16000,16000,"10405,35"
2024,A21002,A2200,2266,332100,"Reuniones, conferencias, cursillos y jornadas",50000,50000,"60410,82"
2024,A21002,A2200,2269,332100,Gastos diversos,38100,38100,"48749,25"
2024,A21002,A2200,2269,332102,Exposiciones y actividades de difusión,110000,110000,"166129,78"
2024,A21002,A2200,2273,332100,Servicios informáticos,203000,203000,"161914,64"
2024,A21002,A2200,2274,332100,Vigilancia y seguridad,246000,246000,"199962,18"
2024,A21002,A2200,2279,332100,Comisión de evaluación documental,2000,2000,0
2024,A21002,A2200,2279,332102,Gestión de usuarios del Archivo Real y General de Navarra,206000,206000,"192998,03"
2024,A21002,A2200,2280,332100,"Calefacción, luz y agua",150000,150000,"94674,95"
2024,A21002,A2200,2299,332102,Gastos de funcionamiento de la biblioteca,3000,3000,"6532,93"
2024,A21002,A2200,2301,332100,Locomoción y gastos de viaje del personal del Servicio de Archivos,1500,1500,"1057,7"
2024,A21002,A2200,4609,332100,(E) Convenio Ayto. Lesaka. Actos centenario Pascual Aldave,5000,5000,5000
2024,A21002,A2200,4800,332100,Becas,27000,27000,"26522,88"
2024,A21002,A2200,4809,332100,Premios del Certamen de fotografía Paisajes con Memoria,2000,2000,800
2024,A21002,A2200,6020,332100,Obras e instalaciones en el Archivo Real y General de Navarra,85000,85000,"84859,38"
2024,A21002,A2200,6020,332102,Obras e instalaciones en locales del Archivo Contemporáneo,110000,110000,"109689,13"
2024,A21002,A2200,6050,332100,Mobiliario y equipamiento,94400,94400,"94316,83"
2024,A21002,A2200,6060,332100,Equipos para el procesamiento de información,35000,"14897,53","14897,53"
2024,A21002,A2200,6081,332100,Adquisición de fondos documentales para el Archivo Real y General de Navarra,20000,20000,"25968,76"
2024,A21002,A2200,6089,332100,Archivo de la música y las artes escénicas,55000,55000,"49029,3"
2024,A21002,A2200,6090,332102,Descripción y digitalización de los fondos,633000,"662644,83","719954,87"
2024,A21002,A2200,6094,332100,Informatización del Servicio de Archivos,28150,28150,"21349,24"
2024,A21002,A2200,6094,332102,Interoperabilidad y archivo digital,90150,90150,68970
2024,A21002,A2200,7609,332100,Subvenciones para organización de archivos de Entidades Locales,70000,70000,"69999,55"
2024,A21002,A2200,7609,332102,Subvenciones para difusión de archivos de Entidades Locales,20000,"10457,64","10457,64"
2024,A30000,A3000,1000,431200,Retribuciones de altos cargos,64553,66167,"66163,58"
2024,A30000,A3000,1200,431200,Retribuciones del personal fijo,10,"52358,35","52344,29"
2024,A30000,A3000,1210,431200,Retribuciones del personal contratado para cubrir plazas reservadas,10,12,0
2024,A30000,A3000,1211,431200,Retribuciones del personal contratado para cubrir vacantes,53217,"32481,55","32475,91"
2024,A30000,A3000,1220,431202,MRR Retribuciones del personal contratado temporal,334215,342578,"325097,89"
2024,A30000,A3000,1400,431202,MRR Retribuciones personales,21062,"25251,07","24076,2"
2024,A30000,A3000,1600,431202,MRR Seguridad social,116098,119007,"106499,85"
2024,A30000,A3000,2150,432100,Conservación y reparación de mobiliario y enseres,1000,1000,"303,7"
2024,A30000,A3000,2200,432100,Material de oficina,1000,1000,"54,02"
2024,A30000,A3000,2202,432100,"Suscripciones, libros y prensa",1500,1500,"3075,5"
2024,A30000,A3000,2261,432100,Gastos de representación,1000,1000,"1026,73"
2024,A30000,A3000,2262,432100,Publicidad y propaganda,10,10,"281,87"
2024,A30000,A3000,2269,432100,Gastos diversos,1025,1025,"1588,7"
2024,A30000,A3000,2276,432100,"Auditorías, estudios e informes",20000,20000,"16658,49"
2024,A30000,A3000,2301,432100,Locomoción y gastos de viaje,10000,10000,"9168,9"
2024,A30000,A3000,4809,432100,Indemnizaciones por responsabilidad patrimonial y ejecución de sentencias,10,10,0
2024,A30000,A3000,6020,432100,Acondicionamiento Dirección General Turismo,0,73000,"74358,99"
2024,A30000,A3000,6050,432100,Mobiliario y equipamiento,3000,8000,"1567,07"
2024,A30000,A3000,6054,432100,Material técnico,1000,1000,"6959,92"
2024,A30000,A3000,6060,432100,Equipos informáticos,13000,18000,"12728,98"
2024,A30000,A3000,6094,432100,Programas informáticos,20000,20000,400
2024,A30001,A3100,1200,432100,Retribuciones del personal fijo,389601,"336676,97","336266,71"
2024,A30001,A3100,1210,432100,Retribuciones del personal contratado para cubrir plazas reservadas,151494,"141024,03",141013
2024,A30001,A3100,1211,432100,Retribuciones del personal contratado para cubrir vacantes,25991,"59198,82","59191,43"
2024,A30001,A3100,2100,432100,Mantenimiento del entorno de Javier,55000,55000,"48667,32"
2024,A30001,A3100,2200,432100,Material ordinario no inventariable,2000,2000,"3486,77"
2024,A30001,A3100,2262,432100,Publicidad y propaganda,20000,20000,"17593,82"
2024,A30001,A3100,2262,432102,"MRR Eventos, Comunicación y comercialización",0,36850,0
2024,A30001,A3100,2262,432103,MRR Encargo a NASERTIC. MKT Comunicación,185203,"276335,78","111827,38"
2024,A30001,A3100,2262,432104,MRR Encargo a NASERTIC. Comunicación,18228,"29733,95","12207,77"
2024,A30001,A3100,2262,432105,MRR CS Encargo a NASERTIC. Comunicación,10841,"16806,66","2362,66"
2024,A30001,A3100,2262,432106,MRR CS Encargo a NASERTIC. MKT Innovación para la promoción del Camino del Santiago,485037,"523779,38","128951,09"
2024,A30001,A3100,2262,432107,MRR CS Eventos y dinamización,0,"225244,15",0
2024,A30001,A3100,2266,432100,Actividades de formación turística,10,10,"60,5"
2024,A30001,A3100,2266,432102,MRR Formación,130000,"224606,67","122074,05"
2024,A30001,A3100,2266,432103,MRR Encargo CNAI Formación turismo,0,"6488,05",0
2024,A30001,A3100,2269,432103,MRR Encargo a NASERTIC. MKT Eventos de aprendizaje,216300,"443320,61","163454,61"
2024,A30001,A3100,2269,432104,MRR CS Acciones de turismo convivencial,15000,15117,0
2024,A30001,A3100,2269,432105,MRR CS Encargo NASERTIC. Digitalización de experiencias de realidad virtual,56652,56651,0
2024,A30001,A3100,2273,432100,MRR Encargo a NASERTIC. Servicios informáticos,82400,"170405,26","47953,96"
2024,A30001,A3100,2273,432102,EXTRA. Inforeyno,13000,18000,13000
2024,A30001,A3100,2276,432100,MRR Encargo a NASERTIC. Asistencias técnicas,74474,"117375,79","71918,89"
2024,A30001,A3100,2276,432104,Asistencia técnica. Turismo,50000,50000,"25010,13"
2024,A30001,A3100,2276,432105,MRR Encargo a NASUVINSA. Asistencias Técnicas,150500,399000,"140732,6"
