2024,400000,41000,2262,321100,Publicidad y propaganda,52020,52020,"26450,53"
2024,410000,41000,1000,321100,Retribuciones de altos cargos,64563,66179,"47259,7"
2024,410000,41000,1200,321100,Retribuciones del personal fijo,205805,"199227,31","85832,31"
2024,410000,41000,2266,321100,Gastos de actividades formativas,500,500,0
2024,410000,41000,2269,321100,Gastos diversos,2918,2918,"1766,29"
2024,410000,41000,2274,321100,Servicios de Seguridad,279355,279355,"178478,72"
2024,410000,41000,2301,321100,Locomoción y gastos de viaje del personal funcionario y contratado,247504,247504,"146862,16"
2024,410000,41000,4400,321100,"Transferencias a Navarra Impulsa Cultura, Deporte y Ocio para programas educativos del Planetario",50173,50173,50173
2024,410000,41100,1200,321100,Retribuciones del personal fijo,427632,"415694,3","274003,41"
2024,410000,41100,1210,321100,Retribuciones del personal contratado para cubrir plazas reservadas,34567,"84974,44","51830,3"
2024,410000,41100,1211,321100,Retribuciones del personal contratado para cubrir vacantes,135899,"97685,39","72915,96"
2024,410000,41600,1200,321100,Retribuciones del personal fijo,144816,"198080,13","110634,26"
2024,410000,41600,1210,321100,Retribuciones del personal contratado para cubrir plazas reservadas,10,0,0
2024,410000,41600,1211,321100,Retribuciones del personal contratado para cubrir vacantes,73273,"71446,24","39974,46"
2024,410000,41600,2269,324200,Apoyo al funcionamiento del Consejo Escolar,35700,35700,0
2024,410000,41600,2290,322000,Financiación del funcionamiento de centros docentes no universitarios,13241000,13241000,"9930432,35"
2024,410000,41600,2290,322002,Gastos de funcionamiento. FPB/TP ubicados fuera de los centros de FP,167321,167321,"52445,2"
2024,410000,41600,4609,322004,Transferencias por uso de espacios municipales por alumnado de Secundaria y Formación Profesional,1100000,1100000,"278988,17"
2024,410000,41800,2120,321100,Gastos de mantenimiento de edificios propios,153000,"104784,88","103757,18"
2024,410000,41800,2120,322000,Gastos de reparación y conservación de centros escolares propios,1000000,1000000,"904518,37"
2024,410000,41800,2120,322002,Abono de siniestros,10,"40907,05","54969,02"
2024,410000,41800,2220,321102,Encargo a NASERTIC. Servicios de telecomunicaciones de edificios propios,14649,14649,"5844,59"
2024,410000,41800,2271,322002,Limpieza de los centros docentes públicos,5383705,5383705,"3257015,93"
2024,410000,41800,2279,322000,Otros gastos de mantenimiento de centros,229919,229919,"86687,23"
2024,410000,41800,2280,321100,"Gastos de funcionamiento de edificios propios. Energía eléctrica, agua y calefacción",1066156,1066156,"260974,33"
2024,410000,41800,2283,321100,Material para reparaciones de edificios propios,31212,31212,"6894,86"
2024,410000,41800,6020,325102,Obras de mantenimiento en el departamento,225000,225000,"58990,8"
2024,410000,41800,6020,325103,Otras obras del departamento,418768,418768,0
2024,410000,41800,6040,321100,Adquisición de elementos de transporte,10,10,0
2024,410000,41800,6050,325100,Mobiliario del departamento,40000,40000,"10100,58"
2024,410000,41800,6054,325100,Material técnico y equipos para el departamento,10200,10200,"7501,83"
2024,410001,41800,1200,321100,Retribuciones del personal fijo,789145,"691946,74","440906,42"
2024,410001,41800,1210,321100,Retribuciones del personal contratado para cubrir plazas reservadas,10,0,0
2024,410001,41800,1211,321100,Retribuciones del personal contratado para cubrir vacantes,309047,"260201,48","182452,4"
2024,410001,41800,2276,321100,Estudios y trabajos técnicos,56000,56000,"38401,13"
2024,410001,41800,6020,325100,Construcción de nuevos centros y obras. Plan de Centros Escolares,4892024,3317724,"707373,02"
2024,410001,41800,6020,325103,Obras para el desarrollo de los centros de Formación Profesional,4302893,3802893,"1305689,42"
2024,410001,41800,6020,325112,Obras de mantenimiento en centros escolares,2380000,"2432278,24","622347,44"
2024,410001,41800,6020,325136,MRR Obras en centros educativos 0-3,5560202,"5589178,21","114242,22"
2024,410001,41800,6020,325137,Obras en centros educativos 0-3,200000,200000,"101606,24"
2024,410001,41800,6020,325139,"Inversiones en Leitza por ""Casa Maxurrenea""",36140,36140,0
2024,410001,41800,6059,325100,Equipamiento en centros públicos,1461650,1461650,"634174,09"
2024,410001,41800,7609,325100,Obras en centros educativos de propiedad municipal,1500000,1500000,0
2024,410001,41800,7609,325103,Construcción de nuevos centros y obras. Plan de Centros Escolares,3367107,5441407,"2115937,3"
2024,410001,41800,7609,325106,Obras en centros educativos 0-3 de propiedad municipal,250000,250000,0
2024,410001,41800,7609,325139,Redacción del proyecto para nuevo colegio público en Aiegi,100000,100000,0
2024,410001,41800,7609,325153,MRR Obras en centros educativos 0-3 de propiedad municipal,3546473,"3543115,34","48249,66"
2024,410001,41800,7609,325157,(E) Convenio con el Ayuntamiento de Berriozar para la mejora de la cubierta Colegio Mendialdea,75000,75000,0
2024,410001,41800,7609,325159,(E) Convenio con el Ayuntamiento de Pamplona para la rehabilitación del Colegio Público San Francisco,75000,75000,0
2024,410001,41800,7609,325173,Convenio Ayto. Valle de Egües. Construcción cubierta patio CPEIP/HLHIP Joakin Lizarraga de Sarriguren,250000,250000,0
2024,410001,41800,7609,325174,Convenio con el Ayuntamiento de Ultzama para la reforma de la segunda planta del colegio público,125000,125000,0
2024,410001,41800,7609,325175,Convenio con el Ayuntamiento de Lesaka para la primera fase de la reforma del patio del colegio público,40000,40000,0
2024,410001,41800,7609,325176,(E) Convenio con el Ayto. de Falces para la adecuación de aulas del CP de Falces para la creación de aulas 0-3 años,125000,125000,0
2024,410001,41800,7609,325177,(E) Convenio Ayto. Lekunberri y Ayto. Larraun. Ejecución de porche para la Eskola Ibarberri,98000,98000,0
2024,410001,41800,7609,325178,(E) Actuaciones en el edificio del CPEIP Otero de Navascués de Cintruénigo,50000,50000,0
2024,410001,41800,7609,325179,(E) Convenio con el Ayuntamiento de Castejón para ampliación cubierta del CPEIP Castejón 2 de Mayo,50000,50000,0
2024,410001,41800,7609,325180,(E) Convenio con Ayto. Corella para el cambio de luminarias del colegio y cubierta del patio de educación infantil,40000,40000,0
2024,410001,41800,7609,325181,(E) Convenio Ayuntamiento de Berrioplano para ampliación del espacio de psicomotricidad en la Escuela Infantil de Artica,30000,30000,0
2024,410001,41800,7609,325182,(E) Convenio con el Ayto. Buñuel para adecuación de los baños de Colegio Público e instalación de plataformas,30000,30000,0
2024,410001,41800,7609,325183,(E) Transferencia Ayto. Tudela para construcción cubierta parque infantil CP Huertas Mayores,20000,20000,0
2024,410001,41800,7609,325184,(E) Convenio con el Ayuntamiento de Tudela para proyecto de construcción de cubierta de patio del CP Huertas Mayores,20000,20000,0
2024,410001,41800,7609,325185,(E) Convenio con el Ayto. de Corella para la climatización del CP Ciudad de Corella con autogeneración eléctrica,15000,15000,0
2024,410001,41800,7609,325186,(E) Convenio con el Ayuntamiento de Olite para obras en el patio del colegio,10000,10000,0
2024,410001,41800,7609,325187,(E) Convenio Ayto. de Monteagudo para realizar mejoras en el Colegio Público de Monteagudo,4600,4600,0
2024,410001,41800,7609,325188,(E) Transferencia Ayto. Betelu. Acondicionamiento instalaciones deportivas y zona infantil del CP Comarcal Araxes,30000,30000,0
2024,410003,41600,4811,322100,2º Ciclo de Educación Infantil. Centros privados concertados y/o subvencionados,21754632,21754632,"15552568,14"
2024,410003,41600,4811,322200,1º Ciclo de Educación Secundaria.  Centros privados concertados y/o subvencionados,21539138,21539138,"15971917,05"
2024,410003,41600,4811,322202,2º Ciclo de Educación Secundaria. Centros privados concertados y/o subvencionados,24745810,24745810,"18565345,11"
2024,410003,41600,4811,322400,Educación Especial. Centros privados concertados y/o subvencionados,9196197,9196197,"5757063,31"
2024,410003,41600,4811,322402,Necesidades educativas específicas. Centros privados concertados y/o subvencionados,5769679,5769679,"3028415,85"
2024,410003,41600,4811,322403,Inmigración y minorías culturales. Centros privados concertados y/o subvencionados,814595,814595,"332740,49"
2024,410003,41600,4811,322C00,Bachillerato. Centros privados concertados y/o subvencionados,13357330,13357330,"8755360,04"
2024,410003,41600,4811,322D00,Educación Primaria. Centros privados concertados y/o subvencionados,55266304,55266304,"40281942,04"
2024,410003,41600,4811,322D02,Atención al alumnado con dificultades de escolarización,1345392,1345392,"524207,28"
2024,410003,41600,4811,322E00,Ciclos formativos de grado básico y medio,9709240,9709240,"5180816,95"
2024,410003,41600,4811,322E02,Ciclos formativos de grado superior. Centros privados concertados y/o subvencionados,5048727,5048727,"3238854,94"
2024,410005,41400,1200,321100,Retribuciones del personal fijo,137978,"214681,91","146232,27"
2024,410005,41400,1210,321100,Retribuciones del personal contratado para cubrir plazas reservadas,10,0,0
2024,410005,41400,1211,321100,Retribuciones del personal contratado para cubrir vacantes,307552,"225509,78","162177,35"
2024,410005,41400,2267,322000,Gastos de oposiciones,187000,187000,"52915,22"
2024,410005,41400,2301,322000,Locomoción y gastos de viaje. Tribunales oposición,650000,650000,"674,39"
2024,410005,41400,2330,322000,Indemnización por trabajos realizados en tribunales,2768230,2768230,"15604,59"
2024,410005,41500,1200,321100,Retribuciones del personal fijo,307294,"362940,96","238889,34"
2024,410005,41500,1210,321100,Retribuciones del personal contratado para cubrir plazas reservadas,25991,"42513,77","13017,41"
2024,410005,41500,1211,321100,Retribuciones del personal contratado para cubrir vacantes,270734,"242999,07","169548,61"
2024,410005,41700,1200,321100,Retribuciones del personal fijo,360154,"278141,2","201430,74"
2024,410005,41700,1210,321100,Retribuciones del personal contratado para cubrir plazas reservadas,43319,"20595,14","3317,97"
2024,410005,41700,1211,321100,Retribuciones del personal contratado para cubrir vacantes,145831,"243489,4","168859,13"
2024,410005,41700,4819,321100,Compensación de gastos de funcionamiento de organizaciones sindicales,38350,38350,0
2024,420000,42000,1000,321100,Retribuciones de altos cargos,64553,66167,"47259,7"
2024,420000,42000,1200,321100,Retribuciones del personal fijo,140634,"149543,18","77265,95"
2024,420000,42000,1210,321100,Retribuciones del personal contratado para cubrir plazas reservadas,10,"5709,35","5708,31"
2024,420000,42000,1211,321100,Retribuciones del personal contratado para cubrir vacantes,67861,"21629,24","21628,2"
2024,420000,42000,2269,321100,Gastos diversos,4000,4000,"6282,66"
2024,420000,42000,2301,321100,Locomoción y gastos de viaje del personal funcionario y contratado,96500,96500,"110860,94"
2024,420000,42000,4400,322G00,NICDO: Campaña escolar de esquí,60000,60000,60000
2024,420000,42000,4709,322G00,Campañas escolares de actividades en la naturaleza,50000,50000,50000
2024,420000,42000,4709,322G02,Actividades de iniciación deportiva dirigida a centros educativos,5000,5000,0
2024,420000,42000,4819,322G00,Campaña escolar de vela. Federación Navarra de Vela,65000,65000,65000
2024,420001,42400,1200,322900,Retribuciones del personal fijo,1018946,"1026202,4","717638,9"
2024,420001,42400,1210,322900,Retribuciones del personal contratado para cubrir plazas reservadas,10794,"11062,38","7901,7"
2024,420001,42400,1211,322900,Retribuciones del personal contratado para cubrir vacantes,47577,"50233,37","35009,23"
2024,420001,42400,2120,322500,"Ciudad de la Música: Mantenimiento, reparación y conservación del edificio",44000,44000,"31387,58"
2024,420001,42400,2150,322500,Ciudad de la Música: Mantenimiento instrumentos y sistemas de sonido,10000,10000,"9270,59"
2024,420001,42400,2200,322500,Ciudad de la Música: Material de oficina,10000,10000,"4366,39"
2024,420001,42400,2202,322002,Recursos didácticos,20000,20000,0
2024,420001,42400,2266,321203,Formación del profesorado en euskera,50000,50000,"12850,14"
2024,420001,42400,2266,321205,Formación del profesorado en enseñanzas artísticas y musicales,8000,8000,"5166,2"
2024,420001,42400,2266,321206,Jornadas y ferias de lenguas extranjeras,7000,7000,"4567,15"
2024,420001,42400,2266,322906,Formación del profesorado en idiomas,130000,130000,"47831,47"
2024,420001,42400,2267,322502,Pruebas de acceso a los estudios superiores de diseño,1500,1500,"967,36"
2024,420001,42400,2269,322002,Elaboración materiales didácticos,5000,5000,0
2024,420001,42400,2269,322003,Promoción de ERASMUS + y otros programas europeos,7070,7070,"593,96"
2024,420001,42400,2269,322004,Financiación olimpiadas escolares,500,500,"509,65"
2024,420001,42400,2269,322005,Funcionamiento del programa ERASMUS+. SEPIE,2065,2065,2065
2024,420001,42400,2269,322200,Tasas del programa Bachillerato Internacional,28000,28000,0
2024,420001,42400,2269,322500,Ciudad de la Música: Gastos diversos,98000,98000,"106452,24"
2024,420001,42400,2269,322502,Conciertos didácticos,27000,27000,"19286,99"
2024,420001,42400,2269,322900,Programas de uso del euskera,552000,552000,"238081,84"
2024,420001,42400,2269,322904,"Exámenes EGA, títulos y gastos de funcionamiento",15000,15000,"7787,61"
2024,420001,42400,2269,322905,Encargo a CNAI. Programas y formación,1550000,1550000,"921965,01"
2024,420001,42400,2273,322500,Ciudad de la Música: Mantenimiento sistemas informáticos,8000,8000,"5332,25"
2024,420001,42400,2279,322500,Ciudad de la Música: Otros trabajos realizados por terceros,43500,43500,"9951,32"
2024,420001,42400,2280,322500,"Ciudad de la Música: Energía eléctrica, agua y calefacción",320000,320000,"169095,67"
2024,420001,42400,2330,322900,Indemnizaciones por trabajos realizados en tribunales,57000,57000,"42131,96"
2024,420001,42400,2330,322902,Pruebas certificativas,10000,10000,"8243,4"
2024,420001,42400,4609,322502,Subvención a escuelas de música,3400000,3400000,"1700000,13"
2024,420001,42400,4609,322503,Convenio con el Ayuntamiento de Tudela para el funcionamiento del Conservatorio Municipal de Música,500000,500000,500000
2024,420001,42400,4800,322500,Ayudas complementarias a la movilidad internacional del alumnado de Enseñanzas Artísticas Superiores,6000,6000,4500
2024,420001,42400,4809,321200,Ayuda para la formación del profesorado en euskera,10000,10000,0
2024,420001,42400,4809,321202,Ayudas para la formación del profesorado en lenguas extranjeras,30000,30000,"19374,78"
2024,420001,42400,4809,322000,Programa ERASMUS+. SEPIE,36437,36437,32720
2024,420001,42400,4816,322002,Subvención actividades extraescolares culturales en euskera,30000,30000,"14797,31"
2024,420001,42400,4816,322500,Escuela Navarra de Teatro,45000,45000,18000
2024,420001,42400,6020,322500,Ciudad de la Música: Adecuación edificio,10000,10000,0
2024,420001,42400,6050,322500,Ciudad de la Música: mobiliario y equipo de oficina,10000,10000,"4762,86"
2024,420001,42400,6059,322500,Ciudad de la Música: adquisición de instrumentos musicales,60000,60000,51027
2024,420001,42400,6081,322500,Ciudad de la Música: Adquisición de libros,3000,3000,"2900,13"
2024,420002,42100,1200,321100,Retribuciones del personal fijo,527219,"516118,85","372349,93"
2024,420002,42100,1200,321200,MRR CompDigEdu Retribuciones del personal fijo,505594,"779148,43","658236,2"
2024,420002,42100,1210,321100,Retribuciones del personal contratado para cubrir plazas reservadas,10,0,0
2024,420002,42100,1210,321200,MRR CompDigEdu Retribuciones del personal contratado para cubrir plazas reservadas,14165,"4425,48","3365,17"
2024,420002,42100,1211,321100,Retribuciones del personal contratado para cubrir vacantes,51981,"53277,56","38055,4"
2024,420002,42100,1220,321200,MRR CompDigEdu Retribuciones del personal contratado temporal,97599,"31454,88","28034,28"
2024,420002,42100,1250,321200,MRR CompDigEdu Retribuciones del personal contratado para sustituciones,12282,0,0
2024,420002,42100,1400,321200,MRR CompDigEdu Retribuciones personales,90803,"117794,88","86049,52"
2024,420002,42100,1600,321200,MRR CompDigEdu Seguridad Social,98336,"122644,43",85492
2024,420002,42100,2266,321200,Actividades formativas del profesorado,500000,500000,"219586,75"
2024,420002,42100,2266,321203,Actividades formativas del personal CAP,5100,5100,0
2024,420002,42100,2266,321204,MRR Actividades formativas del profesorado,443340,"152620,39",0
2024,420002,42100,2269,322000,Expedición de títulos y edición de libros de escolaridad,40000,40000,"112,29"
2024,420002,42100,2269,322003,Calidad,41920,41920,"17263,32"
2024,420002,42100,2269,322004,Programas formativos y proyectos de innovación en centros públicos,125000,125000,"114505,81"
2024,420002,42100,2269,322005,MRR CompDigEdu Gastos diversos,39874,"14634,83",0
2024,420002,42100,2269,322700,Centros de adultos y aulas itinerantes,87791,87791,"3339,6"
2024,420002,42100,2269,322702,Gastos de los cursos en las Aulas Mentor,10,1152,"1165,42"
2024,420002,42100,2279,322D00,Itinerarios culturales por Navarra,20000,20000,0
2024,420002,42100,2290,321200,Gastos de funcionamiento de centros de apoyo al profesorado,98430,98430,0
2024,420002,42100,2301,321200,MRR CompDigEdu Locomoción y gastos de viaje,54345,"41813,81","8823,03"
2024,420002,42100,4809,321200,Ayudas individuales para la formación del profesorado,20000,20000,0
2024,420002,42100,4811,322000,Programas formativos y proyectos de innovación en centros concertados,45000,45000,"36966,46"
2024,420002,42100,6054,321200,Adquisición de material para actividades formativas,11000,11000,"2382,22"
2024,420004,42700,1200,321100,Retribuciones del personal fijo,1884842,"2467946,19","757819,46"
2024,420004,42700,1200,322002,MRR Uds Acompañamiento Retribuciones del personal fijo,34164,35019,27524
2024,420004,42700,1200,322004,MRR PROA+ Retribuciones del personal fijo,609158,"940882,71","887156,84"
2024,420004,42700,1210,321100,Retribuciones del personal contratado para cubrir plazas reservadas,25991,"6138,23","5851,67"
2024,420004,42700,1210,322002,MRR Uds Acompañamiento Retribuciones del personal contratado para cubrir plazas reservadas,4712,4830,0
2024,420004,42700,1210,322004,MRR PROA+ Retribuciones del personal contratado para cubrir plazas reservadas,17297,17731,"337,61"
2024,420004,42700,1211,321100,Retribuciones del personal contratado para cubrir vacantes,196624,"261971,69","192964,89"
2024,420004,42700,1220,322002,MRR Uds Acompañamiento Retribuciones del personal contratado temporal,296084,"365199,85","270997,8"
2024,420004,42700,1220,322004,MRR PROA+ Retribuciones del personal contratado temporal,501920,"708561,89","593582,15"
2024,420004,42700,1250,322002,MRR Uds Acompañamiento Retribuciones del personal contratado para sustituciones,16304,16715,"11088,38"
2024,420004,42700,1250,322004,MRR PROA+ Retribuciones del personal contratado para sustituciones,31292,32075,"2737,37"
2024,420004,42700,1400,322002,MRR Uds Acompañamiento Retribuciones personales,25461,26109,"22713,04"
2024,420004,42700,1400,322004,MRR PROA+ Retribuciones personales,135229,168726,"161949,87"
2024,420004,42700,1600,322002,MRR Uds Acompañamiento Seguridad Social,99178,"127855,15","110126,79"
2024,420004,42700,1600,322004,MRR PROA+ Seguridad Social,277534,"356409,15","322890,38"
2024,420004,42700,2266,321205,MRR PROA+ Actividades formativas del profesorado,3000,3000,"201,71"
2024,420004,42700,2269,321200,Convivencia,138853,138853,"58091,64"
2024,420004,42700,2269,321202,Coeducación e igualdad de género,454120,454120,"153555,21"
2024,420004,42700,2269,322400,Plan de Atención Diversidad. Acciones de compensación educativa a centros públicos alumnado desfavorecido,1203000,1203000,0
2024,420004,42700,2269,322402,Financiación de actividades para la integración socioeducativa de inmigrantes y minorías socioculturales,65000,65000,"7236,38"
2024,420004,42700,2301,322003,MRR PROA+ Locomoción y gastos de viaje,11000,26000,"17192,2"
2024,420004,42700,2301,322004,MRR Unidades de acompañamiento Locomoción y gastos de viaje,14000,14000,"6148,3"
2024,420004,42700,2301,322005,MRR Menttores Locomoción y gastos de viaje,0,"7780,75","7780,75"
2024,420004,42700,2400,322400,Elaboración material guías para centros,24825,24825,0
2024,420004,42700,2400,322402,Adquisición y reposición de material especializado,28000,28000,0
2024,420004,42700,4609,322400,Subvención para actividades de integración socioeducativa,600000,505900,"294222,51"
2024,420004,42700,4809,322400,Ayudas a la educación especial,575000,575000,13887
2024,420004,42700,4809,322402,Ayudas para escuela de vacaciones para alumnado con discapacidades,100000,100000,"16907,05"
2024,420004,42700,4809,322403,Ayudas al alumnado de centros concertados para inmigración y minorías culturales,550000,550000,"411709,03"
2024,420004,42700,4811,322200,MRR PROA+ 1º Ciclo de Educación Secundaria. Subvención a la enseñanza privada,155555,45555,0
2024,420004,42700,4811,322400,Subvención a centros privados concertados de educación especial,35100,70200,35100
2024,420004,42700,4811,322402,(E) Convenio con CEE Ibero Isterria. Funcionamiento centro escolar,30000,30000,0
2024,420004,42700,4811,322D00,MRR PROA+ Educación Primaria. Subvención a la enseñanza privada,46685,141685,0
2024,420004,42700,4819,322000,Convenio Fundación Ilundain Haritz-Berri Programa Educar para prevenir adicciones en Centros Educativos de Navarra,75000,75000,0
2024,420004,42700,4819,322402,"Fundación Secretariado Gitano: programa ""promociona""",55000,55000,0
2024,420004,42700,4819,322403,(E) Convenio con APANA Asociación de Autoescuelas de Navarra. Proyecto Cambiamos de marcha,21600,21600,0
2024,420004,42700,4819,324200,Subvención a asociaciones y federaciones de padres y alumnos,65000,124000,62000
2024,420004,42700,6059,322400,Dotación al Centro de Recursos para la Equidad Educativa en Navarra (CREENA),55000,55000,"5533,28"
2024,420004,42700,6081,321100,Materiales y fondos coeducativos,32577,32577,"6151,79"
2024,420005,42800,1200,321100,Retribuciones del personal fijo,1744579,"1886102,4","1329194,41"
2024,420005,42800,1210,321100,Retribuciones del personal contratado para cubrir plazas reservadas,10,"20931,95","13319,39"
2024,420005,42800,1211,321100,Retribuciones del personal contratado para cubrir vacantes,25991,"54835,85","39611,78"
2024,420005,42800,2266,321100,Cursos de formación para el Servicio de Inspección Educativa,6000,6000,"1265,78"
2024,420005,42800,2269,321100,Documentación,1350,1350,0
2024,420005,42800,2276,321100,"Evaluación del alumnado, de centros, de programas y del sistema educativo",130000,130000,"90805,34"
2024,420005,42800,4800,321100,Premios y certámenes,2750,2750,"40,7"
2024,420007,42900,1200,322100,Retribuciones del personal fijo,353596,"218250,39","158451,25"
2024,420007,42900,1210,322100,Retribuciones del personal contratado para cubrir plazas reservadas,10,0,0
2024,420007,42900,1211,322100,Retribuciones del personal contratado para cubrir vacantes,62627,"67086,1","44735,58"
2024,420007,42900,2200,322100,Material de oficina,10112,10112,"4999,22"
2024,420007,42900,2210,322100,Alimentación,235000,235000,"131478,69"
2024,420007,42900,2214,322100,Material de cocina,11190,11190,"100,93"
2024,420007,42900,2215,322100,Fármacos y asistencia sanitaria,5313,5313,"650,43"
2024,420007,42900,2219,322100,Material didáctico,28892,28892,"7506,25"
2024,420007,42900,2269,322102,Desarrollo de la red de escuelas rurales,5000,5000,0
2024,420007,42900,2269,322103,Gastos diversos,5667,5667,"2141,77"
2024,420007,42900,2285,322100,"Vestuario, calzado y material textil",24782,24782,"3140,57"
2024,420007,42900,4609,322100,Convenios con ayuntamientos para la escolarización de 0 a 3 años,27501065,27501065,"11925030,92"
2024,430000,43000,1000,322E00,Retribuciones de altos cargos,64553,66167,"47259,7"
2024,430000,43000,1200,322E00,Retribuciones del personal fijo,27226,"60645,29","41879,8"
2024,430000,43000,1210,322E00,Retribuciones del personal contratado para cubrir plazas reservadas,10,0,0
2024,430000,43000,1211,322E00,Retribuciones del personal contratado para cubrir vacantes,10,0,0
2024,430000,43000,2269,321100,Gastos diversos,3500,3500,3580
2024,430000,43000,2301,321100,Locomoción y gastos de viaje del personal funcionario y contratado,55164,55164,"11605,53"
2024,430000,43500,1200,321100,Retribuciones del personal fijo,428212,"508521,42","295805,42"
2024,430000,43500,1210,321100,Retribuciones del personal contratado para cubrir plazas reservadas,10,"26638,96","19662,14"
2024,430000,43500,1211,321100,Retribuciones del personal contratado para cubrir vacantes,111375,"101779,4","69192,36"
2024,430001,43000,1210,322E00,Retribuciones del personal contratado para cubrir plazas reservadas,10,0,0
2024,430001,43100,1200,322E00,Retribuciones del personal fijo,680826,"587446,89","384541,04"
2024,430001,43100,1200,322E03,MRR Creación de ciclos bilingües Retribuciones del personal fijo,778400,"909271,24","921210,64"
2024,430001,43100,1200,322E04,MRR Redim oferta FP Retribuciones del personal fijo,10,654603,"369474,57"
2024,430001,43100,1210,322E03,MRR Creación de ciclos bilingües Retribuciones del personal contratado para cubrir plazas reservadas,55300,66892,"63619,02"
2024,430001,43100,1210,322E04,MRR Redim oferta FP Retribuciones del personal contratado para cubrir plazas reservadas,10,91131,"41864,51"
2024,430001,43100,1211,322E00,Retribuciones del personal contratado para cubrir vacantes,87167,"115670,15","73576,95"
2024,430001,43100,1220,322E03,MRR Creación de ciclos bilingües Retribuciones del personal contratado temporal,1594950,"1669644,73","1642201,68"
2024,430001,43100,1220,322E04,MRR Redim oferta FP Retribuciones del personal contratado temporal,10,2061980,"809586,85"
2024,430001,43100,1221,322E04,MRR Redim oferta FP Retribuciones del personal contratado para campañas,10,24285,0
