2025,970000,97000,4455,494100,Convenio UPNA Formación Cooperativismo y Empresa de Economía Social,50.000,50.000,50.000
2025,970000,97000,4455,494102,Convenio UPNA para Cátedra de Prevención de Riesgos Laborales,20.000,20.000,20.000
2025,970000,97000,4709,494100,Ayudas autónomos y autónomas relevo generacional PE,120.000,120.000,120.000
2025,970000,97000,4709,494112,Programa de fomento de la responsabilidad social,120.000,120.000,107.850
2025,970000,97000,4819,494100,Subvención a la Asociación Unidad de Innovación Social para su funcionamiento,30.000,30.000,30.000
2025,970000,97000,4819,494102,Proyectos en materia de responsabilidad social PIES,10,10,0
2025,970000,97000,4819,494103,Compensación por participación a los sindicatos componentes del comité de seguimiento del proceso electoral sindical,65.000,65.000,65.000
2025,970000,97000,4819,494104,(E) Transferencia al Órgano de resolución extrajudicial de conflictos laborales,880.000,880.000,876.794
2025,970000,97000,4819,494108,Transferencias a centrales sindicales en proporción a su representatividad,2.300.000,2.300.000,2.298.423
2025,970000,97000,4819,494111,Transferencia agentes sociales y empresariales por participación,50.010,39.146,38.656
2025,970000,97000,4819,494112,"(E) Convenio con GELTOKI para fomentar la economía social, solidaria y la participación",137.500,137.500,137.500
2025,970000,97000,4819,494113,Transferencia a organizaciones empresariales por su representatividad. CEN,667.000,667.000,667.000
2025,970000,97000,4819,494114,Promoción y mantenimiento de entidades de economía social. ANEL,270.000,270.000,270.000
2025,970000,97000,4819,494115,Proyectos colaborativos en PRL: Delegado Territorial PE,410.000,410.000,404.308
2025,970000,97000,4819,494116,Proyectos Igualdad y Conciliación PE,250.000,240.209,227.246
2025,970000,97000,4819,494120,(E) Convenio REAS para asesoramiento en economía social,110.000,110.000,110.000
2025,970000,97000,4819,494121,Transferencia a la Asociación Centros Especiales de Empleo de Iniciativa Social,40.000,40.000,40.000
2025,970000,97000,4819,494122,Transferencia a la Asociación de Empresas de Inserción de Navarra (EINA) PIES,40.000,40.000,40.000
2025,970000,97000,4819,494123,Transferencia a la Asociación Fundaciones de Navarra PIES,40.000,40.000,40.000
2025,970000,97000,4819,494124,Acción sindical en prevención de riesgos laborales PE,400.000,400.000,400.000
2025,970000,97000,4819,494126,Convocatoria para el fomento de la cooperación entre entidades y/o empresas de la economía social,90.000,90.000,88.942
2025,970000,97000,4819,494127,Conferencia Sectorial. Ayudas para acciones ordinarias en prevención de riesgos laborales,416.792,830.955,316.439
2025,970000,97000,4819,494131,Subvención a la Confederación Empresarial de Navarra CEN para fomento y dinamización en materia igualdad en empresas,100.000,100.000,100.000
2025,970000,97000,4819,494132,Subvención acción sindical por figura de agente de igualdad,200.000,157.928,148.967
2025,970000,97000,4819,494133,(E) Convenio Asociación Denendako Sarea,8.000,8.000,8.000
2025,970000,97000,7709,494100,Inversiones en ejecución del Plan de Salud Laboral,260.000,260.000,253.317
2025,A00000,A0000,1000,331100,Retribuciones de altos cargos,138.802,142.973,142.969
2025,A00000,A0000,1100,331100,Retribuciones del personal eventual,69.851,71.952,71.947
2025,A00000,A0000,2061,331100,Arrendamiento de programas y licencias informáticos,11.000,11.000,9.438
2025,A00000,A0000,2120,331100,"Reparación, mantenimiento y conservación de edificios",20.000,20.000,64.795
2025,A00000,A0000,2150,331100,"Reparación, mantenimiento y conservación de mobiliario y enseres",5.040,5.040,2.804
2025,A00000,A0000,2200,331100,Material de oficina,4.000,4.000,2.751
2025,A00000,A0000,2202,331100,"Suscripciones, libros y prensa",2.000,2.000,1.441
2025,A00000,A0000,2221,331100,Comunicaciones postales,3.000,3.000,3.752
2025,A00000,A0000,2239,331100,"Mensajería, reparto y transportes",1.000,1.000,489
2025,A00000,A0000,2269,331100,Gastos diversos de la Sra. Consejera y Gabinete,6.000,6.000,7.740
2025,A00000,A0000,2269,331102,Gastos diversos,1.000,1.000,8.078
2025,A00000,A0000,2271,331100,Servicios de limpieza,2.000,2.000,0
2025,A00000,A0000,2276,331100,"Auditorías, estudios e informes",1.000,1.000,0
2025,A00000,A0000,2280,331100,"Calefacción, luz y agua",119.800,112.328,40.875
2025,A00000,A0000,2285,331100,Vestuario,1.500,1.500,1.499
2025,A00000,A0000,2301,331100,Gastos de viaje de la Sra. Consejera y Gabinete,6.000,6.000,6.982
2025,A00000,A0000,2301,331102,Locomoción y gastos de viaje del personal de la SGT y Servicios generales,1.000,1.000,0
2025,A00000,A0000,2339,331100,Consejo Navarro de la Cultura y las Artes,17.000,17.000,13.426
2025,A00000,A0000,6020,331100,Acondicionamiento del Departamento,40.200,40.200,39.209
2025,A00000,A0000,6050,331100,Mobiliario y equipamiento,3.500,3.500,2.433
2025,A00000,A0000,6060,331100,Equipos informáticos y de comunicaciones,30.000,30.000,29.940
2025,A00000,A0100,1200,331100,Retribuciones del personal fijo,637.708,654.166,637.515
2025,A00000,A0100,1210,331100,Retribuciones del personal contratado para cubrir plazas reservadas,10,0,0
2025,A00000,A0100,1211,331100,Retribuciones del personal contratado para cubrir vacantes,42.915,17.404,7.915
2025,A00000,A0100,1220,331100,Retribuciones del personal contratado temporal,116.193,92.612,83.367
2025,A00000,A0100,1250,331100,Retribuciones del personal contratado para sustituciones,118.901,420.661,372.141
2025,A00000,A0100,1400,331100,Retribuciones personales,2.125.586,2.163.206,1.975.934
2025,A00000,A0100,1600,331100,Seguridad social,3.212.926,3.249.191,2.973.837
2025,A00000,A0100,1702,331100,Horas extraordinarias,10,12,0
2025,A00000,A0100,1703,331100,Remuneración por trabajo en días festivos,22.450,23.222,23.108
2025,A00000,A0100,1707,331100,Remuneración por trabajo a turnos,37.955,39.253,34.406
2025,A00000,A0100,4809,331100,Indemnizaciones por responsabilidad patrimonial,10,10,0
2025,A00000,A0100,4809,331102,Ejecución de sentencias,10,7.482,7.482
2025,A20000,A2000,1000,334100,Retribuciones de altos cargos,66.164,68.154,68.150
2025,A20000,A2000,1200,334100,Retribuciones del personal fijo,146.732,151.067,151.061
2025,A20000,A2000,1200,334200,Retribuciones del personal fijo,65.219,67.182,47.804
2025,A20000,A2000,1210,334100,Retribuciones del personal contratado para cubrir plazas reservadas,10,0,0
2025,A20000,A2000,1210,334200,Retribuciones del personal contratado para cubrir plazas reservadas,10,0,0
2025,A20000,A2000,1211,334100,Retribuciones del personal contratado para cubrir vacantes,27.906,28.744,28.743
2025,A20000,A2000,1211,334200,Retribuciones del personal contratado para cubrir vacantes,10,0,0
2025,A20000,A2000,2262,334100,Publicidad y difusión,40.000,40.000,38.641
2025,A20000,A2000,2266,334102,"Gastos de organización de concursos, encuentros y otros actos",10.000,10.000,14.547
2025,A20000,A2000,2268,334100,Premio Príncipe de Viana,20.000,20.000,20.000
2025,A20000,A2000,2268,334102,Proyecto de difusión del Premio Joven talento artístico,10.000,10.000,10.000
2025,A20000,A2000,2269,334100,Gastos diversos,15.000,15.000,3.096
2025,A20000,A2000,2301,334100,Locomoción y gastos de viaje del personal de la DGC y la Sección de Recursos y Desarrollo Estratégico,10.000,10.000,9.060
2025,A20000,A2000,4301,921900,Convenio con la Fundación Amado Alonso para la financiación de programas,9.000,9.000,9.000
2025,A20000,A2000,4309,334104,Convenio con la Fundación José Miguel de Barandiarán,4.000,4.000,0
2025,A20000,A2000,4610,334100,"Convenio con Udalbiltza: Geuretik Sortuak, para el fomento de creadores y creadoras en euskera de Navarra",30.000,30.000,30.000
2025,A20000,A2010,2276,334100,Desarrollo PECN 2024-2028 y Ley Foral de Derechos Culturales de Navarra,40.000,40.000,26.799
2025,A20000,A2010,2276,334102,Observatorio Navarro de la Cultura,40.000,40.000,17.516
2025,A20000,A2010,2276,334108,(E) Puesta en marcha del desarrollo de la Plataforma Digital Literaria de Navarra,18.000,18.000,10.388
2025,A20000,A2010,2400,334200,Gastos de edición de publicaciones,125.000,125.000,146.405
2025,A20000,A2010,4709,334200,Ayudas a la edición a empresas privadas,125.000,125.000,121.815
2025,A20000,A2010,4816,334105,Convenio con la Asociación de Editores independientes de Navarra,70.000,70.000,70.000
2025,A20000,A2010,4816,334106,Convenio con la Asociación de Libreros de Navarra Diego de Haro,30.000,30.000,30.000
2025,A20000,A2010,4816,334108,Convenio con la Asociación Navarra de Escritores (ANE-NIE) para la realización de actividades de difusión,10.000,10.000,10.000
2025,A20000,A2010,4816,334200,Ayudas a la edición a entidades sin ánimo de lucro,55.000,55.000,46.658
2025,A20000,A2010,7609,334102,(E) Transf. Ayto Tudela: Proyecto Edificio Sementales,100.000,100.000,0
2025,A20001,A2100,1200,337100,Retribuciones del personal fijo,637.630,547.881,528.879
2025,A20001,A2100,1210,337100,Retribuciones del personal contratado para cubrir plazas reservadas,26.639,39.818,39.648
2025,A20001,A2100,1211,337100,Retribuciones del personal contratado para cubrir vacantes,104.205,169.823,169.788
2025,A20001,A2100,2120,337100,Mantenimiento de locales de Arqueología,10.000,10.000,7.980
2025,A20001,A2100,2150,337100,Mantenimiento y material fungible,2.000,2.000,1.426
2025,A20001,A2100,2190,337100,Gastos de conservación y mantenimiento de colecciones en museos,20.000,20.000,13.817
2025,A20001,A2100,2190,337103,Restauración y protección del patrimonio bibliográfico,3.000,3.000,3.000
2025,A20001,A2100,2200,337100,Material de oficina,2.000,2.000,3.865
2025,A20001,A2100,2202,337100,Adquisición de libros,1.000,1.000,777
2025,A20001,A2100,2262,337100,"Promoción, difusión del patrimonio histórico",95.000,95.000,115.123
2025,A20001,A2100,2269,337102,Gastos diversos,10.000,10.000,4.142
2025,A20001,A2100,2269,337400,Campañas arqueológicas propias y mantenimiento de yacimientos,200.000,200.000,192.928
2025,A20001,A2100,2273,337100,Servicios informáticos,3.500,3.500,295
2025,A20001,A2100,2276,337100,"Estudios, informes y trabajos técnicos",100.000,100.000,130.490
2025,A20001,A2100,2276,337104,Plan director de Arqueología,10.000,10.000,10.000
2025,A20001,A2100,2276,337108,Plan de coordinación y actuación ante Emergencias en Patrimonio Histórico,18.000,18.000,2.420
2025,A20001,A2100,2276,337109,Plan de formación y coordinación con las EELL sobre patrimonio histórico,5.000,5.000,726
2025,A20001,A2100,2276,337111,Estudio de afecciones de obras públicas e investigación en el castro de Murugain,13.000,13.000,12.998
2025,A20001,A2100,2280,337100,"Calefacción, luz y agua",18.000,18.000,8.968
2025,A20001,A2100,2301,337100,Locomoción y gastos de viaje del personal del Servicio de Patrimonio Histórico,25.000,25.000,18.272
2025,A20001,A2100,4300,337100,Fundación para la Conservación del Patrimonio Histórico de Navarra,10.000,10.000,10.000
2025,A20001,A2100,4309,337100,Patronato del Monasterio de Santa María la Real de Nájera,3.000,3.000,3.000
2025,A20001,A2100,4609,337100,Ayudas a entidades locales para intervenciones en patrimonio,120.000,120.000,116.221
2025,A20001,A2100,6020,337200,Proyecto Centro Técnico de la Cultura de Navarra,340.000,340.000,33.941
2025,A20001,A2100,6020,337400,Adecuación de locales,85.000,85.000,78.267
2025,A20001,A2100,6021,337100,"Conservación, restauración y adecuación de monumentos del Gobierno de Navarra",60.010,127.173,376.038
2025,A20001,A2100,6021,337102,MRR Rehabilitación de patrimonio histórico de uso turístico,732.689,780.746,780.746
2025,A20001,A2100,6021,337103,PRIN25 Monasterio de Leyre. Rehabilitación de la Hospedería,10,1.800.000,1.177.539
2025,A20001,A2100,6041,337100,Adquisición de equipamiento,20.000,20.000,19.953
2025,A20001,A2100,6054,333100,Material técnico y suministros de restauración,1.000,1.000,861
2025,A20001,A2100,6056,333102,Restauración de bienes muebles de museos propios,40.000,30.000,6.050
2025,A20001,A2100,6056,337100,Restauración y protección del patrimonio mobiliario,70.000,70.000,65.502
2025,A20001,A2100,6090,337103,Gastos para la implantación del Registro del Patrimonio Cultural,50.000,50.000,53.037
2025,A20001,A2100,6090,337400,Inventario del Patrimonio Arqueológico,50.000,50.000,50.303
2025,A20001,A2100,6094,337100,Informatización del Servicio de Patrimonio Histórico,15.000,15.000,5.919
2025,A20001,A2100,7300,337100,Fundación para la Conservación del Patrimonio Histórico de Navarra,10,10,0
2025,A20001,A2100,7609,337100,Restauración y protección de edificios histórico-artísticos de Entidades Locales,250.000,95.000,40.861
2025,A20001,A2100,7609,337107,Restauración y protección de yacimientos arqueológicos de Entidades Locales,200.000,200.000,196.090
2025,A20001,A2100,7609,337113,(E) Convenio Ayto. Valle de Ollo. Excavaciones Castillo de Garaño,15.000,15.000,0
2025,A20001,A2100,7609,337115,Convenio con Ayto. de Aranguren. Yacimiento de Irulegi,30.000,30.000,30.000
2025,A20001,A2100,7609,337116,(E) Convenio Ayto. Eslava excavaciones Santa Criz de Eslava,12.500,12.500,12.500
2025,A20001,A2100,7609,337121,Restauración y protección de patrimonio mobiliario de Entidades Locales,40.000,40.000,24.563
2025,A20001,A2100,7609,337122,Transferencia Ayto. Auritz-Burguete para intervención arqueológica en el yacimiento de Zaldua,20.000,20.000,18.832
2025,A20001,A2100,7609,337125,(E) Convenio Ayto. Eslava. Adecuación casa parroquial para ubicación Museo Yacimiento Arqueológico Sta. Criz,15.000,15.000,15.000
2025,A20001,A2100,7609,337126,Convenio con Ayuntamiento de Cascante para la consolidación y musealización Calcatorium de Cascantum,60.000,60.000,59.975
2025,A20001,A2100,7609,337127,Transferencia Ayuntamiento de Tafalla para excavaciones en el castro de Valdemediano,15.000,15.000,14.892
2025,A20001,A2100,7609,337128,Transferencia Junta de Amezcoa para el estudio arqueológico del castillo de Intzura,15.000,15.000,14.883
2025,A20001,A2100,7609,337129,(E) Convenio Ayto. Sangüesa para obras de consolidación y conservación del Castillón Sanguesa,60.000,60.000,60.000
2025,A20001,A2100,7609,337130,(E) Convenio Ayto. Mañeru monasterio Bargota,40.000,40.000,40.000
2025,A20001,A2100,7609,337132,(E) Convenio con el Ayuntamiento de Cascante: equipamiento sala multiusos y laboratorio,20.000,20.000,19.999
2025,A20001,A2100,7609,337133,(E) Transf. Ayto. Estella. Redacción Plan Director Arquitectura Defensiva de Estella/Lizarra,15.000,15.000,15.000
2025,A20001,A2100,7609,337134,"(E) Transf. Ayto. Estella/Lizarra. Convenio con Centro Estudios de Tierra Estella para ""Estudio Patrimonio Industrial""",28.000,28.000,28.000
2025,A20001,A2100,7809,337105,Ayudas para intervención en edificios protegidos,175.000,175.000,165.677
2025,A20001,A2100,7819,337100,Restauración y protección de edificios histórico-artísticos,220.854,320.854,314.370
2025,A20001,A2100,7819,337104,Ayudas para  intervenciones en patrimonio mobiliario,70.000,70.000,53.508
2025,A20001,A2100,7819,337105,PRIN25 Restauración y protección de edificios histórico-artísticos (Santa Maria Viana),10,830.000,609.508
2025,A20002,A2500,1200,334100,Retribuciones del personal fijo,460.678,495.001,481.585
2025,A20002,A2500,1210,334100,Retribuciones del personal contratado para cubrir plazas reservadas,10,21.477,15.848
2025,A20002,A2500,1211,334100,Retribuciones del personal contratado para cubrir vacantes,165.746,145.148,133.548
2025,A20002,A2500,2200,331100,Material de oficina,5.000,5.000,2.706
2025,A20002,A2500,2239,331100,"Mensajería, reparto y transportes",1.000,1.000,403
2025,A20002,A2500,2262,334100,Campañas de comunicación y publicidad de programas culturales propios,98.000,98.000,90.464
2025,A20002,A2500,2269,334100,Gastos diversos,25.000,25.000,17.580
2025,A20002,A2500,2279,334100,Programas de apoyo a los sectores culturales y artísticos,1.075.000,1.075.000,1.001.873
2025,A20002,A2500,2279,334103,Programas de apoyo al sector audiovisual,45.000,45.000,36.226
2025,A20002,A2500,2301,334100,Locomoción y gastos de viaje del personal del Servicio de Acción Cultural,6.000,6.000,3.860
2025,A20002,A2500,4300,335100,Programación artística de la Fundación Baluarte y de la Orquesta Sinfónica de Navarra,5.600.000,5.600.000,5.631.866
2025,A20002,A2500,4300,335102,Programación de la Fundación Baluarte en colaboración con la Dirección General de Cultura,265.000,297.038,265.000
2025,A20002,A2500,4400,334100,NICDO. Área de Cine e Industrias Audiovisuales y Digitales,810.000,810.000,810.000
2025,A20002,A2500,4400,334102,"NICDO. Desarrollo de la Industria Musical, Música en vivo, Navarra Music Commission y Girando por Navarra",1.400.000,1.400.000,1.400.000
2025,A20002,A2500,4609,334100,Ayudas a acciones culturales en Ayuntamientos,1.346.690,1.346.690,1.317.276
2025,A20002,A2500,4609,334102,Subvención a la Asociación Red de Teatros de Navarra,300.000,300.000,300.000
2025,A20002,A2500,4609,334105,Subvención a EPEL Tudela Cultura para el Festival de cine Ópera Prima,20.000,20.000,20.000
2025,A20002,A2500,4709,334100,Ayudas a viveros y fábricas de creación artística para el apoyo a proyectos profesionales y empresariales,30.000,30.000,27.798
2025,A20002,A2500,4709,334102,GENERAZINEMA: Ayudas a empresas y profesionales del sector audiovisual,885.725,900.044,845.186
2025,A20002,A2500,4709,334103,"ARTEM EXPORTA: Ayudas a eventos, festivales y certámenes de artes escénicas",120.000,120.000,115.401
2025,A20002,A2500,4709,334106,ARTEM PRO: Ayudas a empresas y profesionales para producción,300.000,300.000,279.250
2025,A20002,A2500,4709,334107,(E) Subvención a Faktoria Choreographic Center,40.000,40.000,40.000
2025,A20002,A2500,4709,334108,Ayudas para ampliar y diversificar la oferta cultural en Navarra,10,10,0
2025,A20002,A2500,4709,334109,Ayudas a laboratorios e incubadoras de creación de proyectos audiovisuales,10,126.165,124.370
2025,A20002,A2500,4809,334102,ÁGORART: Ayudas para la ampliación de estudios artísticos,135.000,135.000,123.058
2025,A20002,A2500,4816,334100,Subvención a KUNA Gestión Cultural de Navarra para actividades de formación y profesionalización,30.000,30.000,30.000
2025,A20002,A2500,4816,334104,IDEIA: Ayudas a entidades culturales para la difusión y la divulgación cultural,120.000,120.000,108.379
2025,A20002,A2500,4816,334106,Subvención a Entidades del Tercer Sector de Artes Escénicas y Musicales de Navarra,850.000,850.000,814.003
2025,A20002,A2500,4816,334107,(E) Subvención a la Escuela Navarra de Teatro,279.000,279.000,279.000
2025,A20002,A2500,4816,334112,(E) Convenio con la Federación Navarra de Teatro Amateur,30.000,30.000,30.000
2025,A20002,A2500,4816,334113,GENERAZINEMA festivales: ayudas a asociaciones para la organización de festivales de cine,15.000,15.000,15.000
2025,A20002,A2500,4816,334120,(E) Convenio asociación Gautxoriak,15.000,15.000,15.000
2025,A20002,A2500,4816,335102,(E) Subvención al Orfeón Pamplonés. Gastos de funcionamiento y actividad,271.000,271.000,271.000
2025,A20002,A2500,4816,335104,(E) convenio con Sinfonía Navarra-veinte21 Ensemble,30.000,30.000,30.000
2025,A20002,A2500,4816,335204,(E) Convenio con asociación URMUGA: Festival Urmuga,29.000,29.000,29.000
2025,A20002,A2500,4816,335205,(E) Subvención a Asociación Kulturix,35.000,35.000,35.000
2025,A20002,A2500,4816,335206,(E) Convenio asociación cultural Garaitzeko Asi,15.000,15.000,15.000
2025,A20002,A2500,7609,334110,(E) Transf. Ayto. Fontellas: ejecución Fase II Centro Sociocultural,150.000,150.000,150.000
2025,A20002,A2500,7609,334114,(E) Transf. Ayto. Valle Egüés: redacción proyecto construcción Casa Cultura,75.000,75.000,0
2025,A20002,A2500,7609,334115,(E) Transf. Ayto Peralta: Renovación del equipamiento de la casa de cultura,60.000,60.000,58.159
2025,A20002,A2500,7609,334116,(E) Convenio Junta del Valle de Salazar casa junta,100.000,100.000,100.000
2025,A20002,A2500,7609,334118,(E) Convenio con Junta Valle de Aezkoa Kultur Ola Etxea,35.000,35.000,34.744
2025,A20002,A2500,7816,335100,Subvención al Orfeón Pamplonés. Amortización préstamo inmobiliario,15.000,15.000,15.000
2025,A20003,A2300,1200,333100,Retribuciones del personal fijo,608.767,870.202,857.258
2025,A20003,A2300,1210,333100,Retribuciones del personal contratado para cubrir plazas reservadas,8.850,9.119,9.116
2025,A20003,A2300,1211,333100,Retribuciones del personal contratado para cubrir vacantes,436.151,153.485,148.290
2025,A20003,A2300,2020,333100,Arrendamiento de edificios,154.000,154.000,152.702
2025,A20003,A2300,2120,333100,"Reparación, mantenimiento y conservación de edificios",75.000,75.000,119.376
2025,A20003,A2300,2150,333100,"Reparación, mantenimiento y conservación de mobiliario y equipamiento",1.000,1.000,299
2025,A20003,A2300,2150,333102,Gastos de conservación y mantenimiento de colecciones museísticas propias,27.001,27.001,27.000
2025,A20003,A2300,2200,333100,Material de oficina,2.499,2.499,2.242
2025,A20003,A2300,2262,333100,Acciones de comunicación y promoción de museos,40.000,40.000,40.653
2025,A20003,A2300,2262,333102,Plan de comunicación del programa CulturIzan,10.000,10.000,7.287
2025,A20003,A2300,2262,333103,Plan de comunicación del circuito de Artes Plásticas y Visuales,10.000,10.000,9.774
2025,A20003,A2300,2266,333100,Formación en el ámbito museístico,5.000,5.000,2.794
2025,A20003,A2300,2269,333100,Exposiciones y programación cultural,337.000,337.000,422.597
2025,A20003,A2300,2269,333103,Gastos diversos,10.000,10.000,12.526
2025,A20003,A2300,2269,333104,Actividades pedagógicas,40.000,40.000,35.488
2025,A20003,A2300,2273,333100,Servicios informáticos,5.000,5.000,5.288
2025,A20003,A2300,2274,333100,Vigilancia y seguridad,917.477,917.477,808.480
2025,A20003,A2300,2276,333102,Estudio diagnóstico: Espacios expositivos en Navarra,18.000,18.000,5.175
2025,A20003,A2300,2279,333100,"Programa de apoyo a la música, danza y expresiones verbales populares",75.000,75.000,54.771
2025,A20003,A2300,2279,333102,Programa de apoyo a los sectores artísticos a través de circuitos de Artes Plásticas,75.000,75.000,51.907
2025,A20003,A2300,2279,333103,Coordinación de programas propios,0,0,16.266
2025,A20003,A2300,2280,333100,"Calefacción, luz y agua",157.000,157.000,71.408
2025,A20003,A2300,2284,333100,Material de limpieza,2.000,2.000,1.447
2025,A20003,A2300,2285,333100,Vestuario,1.000,1.000,1.102
2025,A20003,A2300,2301,333100,Locomoción y gastos de viaje del personal,7.000,7.000,9.237
2025,A20003,A2300,4300,333100,Fundación Baluarte. Encuentros de Pamplona 2024-2026,200.000,200.000,200.000
2025,A20003,A2300,4301,333100,Convenio con el Museo Gayarre. Gastos de funcionamiento y actividad,30.000,30.000,30.000
2025,A20003,A2300,4301,333102,(E) Fundación Museo Oteiza. Gastos de funcionamiento y actividad,997.000,997.000,997.000
2025,A20003,A2300,4301,333103,Centro de Arte Contemporáneo de Huarte. Ayudas para artes plásticas,90.000,90.000,90.000
2025,A20003,A2300,4301,333104,Convenio con Centro de Arte Contemporáneo de Huarte para máster interuniversitario,110.000,110.000,110.000
2025,A20003,A2300,4301,333105,Centro de Arte Contemporáneo de Huarte. Gastos de funcionamiento y actividad,490.000,490.000,490.000
2025,A20003,A2300,4301,333106,Fundación Museo Oteiza. Archivo Oral,20.000,20.000,20.000
2025,A20003,A2300,4301,333107,(E) Subvención a Fundación Museo Oteiza. Continuación e impulso al Proyecto DANOK,10.000,10.000,10.000
2025,A20003,A2300,4301,333108,(E) Subvención al Centro de Arte Contemporáneo de Huarte. Proyecto Dantzan Bilaka,20.000,20.000,20.000
2025,A20003,A2300,4455,333100,Convenio con la Cátedra de Patrimonio Inmaterial,30.000,30.000,29.979
2025,A20003,A2300,4609,333100,Convenio con el Museo Gustavo de Maeztu. Gastos de funcionamiento y actividad,30.000,30.000,30.000
2025,A20003,A2300,4609,333102,Convenio con el Museo Muñoz Sola de Arte Moderno. Gastos de funcionamiento y actividad,30.000,30.000,30.000
2025,A20003,A2300,4609,333104,(E) Convenio con el Ayto. Tafalla Centro Interpretación Jota,25.000,25.000,21.109
2025,A20003,A2300,4800,333100,Becas,10,10,0
2025,A20003,A2300,4816,333100,Ayudas a museos y colecciones museográficas permanentes. Gastos de funcionamiento y actividad,137.500,137.500,136.147
2025,A20003,A2300,4816,333102,Subvención a Ondarezain,6.000,6.000,6.000
2025,A20003,A2300,4816,333103,Sustraiak-Raíces: ayudas a entidades culturales para proyectos de Patrimonio Cultural Inmaterial,60.000,60.000,49.834
2025,A20003,A2300,4816,333104,(E) Convenio con El Empedrao: arte efímero para la reflexión,34.350,34.350,0
2025,A20003,A2300,4816,333111,Convenio con asociación ESKUAHALDUNAK. Difusión obras escultóricas navarras,10.000,10.000,8.109
2025,A20003,A2300,4816,333112,(E) Subvención a Asociación navarra de Escultores,10.000,10.000,10.000
2025,A20003,A2300,6020,333100,"Obras, estudios y proyectos en edificios",215.000,216.503,149.819
2025,A20003,A2300,6020,333102,MRR. Obras de mejora energética del Museo de Navarra,2.081.574,3.181.820,2.317.199
2025,A20003,A2300,6050,333100,Mobiliario y equipamiento,8.630,8.630,10.958
2025,A20003,A2300,6056,333100,Adquisición de bienes culturales,90.000,90.000,80.613
2025,A20003,A2300,6056,333102,Conservación - Restauración Museos propios,104.226,104.226,107.301
2025,A20003,A2300,6060,333100,Informatización del Servicio de Museos,15.000,15.000,14.829
2025,A20003,A2300,6081,333100,Adquisición de fondos editoriales,2.000,2.000,994
2025,A20003,A2300,6090,333102,"Inventario, catalogación y digitalización de fondos",65.000,65.000,77.207
2025,A20003,A2300,6094,333100,Aplicaciones informáticas,15.000,15.000,0
2025,A20003,A2300,7301,333100,Casa-Museo Julián Gayarre. Inversiones,22.500,22.500,22.477
2025,A20003,A2300,7301,333102,Fundación Museo Oteiza. Inversiones,32.000,32.000,32.000
2025,A20003,A2300,7301,333103,Centro de Arte Contemporáneo de Huarte. Inversiones,32.000,32.000,32.000
