2025,710000,71200,2279,412100,Encargo a TRACASA Instrumental. Contratación de trabajos sanidad y producción vegetal,22.000,22.000,18.142
2025,710000,71200,2279,412103,Encargo a GAN. Actividades de prevención en sanidad vegetal,25.000,25.000,24.865
2025,710000,71200,2279,412105,Encargo a INTIA. Contratación de trabajos sanidad y producción vegetal,184.652,184.652,166.779
2025,710000,71200,2279,468100,Encargo a INTIA. Proyectos europeos,10,10,0
2025,710000,71200,2301,412100,Locomoción y gastos de viaje,23.000,23.000,15.170
2025,710000,71200,4400,467402,Actuaciones de INTIA en los ensayos de calidad de las variedades vegetales,45.000,45.000,45.200
2025,710000,71200,4400,467404,"Actividades de experimentación, investigación y desarrollo en el sector agrario, a través de INTIA",2.050.000,2.050.000,2.049.787
2025,710000,71200,4700,412100,Indemnización por arranque de plantaciones,10,10,0
2025,710000,71200,4700,412102,Responsabilidad patrimonial. Arranque de plantaciones,10,10,0
2025,710000,71200,4700,412103,Ayuda de mínimis para la remolacha azucarera,100.000,100.000,100.000
2025,710000,71200,4700,412107,Ayudas a los daños en infraestructuras privadas y a la pérdida de rentas por inundaciones extraordinarias,10,10,0
2025,710000,71200,4701,412102,Fomento de la producción de patata de siembra,120.000,90.255,83.070
2025,710000,71200,6030,411100,"Maquinaria, instalaciones y utillaje",5.000,5.000,0
2025,710000,71200,7700,412100,MRR Ayudas a inversiones en materia de Bioseguridad en viveros,95.319,95.319,95.319
2025,710001,71200,1200,414200,Retribuciones del personal fijo,224.132,287.283,254.673
2025,710001,71200,1210,414200,Retribuciones del personal contratado para cubrir plazas reservadas,36.065,3,0
2025,710001,71200,1211,414200,Retribuciones del personal contratado para cubrir vacantes,92.756,77.735,74.411
2025,710001,71200,2214,412300,"Material, utillaje y herramientas",4.500,4.500,0
2025,710001,71200,2276,414202,Encargo a TRACASA Instrumental. Contratación de trabajos para la gestión de ayudas,190.000,190.000,141.065
2025,710001,71200,2276,414203,Encargo a INTIA. Contratación de trabajos para la gestión de ayudas,1.221.709,1.221.709,1.213.917
2025,710001,71200,2276,414204,Convenio con las Entidades Colaboradoras para la tramitación de las solicitudes únicas de ayuda de la PAC,300.000,254.708,252.775
2025,710001,71200,2279,414200,Otros trabajos realizados por terceros,90.750,90.750,92.110
2025,710001,71200,4700,414205,PDR FEADER 2014-2020. Medida Producción Ecológica,0,7.075,7.075
2025,710001,71200,4700,414206,PDR FEADER 14-20. Medida Agroambiente y Clima,4.366,4.366,1.153
2025,710001,71200,4700,414207,PDR FEADER 14-20. Medidas agroambientales para la conservación de la fauna,14.000,14.000,12.437
2025,710001,71200,4700,414208,PDR FEADER 14-20. Indemnización compensatoria,8.100.000,7.936.351,7.691.507
2025,710001,71200,4700,414209,PEPAC FEADER 23-27. Intervenciones Regionales. Compromisos medioambientales y climáticos,4.370.094,4.370.094,3.985.209
2025,710001,71200,4700,414210,Compensación por primas de seguro a través de Agroseguro,5.000.000,5.075.037,5.074.942
2025,710001,71200,4700,414211,PEPAC FEADER 23-27. Medida producción ecológica,2.901.008,3.259.861,3.119.166
2025,710001,71200,4700,414212,Mejora de la producción y comercialización de la miel. FEAGA,65.000,65.000,62.942
2025,710001,71200,4700,414214,PEPAC FEADER 23-27. Medidas agroambientales  para la conservación de la biodiversidad,1.158.208,905.928,681.057
2025,710001,71200,4700,414216,Prima pastoreo en zona preferente no cofinanciada. Campaña 2014. PEPAC Sistemas Ganaderos Sostenibles,0,163.290,163.290
2025,710002,71200,1200,412300,Retribuciones del personal fijo,374.551,312.646,311.885
2025,710002,71200,1210,412300,Retribuciones del personal contratado para cubrir plazas reservadas,10,12,0
2025,710002,71200,1211,412300,Retribuciones del personal contratado para cubrir vacantes,184.597,261.906,250.944
2025,710002,71200,2279,412100,Planes de distribución de fruta y leche en los colegios,360.000,240.000,196.251
2025,710002,71200,4700,412300,Pagos por devolución de ayudas retenidas,10,10,15.367
2025,710002,71200,4700,412303,Ayuda excepcional de minimis para el sector del champiñón en la Comunidad Foral de Navarra 2025,0,50.000,13.860
2025,710004,71300,1200,412200,Retribuciones del personal fijo,724.227,754.165,751.000
2025,710004,71300,1210,412200,Retribuciones del personal contratado para cubrir plazas reservadas,72.179,53.207,53.165
2025,710004,71300,1211,412200,Retribuciones del personal contratado para cubrir vacantes,267.189,246.815,223.462
2025,710004,71300,2214,412200,"Material, instrumental y equipamiento de uso veterinario",20.000,20.000,8.259
2025,710004,71300,2218,412200,Productos veterinarios,6.000,6.000,642
2025,710004,71300,2269,412200,Gastos diversos,19.990,14.516,37.943
2025,710004,71300,2279,412200,Encargo a INTIA. Asistencia técnica servicio de ganadería,892.480,844.969,774.616
2025,710004,71300,2279,412202,Encargo a TRACASA Instrumental. Asistencia técnica servicio de ganadería,52.000,27.674,27.674
2025,710004,71300,2279,412203,Encargo a INTIA. Actuaciones epidemiovigilancia y control en ganadería,67.253,67.253,54.130
2025,710004,71300,2279,412204,Otros trabajos realizados por terceros,26.660,26.660,23.355
2025,710004,71300,2279,412205,Vacunaciones oficiales de emergencia,650.010,984.789,984.786
2025,710004,71300,2279,412206,Campaña de saneamiento,1.320.000,1.320.000,1.318.302
2025,710004,71300,2279,412207,Gestión del centro de acogida de animales del Gobierno de Navarra,192.000,192.000,173.097
2025,710004,71300,2279,412209,"Campañas de control, sensibilización y promoción sobre tenencia responsable",10.000,10.000,17.243
2025,710004,71300,2279,412213,Encargo a INTIA. Mantenimiento del Panel de Cata de Aceite,67.000,67.000,57.143
2025,710004,71300,2289,412200,Material para identificación animal,331.500,349.650,341.904
2025,710004,71300,2301,412200,Locomoción y gastos de viaje,5.000,5.000,7.459
2025,710004,71300,4400,412206,Convenio con INTIA. Actuaciones para el mantenimiento de razas autóctonas,270.000,270.000,269.989
2025,710004,71300,4609,412200,Ferias y certámenes ganaderos,55.000,43.180,22.704
2025,710004,71300,4609,412202,Ayudas a entidades locales por acciones en protección animal,245.000,245.000,102.268
2025,710004,71300,4700,412200,Ayuda a empresas lácteas por la recogida de leche de vaca en zonas de montaña,60.000,60.000,60.000
2025,710004,71300,4700,412202,Ayudas plan estratégico de la oveja latxa,132.000,132.000,122.536
2025,710004,71300,4700,412204,(E)  Ayudas para el tratamiento y gestión de lana de ovejas latxas como residuo,12.000,12.000,0
2025,710004,71300,4700,412207,Ayuda a la trashumancia,90.000,90.000,89.716
2025,710004,71300,4700,412210,Ayuda para compensar pérdidas económicas por enfermedades emergentes,10,10,322
2025,710004,71300,4700,412211,(E) Ayuda a la compra de collares de vallado virtual,50.000,109.820,109.750
2025,710004,71300,4700,412212,Ayudas para servicios de sustitución en explotaciones ganaderas,0,0,3.426
2025,710004,71300,4819,412200,PDR FEADER 14-20. Asociaciones ganaderas,480.000,480.000,467.993
2025,710004,71300,4819,412202,Ayudas a Asociaciones ganaderas de razas no autóctonas,270.000,270.000,270.000
2025,710004,71300,4819,412203,Fomento de agrupaciones de defensa sanitaria en diversas especies,220.000,201.850,198.292
2025,710004,71300,4819,412206,Ayudas a entidades colaboradoras reconocidas en acciones de protección de animales,50.000,50.000,13.474
2025,710004,71300,6031,412200,Mantenimiento y mejora de las instalaciones del centro de acogida de animales del Gobierno de Navarra,30.000,30.000,0
2025,710004,71300,6054,412200,Equipamiento e instrumental técnico,15.000,15.000,13.093
2025,710004,71300,7609,412200,Ayudas a entidades locales por acciones en protección animal,125.000,125.000,25.000
2025,710004,71300,7609,412202,Ayudas a entidades colaboradoras reconocidas en acciones de protección animal,30.000,30.000,7.062
2025,710004,71300,7700,412200,Indemnización por sacrificio a causa de epizootias,120.000,144.326,139.969
2025,710004,71300,7700,412202,Responsabilidad patrimonial. Sacrificio a causa de epizootias y lucro cesante por inmovilización de explotaciones,10,10,0
2025,710004,71300,7700,412205,MRR Ayudas a inversiones en materia de Bioseguridad en centros de limpieza y desinfección,319.119,491.478,203.453
2025,710004,71300,7700,412206,Ayudas a la reposición y lucro cesante por sacrificios a causa de epizootias,200.000,152.000,134.653
2025,710005,71300,1200,412200,Retribuciones del personal fijo,1.016.403,875.028,857.835
2025,710005,71300,1210,412200,Retribuciones del personal contratado para cubrir plazas reservadas,51.944,64.409,57.013
2025,710005,71300,1211,412200,Retribuciones del personal contratado para cubrir vacantes,519.619,535.516,514.456
2025,710005,71300,2214,412200,Reactivos y pequeño utillaje de laboratorio,400.000,403.065,504.362
2025,710005,71300,2276,412200,"Sistema de calidad del laboratorio: auditorías, mantenimiento, verificación de equipos",44.800,44.800,65.871
2025,710005,71300,2276,412202,Auditorías para el control de la Cadena Alimentaria,21.420,21.420,12.963
2025,710005,71300,2279,412205,Encargo a NASERTIC. Análisis oficiales en calidad y seguridad alimentaria,600.000,600.000,576.481
2025,710005,71300,2280,412200,Calefacción,15.000,15.000,10.009
2025,710005,71300,2283,412200,"Material para reposición, conservación y repuestos",40.000,40.000,26.994
2025,710005,71300,6054,412202,Equipo de laboratorio y material técnico,90.000,90.000,78.305
2025,710006,71500,1200,414100,Retribuciones del personal fijo,567.284,556.613,553.362
2025,710006,71500,1210,414100,Retribuciones del personal contratado para cubrir plazas reservadas,10,12,0
2025,710006,71500,1211,414100,Retribuciones del personal contratado para cubrir vacantes,78.718,108.527,106.195
2025,710006,71500,2269,414400,Gastos diversos,20.700,19.141,4.151
2025,710006,71500,2276,414103,Encargo a INTIA. Asistencia técnica en materia de regadíos y concentración parcelaria,850.000,1.020.000,824.688
2025,710006,71500,2276,414300,Encargo a TRACASA Instrumental. Asistencia técnica en tareas auxiliares para la gestión de expedientes de ayudas,7.500,7.500,2.858
2025,710006,71500,2276,414302,Encargo a INTIA. Asistencia técnica en tareas auxiliares para la gestión de expedientes de ayudas,122.500,122.500,121.535
2025,710006,71500,2279,414300,"Gastos de notaría, registro y otros",41.399,41.399,7.781
2025,710006,71500,2301,414300,Locomoción y gastos de viaje,10.350,10.350,548
2025,710006,71500,4400,414105,Transferencia corriente INTIA,10,10,0
2025,710006,71500,4700,414100,Canon de los riegos del Canal de Navarra,19.736.000,18.824.378,16.935.322
2025,710006,71500,4700,414103,Indemnización por pérdidas en cultivos permanentes,30.000,30.000,0
2025,710006,71500,6019,414104,Encargo a INTIA. Concentración parcelaria Ribaforada-Canal de Lodosa,92.078,162.078,119.228
2025,710006,71500,6019,414105,Encargo a INTIA. Concentración parcelaria Lerín,57.623,57.623,36.931
2025,710006,71500,6019,414302,Obras de reordenación de la propiedad y concentración parcelaria,65.269,70.269,75.362
2025,710006,71500,6019,414304,PDR FEADER 2014-2020. Concentración parcelaria,0,643.180,639.880
2025,710006,71500,6019,414305,PEPAC FEADER 23-27. Concentración parcelaria,1.129.710,0,0
2025,710006,71500,7400,414302,(E) Transferencia de capital a INTIA para inversiones en maquinaria y espacios,10,100.010,0
2025,710006,71500,7609,414100,PDR FEADER 14-20. Inversiones para infraestructuras en regadío en comunales,700.000,200.000,57.994
2025,710006,71500,7609,414300,PDR FEADER 14-20 Inversiones en infraestructuras locales ganaderas,0,17.359,17.359
2025,710006,71500,7609,414302,PDR FEADER 14-20 EURI. Inversiones para infraestructuras en regadío,72.176,172.729,172.280
2025,710006,71500,7609,414303,PEPAC FEADER 23-27. Inversiones en infraestructuras locales ganaderas,1.147.439,1.130.080,858.694
2025,710006,71500,7609,414402,Ayudas infraestructuras agrarias públicas dañadas por incendios e inundaciones extraordinarias,1.395.566,1.395.566,1.197.234
2025,710006,71500,7700,414400,Ayudas infraestructuras agrarias privadas dañadas por incendios e inundaciones extraordinarias,10,10,0
2025,710006,71500,7809,414300,PDR FEADER 14-20 EURI. Inversiones para infraestructuras en regadío,1.736.331,4.832.467,4.832.467
2025,710006,71500,7809,414302,PRIN25 Inversiones para infraestructuras en regadío,10,1.469.000,721.634
2025,710006,71500,7809,414303,Inversiones para infraestructuras en regadío,0,653.190,653.190
2025,710006,71500,7819,414100,Reparación de infraestructuras agrarias de Comunidades de Regantes por inundaciones extraordinarias,10,10,0
2025,710007,71500,1200,456600,Retribuciones del personal fijo,233.838,261.226,255.022
2025,710007,71500,1210,456600,Retribuciones del personal contratado para cubrir plazas reservadas,10,12,0
2025,710007,71500,1211,456600,Retribuciones del personal contratado para cubrir vacantes,72.129,55.525,52.682
2025,710007,71500,2276,414103,"Encargo a TRACASA INSTRUMENTAL, S.L. Estudios y proyectos",0,0,0
2025,710007,71500,2276,456602,Encargo a INTIA. Asistencia en gestión de expedientes comunales,201.477,201.477,207.590
2025,710007,71500,2276,45A100,MRR C4. Mejora de Vías Pecuarias,45.282,0,0
2025,710007,71500,2276,45A102,Encargo a GAN. Estudios y proyectos,60.000,60.000,58.600
2025,710007,71500,2279,456600,Encargo a TRACASA Instrumental. Asistencia en gestión de expedientes comunales,16.000,16.000,98.029
2025,710007,71500,6002,45A103,PDR FEADER 14-20. Mejora de cañadas y Camino de Santiago,67.101,67.101,67.100
2025,710007,71500,6002,45A104,PEPAC FEADER 23-27. Mejora de cañadas y Camino de Santiago,25.150,25.150,24.817
2025,710007,71500,6019,456702,"Inversiones forestales, cinegéticas y vías pecuarias",41.400,44.400,38.458
2025,710007,71500,6019,456703,MRR C4. Mejoras de Vías Pecuarias,10,119.284,119.284
2025,710007,71500,6094,456300,Encargo a TRACASA Instrumental. Aplicaciones informáticas,12.800,12.800,12.792
2025,710007,71500,7609,456602,Realización de deslindes y defensa y redención del comunal,50.000,42.000,0
2025,710008,71200,2030,468100,Arrendamiento de maquinaria,4.725,4.725,17.713
2025,710008,71200,2160,456200,Mantenimiento de las redes meteorológica e hidrológica,375.000,375.000,336.444
2025,710008,71200,2276,468100,Encargo a TRACASA Instrumental. Estudios de los recursos naturales agrarios,139.552,139.552,126.934
2025,710008,71200,6030,456200,Instalaciones y mejoras en las redes meteorológica e hidrológica,42.000,42.000,41.948
2025,710008,71500,1200,456200,Retribuciones del personal fijo,203.031,200.984,191.204
2025,710008,71500,1210,456200,Retribuciones del personal contratado para cubrir plazas reservadas,10,12,0
2025,710008,71500,1211,456200,Retribuciones del personal contratado para cubrir vacantes,10,8.092,8.079
2025,720001,72000,1200,414200,Retribuciones del personal fijo,77.670,70.398,51.848
2025,720001,72000,1210,414200,Retribuciones del personal contratado para cubrir plazas reservadas,10,11,0
2025,720001,72000,1211,414200,Retribuciones del personal contratado para cubrir vacantes,85.829,83.293,73.148
2025,720001,72400,1200,414200,Retribuciones del personal fijo,716.726,616.663,603.168
2025,720001,72400,1210,414200,Retribuciones del personal contratado para cubrir plazas reservadas,79.917,75.932,71.057
2025,720001,72400,1211,414200,Retribuciones del personal contratado para cubrir vacantes,124.208,230.385,200.009
2025,720001,72400,2269,414200,Gastos diversos,10.000,10.000,0
2025,720001,72400,2273,414200,Servicios informáticos Organismo Pagador,436.124,436.124,445.850
2025,720001,72400,2276,414200,Encargo a TRACASA Instrumental. Contratación de trabajos para control de ayudas,82.000,82.000,53.776
2025,720001,72400,2276,414202,Encargo a TRACASA Instrumental. Actualización Sig-Pac,56.100,56.100,46.365
2025,720001,72400,2276,414203,Encargo a INTIA. Contratación de trabajos para control de ayudas,772.634,772.634,811.333
2025,720001,72400,2301,414200,Locomoción y gastos de viaje,10.000,10.000,3.251
2025,720001,72400,4700,414200,Correcciones financieras de fondos comunitarios,10,32.386,32.376
2025,720001,72400,6094,414200,Licencias informáticas imágenes,2.000,0,0
2025,720003,72200,1200,413100,Retribuciones del personal fijo,272.293,275.412,275.401
2025,720003,72200,1210,413100,Retribuciones del personal contratado para cubrir plazas reservadas,10,12,0
2025,720003,72200,1211,413100,Retribuciones del personal contratado para cubrir vacantes,36.065,31.042,18.057
2025,720003,72200,2273,413100,Servicios informáticos cadena de comercialización,5.000,5.000,0
2025,720003,72200,2279,413100,Otros trabajos realizados por terceros,450.000,450.000,374.166
2025,720003,72200,2279,413102,Encargo a INTIA. Informes técnicos y tutorías,70.000,70.000,59.844
2025,720003,72200,2279,413103,Encargo a TRACASA Instrumental. Asistencia técnica tramitación de ayudas y control de la cadena de comercialización,51.000,51.000,24.782
2025,720003,72200,2279,413104,Gastos diversos,13.004,63.004,21.374
2025,720003,72200,2279,413105,"Encargo a INTIA. Innovación de la cadena de valor, la venta directa, circuitos cortos y PLEA",260.000,260.000,259.519
2025,720003,72200,2279,413108,Encargo a INTIA. Observatorio ley de la cadena agroalimentaria,140.000,140.000,101.482
2025,720003,72200,2279,413112,Encargo a  INTIA. Asistencia técnica tramitación de ayudas y control de la cadena de comercialización,381.000,381.000,448.300
2025,720003,72200,4400,413100,Convenio INTIA para el fomento de las producciones de calidad agroalimentaria y del producto local,1.352.626,2.133.273,1.968.953
2025,720003,72200,4400,413102,Centro de distribución de canales cortos agroalimentarios. Convenio INTIA,70.000,70.000,8.582
2025,720003,72200,4400,413103,(E) Convenio INTIA. Promoción RG en Vuelta Ciclista al País Vasco (Itzulia),15.000,15.000,14.980
2025,720003,72200,4459,413100,Subvención al Consejo Regulador de la Producción Ecológica,300.000,300.000,300.000
2025,720003,72200,4459,413102,Convenio con CPAEN. Asesoría en restauración colectiva,125.010,125.010,121.373
2025,720003,72200,4459,413105,PDR FEADER 14-20. Promoción figuras calidad alimentaria,10,10,0
2025,720003,72200,4459,413107,PEPAC FEADER 23-27. Promoción de los productos agrícolas y alimenticias en los regímenes de calidad,1.100.000,965.000,897.493
2025,720003,72200,4609,413100,(E) Ayudas a entidades locales para el fomento de canales cortos de comercialización agroalimentaria,62.500,62.500,48.299
2025,720003,72200,4700,413100,Ayudas a los y las productoras de alimentos en canales cortos de comercialización,25.000,25.000,20.533
2025,720003,72200,4700,414200,Ayudas a los y las productoras en producción ecológica en canales cortos de comercialización,100.000,100.000,16.601
2025,720003,72200,4701,413103,Ayudas a actividades de control y certificación de producciones de calidad,550.000,635.000,619.896
2025,720003,72200,4701,413104,Ayudas a la participación de producciones de calidad diferenciada en certámenes y ferias,450.000,775.000,683.033
2025,720003,72200,4819,413102,Ayudas a asociaciones de artesanos agroalimentarios,50.000,50.000,50.000
2025,720003,72200,4819,413104,Ayudas a asociaciones de productores canales cortos,250.000,250.000,240.297
2025,720003,72200,4819,413105,Convenio Asociación Bodegas de Navarra (ABN),50.000,50.000,50.000
2025,720004,72200,1200,412100,Retribuciones del personal fijo,547.615,509.653,502.119
2025,720004,72200,1210,412100,Retribuciones del personal contratado para cubrir plazas reservadas,10,12,0
2025,720004,72200,1211,412100,Retribuciones del personal contratado para cubrir vacantes,36.065,74.299,67.452
2025,720004,72200,1220,412102,MRR retribuciones de personal contratado temporal,0,75.201,12.273
2025,720004,72200,1400,412102,MRR retribuciones personales,0,24.721,0
2025,720004,72200,1600,412102,MRR seguridad social,0,18.089,2.014
2025,720004,72200,2301,412100,Locomoción y gastos de viaje,9.990,9.990,7.852
2025,720004,72200,4701,412102,(E) Convenio Coop. Ag. Sto. Cristo de Caparroso proceso integración Coop. Ag. S. Isidro Labrador de Murillo el Fruto,60.000,60.000,60.000
2025,720004,72200,4819,412100,Subvención a la Unión de Cooperativas Agrarias de Navarra (UCAN). Fomento del cooperativismo agrario,275.000,275.000,275.000
2025,720004,72200,4819,412102,Subvención a UAGN para la defensa de los intereses de agricultores y ganaderos,153.334,153.334,153.334
2025,720004,72200,4819,412103,Subvención a EHNE para la defensa de los intereses de agricultores y ganaderos,86.658,86.658,85.658
2025,720004,72200,7400,412100,(E) Transferencia de capital a INTIA para inversiones en maquinaria y espacios,10,10,0
2025,720004,72200,7700,412102,PDR FEADER 14-20. Inversiones en explotaciones agrarias,11.600.240,10.742.864,8.441.750
2025,720004,72200,7700,412103,PDR FEADER 14-20. Instalación de jóvenes agricultores,1.081.004,1.081.004,969.176
2025,720004,72200,7700,412110,MRR Ayudas aplicación de agricultura de precisión y tecnologías 4.0 en el sector agrícola y ganadero,10.402.630,10.287.630,9.904.418
2025,720004,72200,7700,412111,PO FEMPA 21-27. Inversiones en explotaciones acuícolas,1.100.000,950.000,527.609
2025,720004,72200,7700,412112,PEPAC FEADER 23-27. Ayudas al establecimiento de jóvenes y nuevas personas agricultoras,2.260.000,2.260.000,2.245.000
2025,720004,72200,7700,412113,PEPAC FEADER 23-27. Ayudas a inversiones en explotaciones agrarias,1.104.424,1.104.424,1.020.280
2025,720005,72200,1200,412100,Retribuciones del personal fijo,170.462,164.213,154.588
2025,720005,72200,1210,412100,Retribuciones del personal contratado para cubrir plazas reservadas,10,12,0
2025,720005,72200,1211,412100,Retribuciones del personal contratado para cubrir vacantes,150.939,161.715,133.752
2025,720005,72200,2269,412103,"Reuniones técnicas, foros y formación",4.000,4.000,933
2025,720005,72200,2269,412104,Gastos diversos Museo del Vino,98.532,98.532,97.195
2025,720005,72200,2269,467400,Gastos diversos,90.000,90.000,124.565
2025,720005,72200,6020,412200,Obras acondicionamiento Museo del Vino,5.000,5.000,0
2025,720005,72200,6020,467400,Obras de adecuación de la bodega experimental,15.000,35.985,40.985
2025,720005,72200,6050,412100,Mobiliario Museo del Vino,2.000,2.000,0
2025,720005,72200,6054,467400,Equipamiento y material técnico,35.000,26.895,27.743
2025,720005,72200,6060,412100,Equipos audiovisuales Museo del Vino,8.000,120,120
2025,720005,72200,6094,412100,Audiovisuales y programas Museo del Vino,3.000,0,0
2025,720006,72300,1200,412100,Retribuciones del personal fijo,160.285,127.806,124.197
2025,720006,72300,1210,412100,Retribuciones del personal contratado para cubrir plazas reservadas,10,18.654,18.641
2025,720006,72300,1211,412100,Retribuciones del personal contratado para cubrir vacantes,36.065,42.111,30.322
2025,720006,72300,2269,412100,Gastos diversos,6.000,6.000,9.091
2025,720006,72300,2276,412105,"Encargo a INTIA. Asistencia Técnica: arraigo, valores y nueva ruralidad y otros",260.000,260.000,167.500
2025,720006,72300,2276,412106,Encargo a GAN. Asistencia técnica,40.000,40.000,35.376
2025,720006,72300,2279,412103,Contratación de trabajos externos,90.000,115.000,96.250
2025,720006,72300,2279,412104,Encargo a TRACASA Instrumental. Asistencia técnica al Servicio de Diversificación y Desarrollo Rural,77.000,77.000,32.474
2025,720006,72300,2279,412106,"Acciones relevo generacional en el territorio rural ""NafarLekukoa-Pasa el testigo""",10,10,0
2025,720006,72300,2279,412107,Encargo a INTIA. Asistencia técnica al Servicio de Diversificación y Desarrollo Rural,727.200,727.200,659.647
2025,720006,72300,2301,412100,Locomoción y gastos de viaje,5.000,5.000,2.696
2025,720006,72300,4400,412100,PDR FEADER 14-20. Actividades de formación,250.000,250.000,246.524
2025,720006,72300,4400,412102,Actividades de Formación Agraria a través de INTIA,10,10,0
2025,720006,72300,4609,412100,(E) Convenio con Mancomunidad de Sakana diagnóstico alimentación sostenible,40.000,40.000,39.710
2025,720006,72300,4819,412103,Impulso asociaciones espacios test agrarios,50.000,50.000,0
2025,720006,72300,4819,412104,(E) Convenio Artalde. Escuela de pastoreo del Pirineo. Relevo agrario,37.000,37.000,36.794
2025,720006,72300,7609,412100,(E) Convenio Ayto. Roncal. Acondicionamiento espacio de formación,20.000,20.000,16.727
2025,720007,72300,1200,412100,Retribuciones del personal fijo,80.186,119.540,119.337
2025,720007,72300,1210,412100,Retribuciones del personal contratado para cubrir plazas reservadas,10,12,0
2025,720007,72300,1211,412100,Retribuciones del personal contratado para cubrir vacantes,62.704,45.319,32.701
2025,720007,72300,4400,412108,PDR FEADER 14-20. Servicios de asesoramiento a través de INTIA,840.000,840.000,840.000
2025,720007,72300,4400,412109,PEPAC FEADER 23-27. Servicios de asesoramiento a través de INTIA,1.260.000,1.260.000,1.260.000
2025,720007,72300,4819,412103,"Convenio con los GAL: Cederna, Eder, Teder y Zona Media para 'Pueblos vivos y activos-Landa herriak bizirik'",175.000,175.000,174.997
2025,720007,72300,7700,412102,PDR FEADER 14-20. Proyectos piloto de cooperación,1.205.000,1.205.000,790.877
2025,720007,72300,7700,412104,PEPAC FEADER 23-27. Otras formas de cooperación. Proyectos piloto de innovación,10,10,0
2025,720007,72300,7709,414200,PDR FEADER 14-20. Creación y desarrollo de empresas no agrarias en zonas rurales,1.255.000,1.027.307,1.010.853
2025,720007,72300,7709,414202,PEPAC FEADER 23-27. Creación y desarrollo de empresas no agrarias en zonas rurales,1.080.000,1.080.000,1.040.000
2025,720007,72300,7819,412102,PDR FEADER 14-20. Estrategias de desarrollo local participativo,550.000,550.000,506.012
2025,720007,72300,7819,412103,PEPAC FEADER 23-27. Desarrollo local participativo (Leader),4.600.000,4.444.353,4.110.484
