2025,410000,41800,2280,321100,"Gastos de funcionamiento de edificios propios. Energía eléctrica, agua y calefacción",1.087.479,711.519,307.507
2025,410000,41800,2283,321100,Material para reparaciones de edificios propios,31.836,31.836,4.263
2025,410000,41800,6020,325102,Obras de mantenimiento en el departamento,229.500,229.500,144.609
2025,410000,41800,6020,325103,Otras obras del departamento,927.143,127.143,99.093
2025,410000,41800,6040,321100,Adquisición de elementos de transporte,10,10,0
2025,410000,41800,6050,325100,Mobiliario del departamento,40.800,40.800,51.411
2025,410000,41800,6054,325100,Material técnico y equipos para el departamento,10.404,10.404,8.654
2025,410001,41800,1200,321100,Retribuciones del personal fijo,715.450,624.911,579.627
2025,410001,41800,1210,321100,Retribuciones del personal contratado para cubrir plazas reservadas,10,25.386,14.100
2025,410001,41800,1211,321100,Retribuciones del personal contratado para cubrir vacantes,253.732,283.070,267.517
2025,410001,41800,2276,321100,Estudios y trabajos técnicos,57.120,57.120,71.117
2025,410001,41800,6020,325100,Construcción de nuevos centros y obras. Plan de Centros Escolares,2.158.562,2.917.562,2.844.969
2025,410001,41800,6020,325103,Obras para el desarrollo de los centros de Formación Profesional,3.215.165,2.651.165,2.312.013
2025,410001,41800,6020,325104,PRIN25 Obras para el desarrollo de los centros de Formación Profesional,10,3.100.000,2.079.620
2025,410001,41800,6020,325105,PRIN25 Construcción de nuevos centros y obras. Plan de Centros Escolares,10,1.052.000,29.406
2025,410001,41800,6020,325112,Obras de mantenimiento en centros escolares,2.427.600,3.477.600,3.396.204
2025,410001,41800,6020,325136,MRR Obras en centros educativos 0-3,3.375.903,4.442.825,4.442.825
2025,410001,41800,6020,325137,Obras en centros educativos 0-3,204.000,204.000,116.127
2025,410001,41800,6020,325139,Convenio con el Ayto. de Leitza para inversiones en infraestructuras educativas,37.260,0,0
2025,410001,41800,6020,325140,(E) Instalación pavimento vinílico en Frontón CIP Tafalla para uso de frontón como pista de fútbol sala,100.000,100.000,98.415
2025,410001,41800,6059,325100,Equipamiento en centros públicos,2.133.059,1.533.059,1.203.524
2025,410001,41800,7609,325100,Obras en centros educativos de propiedad municipal,1.040.000,1.040.000,982.389
2025,410001,41800,7609,325103,Construcción de nuevos centros y obras. Plan de Centros Escolares,1.564.156,1.619.156,1.498.471
2025,410001,41800,7609,325104,PRIN25 Construcción de nuevos centros y obras. Plan de Centros Escolares,10,3.182.000,1.326.781
2025,410001,41800,7609,325106,Obras en centros educativos 0-3 de propiedad municipal,250.000,250.000,54.521
2025,410001,41800,7609,325107,Convenio con Ayuntamiento de Baztán para la cubierta de la escuela infantil,350.000,350.000,350.000
2025,410001,41800,7609,325108,Convenio con el Ayuntamiento de Lakuntza para la envolvente de la escuela pública,250.000,250.000,250.000
2025,410001,41800,7609,325109,(E) Convenio Ayto. Pamplona para proyectos renaturalización de patios escolares,600.000,600.000,564.562
2025,410001,41800,7609,325110,(E) Convenio Ayto. Goizueta cubierta colegio público,180.000,180.000,180.000
2025,410001,41800,7609,325111,(E) Transf. Ayto. Cárcar. Creación de dos unidades de 1º ciclo de Educación Infantil en CPEIP Virgen de Gracia,150.000,150.000,150.000
2025,410001,41800,7609,325112,(E) Transf. Ayto. Lodosa. Fachada colegio público,60.000,60.000,60.000
2025,410001,41800,7609,325113,(E) Transf. Ayto. Villatuerta. Construcción de comedor público en el colegio San Veremundo,40.000,40.000,40.000
2025,410001,41800,7609,325114,Convenio con el Ayto. de Leitza para inversiones en infraestructuras educativas,0,37.260,37.260
2025,410001,41800,7609,325116,(E) Transf. Ayto. Azagra. Mejora y remodelación del Centro de Educación Infantil,20.000,20.000,16.815
2025,410001,41800,7609,325117,(E) Convenio Ayto. Corella para climatización 8 aulas en colegio público,20.000,20.000,20.000
2025,410001,41800,7609,325118,(E) Convenio Ayuntamiento de Tafalla. Mejoras CPEIP Marqués de la Real Defensa,18.150,18.150,17.727
2025,410001,41800,7609,325119,(E) Transf. Ayto. Fustiñana. Sustitución puertas de acceso colegio público Santos Justo y Pastor,15.000,15.000,13.467
2025,410001,41800,7609,325120,(E) Transferencia Ayto. de Los Arcos para rehabilitación escaleras zona recreo en el colegio público,12.000,12.000,12.000
2025,410001,41800,7609,325121,(E) Convenio Ayuntamiento Berriozar para mejoras del CPEIP Mendialdea I y II,22.500,22.500,22.500
2025,410001,41800,7609,325122,(E) Transf. Ayto. Berriozar. Cubiertas colegio Mendialdea fase 4,75.000,75.000,75.000
2025,410001,41800,7609,325123,(E) Transf. Ayto. Berrioplano. Mobiliario aula psicomotricidad Escuela Infantil Nueva Artica,30.000,30.000,18.685
2025,410001,41800,7609,325124,(E) Convenio con el Ayuntamiento de Aibar para obras en la Escuela Infantil,65.000,65.000,65.000
2025,410001,41800,7609,325125,(E) Convenio Ayuntamiento de Pamplona Escuela San  Francisco,80.000,80.000,79.990
2025,410001,41800,7609,325126,(E) Convenio con Ayto. Lekunberri y Ayto. Larraun para inversiones en colegio público CPEIP Lekunberri Ibarberri HLHIP,160.000,160.000,160.000
2025,410001,41800,7609,325127,(E) Transf. Ayto. Fitero. Iluminación patio Colegio Público Juan de Palafox,30.000,30.000,30.000
2025,410001,41800,7609,325153,MRR Obras en centros educativos 0-3 de propiedad municipal,640.000,2.916.755,1.357.581
2025,410003,41600,4811,322100,2º Ciclo de Educación Infantil. Centros privados concertados y/o subvencionados,22.670.375,22.620.375,22.219.913
2025,410003,41600,4811,322200,1º Ciclo de Educación Secundaria.  Centros privados concertados y/o subvencionados,22.445.810,22.995.810,22.646.654
2025,410003,41600,4811,322202,2º Ciclo de Educación Secundaria. Centros privados concertados y/o subvencionados,25.787.464,27.637.464,27.298.853
2025,410003,41600,4811,322400,Educación Especial. Centros privados concertados y/o subvencionados,9.583.303,9.283.303,8.831.836
2025,410003,41600,4811,322402,Necesidades educativas específicas. Centros privados concertados y/o subvencionados,6.012.549,6.012.549,5.697.613
2025,410003,41600,4811,322403,Inmigración y minorías culturales. Centros privados concertados y/o subvencionados,848.885,898.885,851.873
2025,410003,41600,4811,322C00,Bachillerato. Centros privados concertados y/o subvencionados,13.919.596,13.119.596,12.700.061
2025,410003,41600,4811,322D00,Educación Primaria. Centros privados concertados y/o subvencionados,57.802.794,58.002.794,57.421.704
2025,410003,41600,4811,322D02,Atención al alumnado con dificultades de escolarización,1.402.025,1.402.025,1.182.655
2025,410003,41600,4811,322E00,Ciclos formativos de grado básico y medio,10.117.942,8.917.942,8.406.998
2025,410003,41600,4811,322E02,Ciclos formativos de grado superior. Centros privados concertados y/o subvencionados,5.261.249,4.961.249,4.571.266
2025,410005,41400,1200,321100,Retribuciones del personal fijo,247.976,297.471,283.691
2025,410005,41400,1210,321100,Retribuciones del personal contratado para cubrir plazas reservadas,10,8.918,8.877
2025,410005,41400,1211,321100,Retribuciones del personal contratado para cubrir vacantes,209.781,168.233,145.317
2025,410005,41400,2267,322000,Gastos de oposiciones,211.740,211.740,177.219
2025,410005,41400,2301,322000,Locomoción y gastos de viaje. Tribunales oposición,697.500,697.500,350.698
2025,410005,41400,2330,322000,Indemnización por trabajos realizados en tribunales,3.106.642,1.900.122,1.073.802
2025,410005,41500,1200,321100,Retribuciones del personal fijo,368.239,447.261,428.378
2025,410005,41500,1210,321100,Retribuciones del personal contratado para cubrir plazas reservadas,17.761,38.551,14.236
2025,410005,41500,1211,321100,Retribuciones del personal contratado para cubrir vacantes,262.149,240.046,236.710
2025,410005,41700,1200,321100,Retribuciones del personal fijo,255.405,317.402,308.035
2025,410005,41700,1210,321100,Retribuciones del personal contratado para cubrir plazas reservadas,10,8.460,6.741
2025,410005,41700,1211,321100,Retribuciones del personal contratado para cubrir vacantes,261.938,175.642,148.588
2025,410005,41700,4819,321100,Compensación de gastos de funcionamiento de organizaciones sindicales,39.117,39.117,39.117
2025,420000,42000,1000,321100,Retribuciones de altos cargos,66.164,68.154,68.150
2025,420000,42000,1200,321100,Retribuciones del personal fijo,138.922,197.608,186.524
2025,420000,42000,1210,321100,Retribuciones del personal contratado para cubrir plazas reservadas,10,0,0
2025,420000,42000,1211,321100,Retribuciones del personal contratado para cubrir vacantes,10,0,0
2025,420000,42000,2269,321100,Gastos diversos,4.000,4.000,689
2025,420000,42000,2301,321100,Locomoción y gastos de viaje del personal funcionario y contratado,105.000,105.000,161.853
2025,420000,42000,4400,322G00,NICDO: Campaña escolar de esquí,60.000,60.000,60.000
2025,420000,42000,4709,322G00,Campañas escolares de actividades en la naturaleza,50.000,50.000,50.000
2025,420000,42000,4709,322G02,Actividades de iniciación deportiva dirigida a centros educativos,5.000,5.000,0
2025,420000,42000,4819,322G00,Campaña escolar de vela. Federación Navarra de Vela,65.000,65.000,65.000
2025,420001,42400,1200,322900,Retribuciones del personal fijo,984.743,998.017,966.331
2025,420001,42400,1210,322900,Retribuciones del personal contratado para cubrir plazas reservadas,11.063,11.395,11.394
2025,420001,42400,1211,322900,Retribuciones del personal contratado para cubrir vacantes,53.278,55.008,55.004
2025,420001,42400,2120,322500,"Ciudad de la Música: Mantenimiento, reparación y conservación del edificio",50.000,50.000,51.850
2025,420001,42400,2150,322500,Ciudad de la Música: Mantenimiento instrumentos y sistemas de sonido,20.000,20.000,19.999
2025,420001,42400,2200,322500,Ciudad de la Música: Material de oficina,10.000,10.000,10.092
2025,420001,42400,2202,322002,Recursos didácticos,35.000,35.000,35.000
2025,420001,42400,2266,321203,Formación del profesorado en euskera,40.000,40.000,10.165
2025,420001,42400,2266,321205,Formación del profesorado en enseñanzas artísticas y musicales,8.000,8.000,11.509
2025,420001,42400,2266,321206,Jornadas y ferias de lenguas extranjeras,9.000,9.000,5.859
2025,420001,42400,2266,322500,Ciudad de la Música: Congreso pop y jazz,30.000,30.000,29.208
2025,420001,42400,2266,322906,Formación del profesorado en idiomas,110.000,110.000,49.078
2025,420001,42400,2267,322502,Pruebas de acceso a los estudios superiores de diseño,1.500,1.500,687
2025,420001,42400,2269,322002,Elaboración materiales didácticos,5.000,5.000,0
2025,420001,42400,2269,322003,Programa ERASMUS+.SEPIE. Promoción y otros programas europeos,11.000,11.000,7.842
2025,420001,42400,2269,322004,Financiación olimpiadas escolares,750,750,750
2025,420001,42400,2269,322005,Programa ERASMUS+. SEPIE. Gastos de funcionamiento,10,2.792,828
2025,420001,42400,2269,322500,Ciudad de la Música: Gastos diversos,107.000,107.000,115.988
2025,420001,42400,2269,322502,Conciertos didácticos,30.000,30.000,19.007
2025,420001,42400,2269,322900,Programas de uso del euskera,557.000,557.000,415.971
2025,420001,42400,2269,322904,"Exámenes EGA, títulos y gastos de funcionamiento",12.000,12.000,10.697
2025,420001,42400,2269,322905,Encargo a CNAI. Programas y formación,1.620.000,1.620.000,1.711.929
2025,420001,42400,2273,322500,Ciudad de la Música: Mantenimiento sistemas informáticos,10.000,10.000,13.980
2025,420001,42400,2279,322500,Ciudad de la Música: Otros trabajos realizados por terceros,45.000,45.000,41.601
2025,420001,42400,2280,322500,"Ciudad de la Música: Energía eléctrica, agua y calefacción",320.000,320.000,173.093
2025,420001,42400,2330,322900,Indemnizaciones por trabajos realizados en tribunales,60.000,60.000,52.340
2025,420001,42400,2330,322902,Pruebas certificativas,10.000,10.000,9.208
2025,420001,42400,4609,322502,Subvención a escuelas de música,3.400.000,3.400.000,3.398.047
2025,420001,42400,4609,322503,Convenio con el Ayuntamiento de Tudela para el funcionamiento del Conservatorio Municipal de Música,500.000,500.000,500.000
2025,420001,42400,4800,322500,Ayudas complementarias a la movilidad internacional del alumnado de Enseñanzas Artísticas Superiores,6.000,6.000,3.334
2025,420001,42400,4809,321200,Ayuda para la formación del profesorado en euskera,20.000,20.000,12.312
2025,420001,42400,4809,321202,Ayudas para la formación del profesorado en lenguas extranjeras,40.000,40.000,35.234
2025,420001,42400,4809,322000,Programa ERASMUS+. SEPIE,10,116.161,116.019
2025,420001,42400,4816,322002,Subvención actividades extraescolares culturales en euskera,20.000,20.000,19.518
2025,420001,42400,4816,322500,Escuela Navarra de Teatro,45.000,45.000,45.000
2025,420001,42400,4819,322902,"Convenio con ""Bertsozale Elkartea"" para trabajar la oralidad en las aulas",20.000,20.000,20.000
2025,420001,42400,6020,322500,Ciudad de la Música: Adecuación edificio,10.270,10.270,10.253
2025,420001,42400,6050,322500,Ciudad de la Música: mobiliario y equipo de oficina,10.270,10.270,9.132
2025,420001,42400,6059,322500,Ciudad de la Música: adquisición de instrumentos musicales,65.620,65.620,65.584
2025,420001,42400,6081,322500,Ciudad de la Música: Adquisición de libros,3.081,3.081,3.081
2025,420002,42100,1200,321100,Retribuciones del personal fijo,510.406,525.742,525.502
2025,420002,42100,1200,321200,MRR CompDigEdu Retribuciones del personal fijo,348.128,442.904,442.665
2025,420002,42100,1210,321100,Retribuciones del personal contratado para cubrir plazas reservadas,10,0,0
2025,420002,42100,1210,321200,MRR CompDigEdu Retribuciones del personal contratado para cubrir plazas reservadas,10,12,0
2025,420002,42100,1211,321100,Retribuciones del personal contratado para cubrir vacantes,53.278,54.883,50.879
2025,420002,42100,1220,321200,MRR CompDigEdu Retribuciones del personal contratado temporal,10,12,0
2025,420002,42100,1250,321200,MRR CompDigEdu Retribuciones del personal contratado para sustituciones,10,12,0
2025,420002,42100,1400,321200,MRR CompDigEdu Retribuciones personales,88.339,69.484,58.434
2025,420002,42100,1600,321200,MRR CompDigEdu Seguridad Social,162.541,102.633,56.851
2025,420002,42100,2266,321200,Actividades formativas del profesorado,500.000,500.000,487.915
2025,420002,42100,2266,321203,Actividades formativas del personal CAP,5.100,5.100,4.621
2025,420002,42100,2266,321204,MRR Actividades formativas del profesorado,101.746,93.731,0
2025,420002,42100,2269,322000,Expedición de títulos y edición de libros de escolaridad,40.000,40.000,19.145
2025,420002,42100,2269,322003,Calidad,41.920,41.920,29.334
2025,420002,42100,2269,322004,Programas formativos y proyectos de innovación en centros públicos,125.000,125.000,117.075
2025,420002,42100,2269,322005,MRR CompDigEdu Gastos diversos,39.874,46.865,0
2025,420002,42100,2269,322700,Centros de adultos y aulas itinerantes,87.791,87.791,87.802
2025,420002,42100,2269,322702,Gastos de los cursos en las Aulas Mentor,10,936,1.469
2025,420002,42100,2273,322000,MRR CompDigEdu Servicios y consultoría,0,55.792,0
2025,420002,42100,2279,322D00,Itinerarios culturales por Navarra,20.000,20.000,18.150
2025,420002,42100,2290,321200,Gastos de funcionamiento de centros de apoyo al profesorado,98.430,98.430,98.430
2025,420002,42100,2301,321200,MRR CompDigEdu Locomoción y gastos de viaje,9.756,26.912,15.380
2025,420002,42100,4809,321200,Ayudas individuales para la formación del profesorado,20.000,20.000,12.534
2025,420002,42100,4811,322000,Programas formativos y proyectos de innovación en centros concertados,45.000,45.000,23.335
2025,420002,42100,6054,321200,Adquisición de material para actividades formativas,11.297,11.297,10.936
2025,420004,42700,1200,321100,Retribuciones del personal fijo,3.353.683,4.097.776,3.990.203
2025,420004,42700,1200,322006,PROA FSE+ Retribuciones del personal fijo,10,0,0
2025,420004,42700,1200,322007,Comp. Lectora Retribuciones del personal fijo,10,0,0
2025,420004,42700,1200,322008,Comp. Matemática Retribuciones del personal fijo,10,0,0
2025,420004,42700,1210,321100,Retribuciones del personal contratado para cubrir plazas reservadas,10,78.116,73.608
2025,420004,42700,1210,322006,PROA FSE+ Retribuciones del personal contratado para cubrir plazas reservadas,10,0,0
2025,420004,42700,1210,322007,Comp. Lectora Retribuciones del personal contratado para cubrir plazas reservadas,10,0,0
2025,420004,42700,1210,322008,Comp. Matemática Retribuciones del personal contratado para cubrir plazas reservadas,10,0,0
2025,420004,42700,1211,321100,Retribuciones del personal contratado para cubrir vacantes,139.415,63.100,63.041
2025,420004,42700,1211,322006,PROA FSE+ Retribuciones del personal contratado para cubrir vacantes,10,12,0
2025,420004,42700,1211,322007,Comp. Lectora Retribuciones del personal contratado para cubrir vacantes,10,0,0
2025,420004,42700,1211,322008,Comp. Matemática Retribuciones del personal contratado para cubrir vacantes,10,0,0
2025,420004,42700,1220,322006,PROA FSE+ Retribuciones del personal contratado temporal,10,12,0
2025,420004,42700,1220,322007,Comp. Lectora Retribuciones del personal contratado temporal,10,12,0
2025,420004,42700,1220,322008,Comp. Matemática Retribuciones del personal contratado temporal,10,12,0
2025,420004,42700,1250,322006,PROA FSE+ Retribuciones del personal contratado para sustituciones,10,12,0
2025,420004,42700,1250,322007,Comp. Lectora Retribuciones del personal contratado para sustituciones,10,12,0
2025,420004,42700,1250,322008,Comp. Matemática Retribuciones del personal contratado para sustituciones,10,12,0
2025,420004,42700,1400,322006,PROA FSE+ Retribuciones personales,10,12,0
2025,420004,42700,1400,322007,Comp. Lectora Retribuciones personales,10,12,0
2025,420004,42700,1400,322008,Comp. Matemática Retribuciones personales,10,12,0
2025,420004,42700,1600,322006,PROA FSE+ Seguridad Social,10,43.369,42.983
2025,420004,42700,1600,322007,Comp. Lectora Seguridad Social,10,11,0
2025,420004,42700,1600,322008,Comp. Matemática Seguridad Social,10,11,0
2025,420004,42700,2269,321200,Convivencia,138.853,138.853,120.852
2025,420004,42700,2269,321202,Coeducación e igualdad de género,454.120,454.120,196.900
2025,420004,42700,2269,322400,Plan de Atención Diversidad. Acciones de compensación educativa a centros públicos alumnado desfavorecido,1.203.000,1.203.000,1.203.000
2025,420004,42700,2269,322402,Financiación de actividades para la integración socioeducativa de inmigrantes y minorías socioculturales,65.000,65.000,7.989
2025,420004,42700,2400,322400,Elaboración material guías para centros,24.825,24.825,1.839
2025,420004,42700,2400,322402,Adquisición y reposición de material especializado,28.000,28.000,0
2025,420004,42700,4301,322000,Convenio Fundación Ilundain Haritz-Berri Programa Educar para prevenir adicciones en Centros Educativos de Navarra,75.000,75.000,75.000
2025,420004,42700,4309,322400,"Fundación Secretariado Gitano: programa ""promociona""",55.000,55.000,55.000
2025,420004,42700,4609,322400,Subvención para actividades de integración socioeducativa,680.000,680.000,610.534
2025,420004,42700,4809,322400,Ayudas a la educación especial,575.000,575.000,407.860
2025,420004,42700,4809,322402,Ayudas para escuela de vacaciones para alumnado con discapacidades,100.000,100.000,69.162
2025,420004,42700,4809,322403,Ayudas al alumnado de centros concertados para inmigración y minorías culturales,550.000,550.000,483.944
2025,420004,42700,4811,322400,Subvención a centros privados concertados de educación especial,35.100,35.100,35.100
2025,420004,42700,4811,322402,Convenio con CEE Ibero Isterria. Funcionamiento centro escolar,30.000,30.000,30.000
2025,420004,42700,4819,324200,Subvención a asociaciones y federaciones de padres y alumnos,65.000,65.000,62.000
2025,420004,42700,6059,322400,Dotación al Centro de Recursos para la Equidad Educativa en Navarra (CREENA),56.485,56.485,14.091
2025,420004,42700,6081,321100,Materiales y fondos coeducativos,33.457,33.457,33.373
2025,420005,42800,1200,321100,Retribuciones del personal fijo,2.012.543,2.065.844,2.065.810
2025,420005,42800,1210,321100,Retribuciones del personal contratado para cubrir plazas reservadas,26.639,11.214,7.305
2025,420005,42800,1211,321100,Retribuciones del personal contratado para cubrir vacantes,53.278,68.895,68.892
2025,420005,42800,2266,321100,Cursos de formación para el Servicio de Inspección Educativa,6.000,6.000,488
2025,420005,42800,2269,321100,Documentación,1.350,1.350,772
2025,420005,42800,2276,321100,"Evaluación del alumnado, de centros, de programas y del sistema educativo",200.000,200.000,157.740
2025,420005,42800,4800,321100,Premios y certámenes,2.750,2.750,750
2025,420005,42800,4809,322000,Programa ERASMUS+. SEPIE,0,14.638,8.325
2025,420007,42900,1200,322100,Retribuciones del personal fijo,372.004,271.874,209.388
2025,420007,42900,1200,322102,MRR 0-3 Retribuciones del personal fijo,10,1.214.009,1.173.768
2025,420007,42900,1210,322100,Retribuciones del personal contratado para cubrir plazas reservadas,10,0,0
2025,420007,42900,1210,322102,MRR 0-3 Retribuciones del personal contratado para cubrir plazas reservadas,10,103.022,80.863
2025,420007,42900,1211,322100,Retribuciones del personal contratado para cubrir vacantes,64.190,66.119,66.116
2025,420007,42900,1211,322102,MRR 0-3 Retribuciones del personal contratado para cubrir vacantes,10,943.006,942.182
2025,420007,42900,1220,322102,MRR 0-3 Retribuciones del personal contratado temporal,10,12,0
2025,420007,42900,1250,322102,MRR 0-3 Retribuciones del personal contratado para sustituciones,10,376.398,371.149
2025,420007,42900,1400,322102,MRR 0-3 Retribuciones personales,10,309.920,305.261
2025,420007,42900,1600,322102,MRR 0-3 Seguridad Social,10,771.097,636.843
2025,420007,42900,2200,322100,Material de oficina,10.314,10.314,10.801
2025,420007,42900,2210,322100,Alimentación,244.680,244.680,225.462
2025,420007,42900,2214,322100,Material de cocina,11.414,11.414,5.351
2025,420007,42900,2215,322100,Fármacos y asistencia sanitaria,5.419,5.419,3.412
2025,420007,42900,2219,322100,Material didáctico,29.470,29.470,27.294
2025,420007,42900,2269,322102,Desarrollo de la red de escuelas rurales,5.100,5.100,169
2025,420007,42900,2269,322103,Gastos diversos,5.780,5.780,3.470
2025,420007,42900,2285,322100,"Vestuario, calzado y material textil",25.278,25.278,19.262
2025,420007,42900,4609,322100,Convenios con ayuntamientos para la escolarización de 0 a 3 años,29.038.538,29.038.538,29.032.876
2025,430000,43000,1000,322E00,Retribuciones de altos cargos,66.164,68.154,68.150
2025,430000,43000,1200,322E00,Retribuciones del personal fijo,59.205,71.249,71.248
2025,430000,43000,1210,322E00,Retribuciones del personal contratado para cubrir plazas reservadas,10,0,0
2025,430000,43000,1211,322E00,Retribuciones del personal contratado para cubrir vacantes,9.524,77,0
2025,430000,43000,2269,321100,Gastos diversos,3.500,3.500,16.655
2025,430000,43000,2301,321100,Locomoción y gastos de viaje del personal funcionario y contratado,56.267,56.267,21.360
2025,430000,43500,1200,321100,Retribuciones del personal fijo,421.208,430.057,422.875
2025,430000,43500,1210,321100,Retribuciones del personal contratado para cubrir plazas reservadas,26.649,50.155,48.274
2025,430000,43500,1211,321100,Retribuciones del personal contratado para cubrir vacantes,105.276,93.229,93.225
2025,430001,43100,1200,322E00,Retribuciones del personal fijo,601.500,671.574,512.134
2025,430001,43100,1200,322E03,MRR Creación de ciclos bilingües Retribuciones del personal fijo,10,492.447,491.085
2025,430001,43100,1200,322E04,MRR Redim oferta FP Retribuciones del personal fijo,10,294.384,186.674
2025,430001,43100,1200,322E05,Conferencia Sectorial. Retribuciones del personal fijo,10,512.282,511.919
2025,430001,43100,1210,322E00,Retribuciones del personal contratado para cubrir plazas reservadas,10,13.488,13.487
2025,430001,43100,1210,322E03,MRR Creación de ciclos bilingües Retribuciones del personal contratado para cubrir plazas reservadas,10,91.988,90.292
2025,430001,43100,1210,322E04,MRR Redim oferta FP Retribuciones del personal contratado para cubrir plazas reservadas,10,42.891,32.907
2025,430001,43100,1210,322E05,Conferencia Sectorial. Retribuciones del personal contratado para cubrir plazas reservadas,10,0,0
2025,430001,43100,1211,322E00,Retribuciones del personal contratado para cubrir vacantes,131.953,117.162,89.337
2025,430001,43100,1211,322E05,Conferencia Sectorial. Retribuciones del personal contratado para cubrir vacantes,10,0,0
2025,430001,43100,1220,322E03,MRR Creación de ciclos bilingües Retribuciones del personal contratado temporal,10,1.398.673,1.398.462
2025,430001,43100,1220,322E04,MRR Redim oferta FP Retribuciones del personal contratado temporal,1.142.949,634.327,529.631
2025,430001,43100,1220,322E05,Conferencia Sectorial. Retribuciones del personal contratado temporal,10,322.880,320.393
2025,430001,43100,1221,322E04,MRR Redim oferta FP Retribuciones del personal contratado para campañas,10,24.132,23.951
2025,430001,43100,1250,322E03,MRR Creación de ciclos bilingües Retribuciones del personal contratado para sustituciones,10,152.236,151.240
2025,430001,43100,1250,322E04,MRR Redim oferta FP Retribuciones del personal contratado para sustituciones,10,113.247,85.736
2025,430001,43100,1250,322E05,Conferencia Sectorial. Retribuciones del personal contratado para sustituciones,10,9.061,1.659
2025,430001,43100,1400,322E03,MRR Creación de ciclos bilingües Retribuciones personales,10,128.405,124.050
2025,430001,43100,1400,322E04,MRR Redim oferta FP Retribuciones personales,10,68.599,43.396
2025,430001,43100,1400,322E05,Conferencia Sectorial. Retribuciones personales,10,136.217,135.737
2025,430001,43100,1600,322E03,MRR Creación de ciclos bilingües Seguridad Social,10,719.754,718.568
2025,430001,43100,1600,322E04,MRR Redim oferta FP Seguridad Social,377.207,381.138,352.546
